number,value,datetime_start,datetime_complete,duration,params_activation,params_batch_size,params_dropout_rate,params_embedding_dim,params_epochs,params_learning_rate,params_n_hidden_layers,params_units_per_layer,params_use_dropout,state
1355,2.5666024684906006,2025-01-28 12:25:40.612785,2025-01-28 12:25:44.064814,0 days 00:00:03.452029,softplus,256,,4,90,0.001998284180140464,4,512,False,PRUNED
1356,2.8158979415893555,2025-01-28 12:25:44.081890,2025-01-28 12:25:48.400137,0 days 00:00:04.318247,tanh,256,,4,80,0.0003579237579280635,4,496,False,PRUNED
1357,2.6518301963806152,2025-01-28 12:25:48.419112,2025-01-28 12:25:52.040672,0 days 00:00:03.621560,softplus,256,,8,90,0.00010190585671812798,4,496,False,PRUNED
1358,4.375638484954834,2025-01-28 12:25:52.059025,2025-01-28 12:25:54.104688,0 days 00:00:02.045663,softplus,1024,,4,10,0.002566469853478312,4,512,False,PRUNED
1359,2.838291883468628,2025-01-28 12:25:54.122894,2025-01-28 12:25:56.588702,0 days 00:00:02.465808,softplus,256,,4,90,0.00011362917211080879,4,512,False,PRUNED
1360,68.83336639404297,2025-01-28 12:25:56.607379,2025-01-28 12:26:01.130052,0 days 00:00:04.522673,relu,256,0.30000000000000004,16,90,0.00010193804785220355,3,224,True,PRUNED
1361,2.889785051345825,2025-01-28 12:26:01.148520,2025-01-28 12:26:04.384164,0 days 00:00:03.235644,softplus,128,,4,80,0.007540296097009028,4,496,False,PRUNED
1362,2.7989695072174072,2025-01-28 12:26:04.402823,2025-01-28 12:26:07.355232,0 days 00:00:02.952409,softplus,256,,2,90,0.0004055775315222053,4,512,False,PRUNED
1363,2.5487916469573975,2025-01-28 12:26:07.373355,2025-01-28 12:26:10.803300,0 days 00:00:03.429945,softplus,256,,4,90,0.00012202535654440085,4,512,False,PRUNED
1364,2.5599417686462402,2025-01-28 12:26:10.820895,2025-01-28 12:26:14.048121,0 days 00:00:03.227226,softplus,256,,4,100,0.002958655834165855,2,496,False,PRUNED
1365,2.769254446029663,2025-01-28 12:26:14.065087,2025-01-28 12:26:16.655637,0 days 00:00:02.590550,selu,256,,4,90,0.0004787264389736492,4,480,False,PRUNED
1366,2.7090935707092285,2025-01-28 12:26:16.673690,2025-01-28 12:26:20.128579,0 days 00:00:03.454889,softplus,256,,8,80,0.00011377783058499094,3,512,False,PRUNED
1367,2.971761703491211,2025-01-28 12:26:20.146525,2025-01-28 12:26:23.062020,0 days 00:00:02.915495,softplus,256,,4,90,0.0006280846697278303,4,464,False,PRUNED
1368,2.798769950866699,2025-01-28 12:26:23.081523,2025-01-28 12:26:26.034572,0 days 00:00:02.953049,softplus,256,,64,90,0.00010171571038625013,4,512,False,PRUNED
1369,2.859527111053467,2025-01-28 12:26:26.053205,2025-01-28 12:26:29.132068,0 days 00:00:03.078863,softplus,128,,4,80,0.00010208974173894024,4,496,False,PRUNED
1370,2.721585512161255,2025-01-28 12:26:29.149594,2025-01-28 12:26:32.633131,0 days 00:00:03.483537,gelu,256,,4,90,0.00014264810026510912,4,496,False,PRUNED
1371,2.8342597484588623,2025-01-28 12:26:32.650024,2025-01-28 12:26:35.407700,0 days 00:00:02.757676,softplus,256,,4,90,0.00010175601874582616,4,192,False,PRUNED
1372,3.1669623851776123,2025-01-28 12:26:35.427320,2025-01-28 12:26:37.659555,0 days 00:00:02.232235,softplus,256,,4,100,0.00011266704703998871,3,512,False,PRUNED
1373,2.82246732711792,2025-01-28 12:33:52.697660,2025-01-28 12:33:55.477464,0 days 00:00:02.779804,softplus,512,,8,90,0.00010174638765603525,4,480,False,PRUNED
1374,2.8262298107147217,2025-01-28 12:33:55.485866,2025-01-28 12:34:00.532736,0 days 00:00:05.046870,relu,256,,4,80,0.0001325445312207788,4,512,False,PRUNED
1375,2.9185311794281006,2025-01-28 12:34:00.549975,2025-01-28 12:34:02.959887,0 days 00:00:02.409912,selu,256,,4,90,0.0015538551566982837,3,512,False,PRUNED
1376,2.5208675861358643,2025-01-28 12:34:02.977680,2025-01-28 12:34:07.041520,0 days 00:00:04.063840,softplus,256,,32,90,0.00015509020136410208,4,496,False,PRUNED
1377,3.783572196960449,2025-01-28 12:34:07.058185,2025-01-28 12:34:09.476202,0 days 00:00:02.418017,softplus,256,,4,80,0.0001017784117548652,4,496,False,PRUNED
1378,2.8966314792633057,2025-01-28 12:34:09.494071,2025-01-28 12:34:12.402633,0 days 00:00:02.908562,softplus,256,,4,90,0.006191526336554749,5,512,False,PRUNED
1379,2.939009189605713,2025-01-28 12:34:12.423412,2025-01-28 12:34:15.777896,0 days 00:00:03.354484,softplus,128,,4,100,0.00467206645092633,4,512,False,PRUNED
1380,12.804847717285156,2025-01-28 12:34:15.794413,2025-01-28 12:34:19.562111,0 days 00:00:03.767698,softplus,256,0.2,4,90,0.0004360380648572661,4,496,True,PRUNED
1381,3.019299268722534,2025-01-28 12:34:19.579676,2025-01-28 12:34:24.309163,0 days 00:00:04.729487,tanh,256,,8,90,0.000251641861626432,4,512,False,PRUNED
1382,2.8894355297088623,2025-01-28 12:34:24.327172,2025-01-28 12:34:26.802702,0 days 00:00:02.475530,softplus,1024,,4,90,0.00010191339229466309,4,480,False,PRUNED
1383,2.8956470489501953,2025-01-28 12:34:26.822148,2025-01-28 12:34:29.283756,0 days 00:00:02.461608,softplus,256,,4,80,0.004099503569178819,4,512,False,PRUNED
1384,2.7815380096435547,2025-01-28 12:34:29.301899,2025-01-28 12:34:31.881737,0 days 00:00:02.579838,selu,256,,4,90,0.0001238018678509009,4,496,False,PRUNED
1385,3.4268758296966553,2025-01-28 12:34:31.898581,2025-01-28 12:34:34.236389,0 days 00:00:02.337808,softplus,256,,4,90,0.00011360978090472244,3,496,False,PRUNED
1386,2.813631057739258,2025-01-28 12:34:34.254777,2025-01-28 12:34:36.837025,0 days 00:00:02.582248,softplus,256,,4,90,0.0022221938190131224,4,512,False,PRUNED
1387,3.488856792449951,2025-01-28 12:34:36.854878,2025-01-28 12:34:39.179358,0 days 00:00:02.324480,softplus,256,,4,100,0.0001839431942497035,4,496,False,PRUNED
1388,3.052128791809082,2025-01-28 12:34:39.195974,2025-01-28 12:34:44.587632,0 days 00:00:05.391658,relu,128,,16,80,0.00010188937001442569,4,512,False,PRUNED
1389,2.8042490482330322,2025-01-28 12:34:44.605710,2025-01-28 12:34:47.122286,0 days 00:00:02.516576,softplus,256,,8,90,0.008413780687025007,4,464,False,PRUNED
1390,2.886638879776001,2025-01-28 12:34:47.140926,2025-01-28 12:34:49.889738,0 days 00:00:02.748812,softplus,256,,4,90,0.00010213195902751806,4,480,False,PRUNED
1391,2.710491418838501,2025-01-28 12:34:49.907508,2025-01-28 12:34:53.346163,0 days 00:00:03.438655,softplus,256,,2,90,0.0002785610464983478,3,512,False,PRUNED
1392,2.7508504390716553,2025-01-28 12:34:53.363454,2025-01-28 12:34:56.763978,0 days 00:00:03.400524,softplus,256,,4,80,0.0002153725817055667,4,496,False,PRUNED
1393,2.7691662311553955,2025-01-28 12:34:56.781012,2025-01-28 12:34:59.242680,0 days 00:00:02.461668,selu,256,,4,90,0.00010178273904560642,4,512,False,PRUNED
1394,3.095538854598999,2025-01-28 12:34:59.259384,2025-01-28 12:35:01.887712,0 days 00:00:02.628328,softplus,256,,4,90,0.0001019824148808965,4,496,False,PRUNED
1395,2.9859848022460938,2025-01-28 12:35:01.905980,2025-01-28 12:35:04.532764,0 days 00:00:02.626784,softplus,512,,64,100,0.00023414050839376364,4,512,False,PRUNED
1396,2.7787394523620605,2025-01-28 12:35:04.549874,2025-01-28 12:35:07.075280,0 days 00:00:02.525406,gelu,256,,4,90,0.00010188464186793856,3,512,False,PRUNED
1397,3.3611788749694824,2025-01-28 12:35:07.091759,2025-01-28 12:35:09.664542,0 days 00:00:02.572783,softplus,256,,8,80,0.005570285382292772,4,496,False,PRUNED
1398,3.1981005668640137,2025-01-28 12:35:09.681782,2025-01-28 12:35:13.021591,0 days 00:00:03.339809,softplus,128,,4,90,0.00012381816762789918,4,496,False,PRUNED
1399,48.67867660522461,2025-01-28 12:35:13.039093,2025-01-28 12:35:17.039921,0 days 00:00:04.000828,softplus,256,0.5,4,90,0.00016453580421560383,4,512,True,PRUNED
1400,4.813305377960205,2025-01-28 12:35:17.057604,2025-01-28 12:35:19.450067,0 days 00:00:02.392463,softplus,256,,4,80,0.00031638670605133626,4,496,False,PRUNED
1401,2.9065980911254883,2025-01-28 12:35:19.467722,2025-01-28 12:35:22.790737,0 days 00:00:03.323015,softplus,256,,4,90,0.00011309408194841161,3,480,False,PRUNED
1402,2.5881383419036865,2025-01-28 12:35:22.807105,2025-01-28 12:35:28.684921,0 days 00:00:05.877816,relu,256,,4,90,0.00011470051047206175,4,320,False,PRUNED
1403,2.907829523086548,2025-01-28 12:35:28.703048,2025-01-28 12:35:33.157499,0 days 00:00:04.454451,softplus,256,,32,100,0.0001332956402734906,4,416,False,PRUNED
1404,2.8734710216522217,2025-01-28 12:35:33.175736,2025-01-28 12:35:35.582030,0 days 00:00:02.406294,selu,256,,4,90,0.00010200393820527061,4,512,False,PRUNED
1405,2.869419813156128,2025-01-28 12:35:35.598597,2025-01-28 12:35:38.093265,0 days 00:00:02.494668,softplus,256,,8,90,0.00010194565425254126,4,480,False,PRUNED
1406,3.076967477798462,2025-01-28 12:35:38.111892,2025-01-28 12:35:40.135563,0 days 00:00:02.023671,softplus,1024,,4,80,0.008588541516229453,3,512,False,PRUNED
1407,2.6186232566833496,2025-01-28 12:35:40.154627,2025-01-28 12:35:45.388368,0 days 00:00:05.233741,softplus,128,,4,90,0.00010207553190902805,4,496,False,PRUNED
1408,2.6576521396636963,2025-01-28 12:35:45.406143,2025-01-28 12:35:49.322646,0 days 00:00:03.916503,tanh,256,,4,90,0.000823666053002845,4,512,False,PRUNED
1409,4.125479221343994,2025-01-28 12:35:49.340237,2025-01-28 12:35:51.780070,0 days 00:00:02.439833,softplus,256,,4,90,0.0027630319421666025,4,496,False,PRUNED
1410,2.6392483711242676,2025-01-28 12:35:51.798359,2025-01-28 12:35:55.619688,0 days 00:00:03.821329,softplus,256,,4,100,0.0001463341193932567,4,512,False,PRUNED
1411,2.9472768306732178,2025-01-28 12:35:55.636407,2025-01-28 12:35:58.105164,0 days 00:00:02.468757,softplus,256,,4,80,0.0001133059054384648,4,512,False,PRUNED
1412,2.773495674133301,2025-01-28 12:35:58.124656,2025-01-28 12:36:02.496092,0 days 00:00:04.371436,softplus,256,,8,90,0.0019109432031551435,3,464,False,PRUNED
1413,2.8501551151275635,2025-01-28 12:36:02.514712,2025-01-28 12:36:04.778376,0 days 00:00:02.263664,selu,256,,4,90,0.0005001952515880789,4,496,False,PRUNED
1414,2.5372021198272705,2025-01-28 12:36:04.798060,2025-01-28 12:36:08.655776,0 days 00:00:03.857716,softplus,256,,4,80,0.00034733703106117,4,480,False,PRUNED
1415,3.1604316234588623,2025-01-28 12:36:08.674367,2025-01-28 12:36:12.451835,0 days 00:00:03.777468,softplus,256,,16,90,0.00010190003434888497,4,512,False,PRUNED
1416,2.9378578662872314,2025-01-28 12:36:12.470786,2025-01-28 12:36:18.817327,0 days 00:00:06.346541,relu,128,,4,90,0.0001018428381359562,4,512,False,PRUNED
1417,4.851856231689453,2025-01-28 12:36:18.835383,2025-01-28 12:36:21.244497,0 days 00:00:02.409114,softplus,256,0.4,2,90,0.006261938872529521,1,496,True,PRUNED
1418,2.5374085903167725,2025-01-28 12:36:21.264049,2025-01-28 12:36:24.858405,0 days 00:00:03.594356,softplus,256,,4,100,0.00010187797201430527,3,512,False,PRUNED
1419,2.519690752029419,2025-01-28 12:36:24.875529,2025-01-28 12:36:28.319013,0 days 00:00:03.443484,softplus,256,,4,80,0.0007092510849052523,4,496,False,PRUNED
1420,2.627300500869751,2025-01-28 12:36:28.338761,2025-01-28 12:36:32.070578,0 days 00:00:03.731817,softplus,256,,8,70,0.00012551020506055494,4,512,False,PRUNED
1421,2.830047369003296,2025-01-28 12:36:32.087664,2025-01-28 12:36:34.401604,0 days 00:00:02.313940,gelu,512,,4,90,0.00010187481652956093,4,448,False,PRUNED
1422,2.65762996673584,2025-01-28 12:36:34.419481,2025-01-28 12:36:38.089120,0 days 00:00:03.669639,softplus,256,,4,90,0.00017395352313309407,4,512,False,PRUNED
1423,4.084403991699219,2025-01-28 12:36:38.106798,2025-01-28 12:36:40.542975,0 days 00:00:02.436177,selu,256,,4,90,0.00011308329828203112,4,496,False,PRUNED
1424,2.84833025932312,2025-01-28 12:36:40.562005,2025-01-28 12:36:44.939052,0 days 00:00:04.377047,softplus,256,,64,90,0.00010186080458029657,3,480,False,PRUNED
1425,3.0229198932647705,2025-01-28 12:36:44.956164,2025-01-28 12:36:48.462466,0 days 00:00:03.506302,softplus,128,,4,100,0.004811720850409323,5,512,False,PRUNED
1426,2.5210983753204346,2025-01-28 12:36:48.482092,2025-01-28 12:36:52.258911,0 days 00:00:03.776819,softplus,256,,4,50,0.0009055210536144509,4,496,False,PRUNED
1427,2.619182586669922,2025-01-28 12:36:52.276443,2025-01-28 12:36:55.867652,0 days 00:00:03.591209,softplus,256,,8,80,0.00013967274839428762,4,512,False,PRUNED
1428,2.9921064376831055,2025-01-28 12:36:55.885783,2025-01-28 12:36:58.149961,0 days 00:00:02.264178,softplus,256,,4,90,0.00011410924522769616,4,496,False,PRUNED
1429,2.846911668777466,2025-01-28 12:36:58.169750,2025-01-28 12:37:00.585740,0 days 00:00:02.415990,softplus,256,,4,90,0.003440849389716003,4,480,False,PRUNED
1430,3.057328701019287,2025-01-28 12:37:00.605644,2025-01-28 12:37:05.222192,0 days 00:00:04.616548,relu,1024,,4,80,0.0009805752160069073,3,160,False,PRUNED
1431,2.5480921268463135,2025-01-28 12:37:05.239974,2025-01-28 12:37:09.279075,0 days 00:00:04.039101,softplus,256,,32,90,0.0001222917668450448,4,512,False,PRUNED
1432,2.7031755447387695,2025-01-28 12:37:09.295350,2025-01-28 12:37:12.731560,0 days 00:00:03.436210,selu,256,,4,40,0.002062259915567575,4,496,False,PRUNED
1433,2.6486306190490723,2025-01-28 12:37:12.747967,2025-01-28 12:37:16.387815,0 days 00:00:03.639848,softplus,256,,4,90,0.0010180751815195416,4,512,False,PRUNED
1434,3.0713999271392822,2025-01-28 12:37:16.404336,2025-01-28 12:37:21.416816,0 days 00:00:05.012480,tanh,256,,4,90,0.004917295555458218,4,496,False,PRUNED
1435,2.7748122215270996,2025-01-28 12:37:21.434736,2025-01-28 12:37:24.894693,0 days 00:00:03.459957,softplus,128,,8,80,0.004431802954525494,4,512,False,PRUNED
1436,3.137376546859741,2025-01-28 12:37:24.912936,2025-01-28 12:37:26.991771,0 days 00:00:02.078835,softplus,256,,4,90,0.0012829431162902892,3,496,False,PRUNED
1437,14.707575798034668,2025-01-28 12:37:27.008881,2025-01-28 12:37:30.955437,0 days 00:00:03.946556,softplus,256,0.2,4,100,0.00010185720559204314,4,512,True,PRUNED
1438,2.9103195667266846,2025-01-28 12:37:30.974444,2025-01-28 12:37:33.793626,0 days 00:00:02.819182,softplus,256,,4,90,0.00010196092859082722,4,512,False,PRUNED
1439,2.7007527351379395,2025-01-28 12:37:33.811613,2025-01-28 12:37:37.303947,0 days 00:00:03.492334,softplus,256,,4,90,0.0017040404526962186,4,480,False,PRUNED
1440,2.8074653148651123,2025-01-28 12:37:37.321358,2025-01-28 12:37:40.866665,0 days 00:00:03.545307,softplus,256,,4,80,0.0010908813717786933,4,512,False,PRUNED
1441,2.8910934925079346,2025-01-28 12:37:40.885964,2025-01-28 12:37:43.125971,0 days 00:00:02.240007,softplus,256,,8,90,0.000945625892739833,3,496,False,PRUNED
1442,3.0825157165527344,2025-01-28 12:37:43.144080,2025-01-28 12:37:45.920483,0 days 00:00:02.776403,selu,256,,4,90,0.00011391101688843445,4,512,False,PRUNED
1443,2.5012450218200684,2025-01-28 12:37:45.937546,2025-01-28 12:37:51.580695,0 days 00:00:05.643149,softplus,128,,16,100,0.00010196145721872751,4,496,False,PRUNED
1444,2.8051199913024902,2025-01-28 12:37:51.598521,2025-01-28 12:37:53.697453,0 days 00:00:02.098932,softplus,512,,4,80,0.0006297765538557969,4,496,False,PRUNED
1445,2.8563501834869385,2025-01-28 12:37:53.714218,2025-01-28 12:37:57.863729,0 days 00:00:04.149511,relu,256,,2,90,0.003235144200182551,4,512,False,PRUNED
1446,2.9598517417907715,2025-01-28 12:37:57.879954,2025-01-28 12:38:00.510383,0 days 00:00:02.630429,softplus,256,,4,70,0.0017377795802770532,3,480,False,PRUNED
1447,3.239902973175049,2025-01-28 12:38:00.527917,2025-01-28 12:38:03.315813,0 days 00:00:02.787896,gelu,256,,4,90,0.00015764693663960613,4,512,False,PRUNED
1448,2.835407018661499,2025-01-28 12:38:03.335534,2025-01-28 12:38:05.614250,0 days 00:00:02.278716,softplus,256,,4,90,0.00010160825414847244,4,496,False,PRUNED
1449,2.635241746902466,2025-01-28 12:38:05.633396,2025-01-28 12:38:09.093793,0 days 00:00:03.460397,softplus,256,,4,80,0.0015045812766950255,4,48,False,PRUNED
1450,2.8292620182037354,2025-01-28 12:38:09.111860,2025-01-28 12:38:11.853174,0 days 00:00:02.741314,softplus,256,,8,90,0.0001329727634665601,4,368,False,PRUNED
1451,3.348519802093506,2025-01-28 12:38:11.873358,2025-01-28 12:38:14.894619,0 days 00:00:03.021261,softplus,256,,64,90,0.0011805442036964611,4,512,False,PRUNED
1452,3.9358773231506348,2025-01-28 12:38:14.912617,2025-01-28 12:38:17.146067,0 days 00:00:02.233450,selu,256,,4,100,0.00020078862494546753,3,496,False,PRUNED
1453,2.8857011795043945,2025-01-28 12:38:17.163356,2025-01-28 12:38:20.265586,0 days 00:00:03.102230,softplus,128,,4,90,0.00010201655054506526,4,512,False,PRUNED
1454,9.166267395019531,2025-01-28 12:38:20.285024,2025-01-28 12:38:24.391257,0 days 00:00:04.106233,softplus,256,0.1,4,90,0.00010201046068230865,4,480,True,PRUNED
1455,2.957578420639038,2025-01-28 12:38:24.408393,2025-01-28 12:38:26.824250,0 days 00:00:02.415857,softplus,256,,4,90,0.0008111284671010212,4,512,False,PRUNED
1456,2.9816927909851074,2025-01-28 12:38:26.843610,2025-01-28 12:38:28.434972,0 days 00:00:01.591362,softplus,1024,,4,80,0.004313378389878665,2,496,False,PRUNED
1457,2.6003105640411377,2025-01-28 12:38:28.453747,2025-01-28 12:38:31.986707,0 days 00:00:03.532960,softplus,256,,4,90,0.00011457126588972817,4,464,False,PRUNED
1458,3.1242334842681885,2025-01-28 12:38:32.003951,2025-01-28 12:38:36.967382,0 days 00:00:04.963431,relu,256,,8,90,0.00030373501417955246,3,480,False,PRUNED
1459,2.5048019886016846,2025-01-28 12:38:36.985511,2025-01-28 12:38:40.605322,0 days 00:00:03.619811,softplus,256,,4,80,0.00023683478738840673,4,512,False,PRUNED
1460,2.8871679306030273,2025-01-28 12:38:40.626698,2025-01-28 12:38:43.534836,0 days 00:00:02.908138,tanh,256,,32,100,0.0023534232976194364,4,496,False,PRUNED
1461,3.5979673862457275,2025-01-28 12:38:43.554338,2025-01-28 12:38:45.929764,0 days 00:00:02.375426,softplus,256,,4,90,0.0005393354382352538,4,512,False,PRUNED
1462,2.8748514652252197,2025-01-28 12:38:45.947924,2025-01-28 12:38:48.679379,0 days 00:00:02.731455,selu,256,,4,30,0.00010207745320786539,4,496,False,PRUNED
1463,2.557746648788452,2025-01-28 12:38:48.698039,2025-01-28 12:38:53.860315,0 days 00:00:05.162276,softplus,128,,4,90,0.00010182338920667996,4,512,False,PRUNED
1464,3.2234838008880615,2025-01-28 12:38:53.879364,2025-01-28 12:38:56.003944,0 days 00:00:02.124580,softplus,256,,4,90,0.00010190344360084401,3,512,False,PRUNED
1465,2.7647011280059814,2025-01-28 12:38:56.021072,2025-01-28 12:38:58.392579,0 days 00:00:02.371507,softplus,256,,8,80,0.0013546357343922435,4,496,False,PRUNED
1466,2.875558376312256,2025-01-28 12:38:58.410633,2025-01-28 12:39:01.196755,0 days 00:00:02.786122,softplus,256,,4,90,0.00037708251697122873,4,512,False,PRUNED
1467,2.5108859539031982,2025-01-28 12:39:01.216987,2025-01-28 12:39:04.719279,0 days 00:00:03.502292,softplus,256,,4,90,0.00012570930128676913,4,480,False,PRUNED
1468,2.77950119972229,2025-01-28 12:39:04.739555,2025-01-28 12:39:06.894368,0 days 00:00:02.154813,softplus,512,,4,100,0.00011381788864505478,4,512,False,PRUNED
1469,2.58071231842041,2025-01-28 12:39:06.912829,2025-01-28 12:39:09.973411,0 days 00:00:03.060582,softplus,256,,4,90,0.0005122411238204375,3,496,False,PRUNED
1470,2.672018527984619,2025-01-28 12:39:09.992281,2025-01-28 12:39:14.356285,0 days 00:00:04.364004,selu,256,,4,80,0.0025891835312908617,5,512,False,PRUNED
1471,3.0786325931549072,2025-01-28 12:39:14.372945,2025-01-28 12:39:17.031301,0 days 00:00:02.658356,softplus,256,,16,90,0.00025855444226239124,4,496,False,PRUNED
1472,2.8077259063720703,2025-01-28 12:39:17.048207,2025-01-28 12:39:20.083336,0 days 00:00:03.035129,softplus,128,,4,90,0.0070720799434081305,4,496,False,PRUNED
1473,107.3520278930664,2025-01-31 23:58:24.512343,2025-01-31 23:58:29.422276,0 days 00:00:04.909933,relu,256,0.5,4,80,0.0001018215745669523,4,480,True,PRUNED
1474,7.049063682556152,2025-01-31 23:58:29.432390,2025-01-31 23:58:31.025436,0 days 00:00:01.593046,softplus,256,,2,90,0.005160357890261557,4,512,False,PRUNED
1475,9.351057052612305,2025-01-31 23:58:31.044350,2025-01-31 23:58:32.675003,0 days 00:00:01.630653,gelu,256,,8,90,0.0001813391856559737,4,304,False,PRUNED
1476,10.879267692565918,2025-01-31 23:58:32.694727,2025-01-31 23:58:34.113650,0 days 00:00:01.418923,softplus,256,,4,100,0.0038466860667969315,3,512,False,PRUNED
1477,8.083024024963379,2025-01-31 23:58:34.132604,2025-01-31 23:58:35.998595,0 days 00:00:01.865991,softplus,256,,4,70,0.0044548453888926,4,496,False,PRUNED
1478,40.8636474609375,2025-01-31 23:58:36.017175,2025-01-31 23:58:37.950698,0 days 00:00:01.933523,softplus,1024,,64,90,0.00010198589436792204,4,512,False,PRUNED
1479,7.642317295074463,2025-01-31 23:58:37.970782,2025-01-31 23:58:39.335223,0 days 00:00:01.364441,softplus,256,,4,90,0.00012322759302491195,4,496,False,PRUNED
1480,8.320781707763672,2025-01-31 23:58:39.369844,2025-01-31 23:58:40.885214,0 days 00:00:01.515370,softplus,256,,4,80,0.00014635504461136718,4,480,False,PRUNED
1481,4.325141906738281,2025-01-31 23:58:40.921137,2025-01-31 23:58:42.487391,0 days 00:00:01.566254,selu,128,,8,90,0.00010154121471882,3,512,False,PRUNED
1482,4.9879913330078125,2025-01-31 23:58:42.757755,2025-01-31 23:58:44.140847,0 days 00:00:01.383092,softplus,256,,4,90,0.00882509180195526,4,496,False,PRUNED
1483,8.442288398742676,2025-01-31 23:58:44.159554,2025-01-31 23:58:45.716384,0 days 00:00:01.556830,softplus,256,,4,60,0.0001127618873892699,4,512,False,PRUNED
1484,8.547950744628906,2025-01-31 23:58:45.737337,2025-01-31 23:58:47.526549,0 days 00:00:01.789212,softplus,256,,4,90,0.0036418156462962137,4,464,False,PRUNED
1485,8.155484199523926,2025-01-31 23:58:47.545553,2025-01-31 23:58:49.142495,0 days 00:00:01.596942,softplus,256,,4,80,0.00010201023096376307,4,512,False,PRUNED
1486,9.01657772064209,2025-01-31 23:58:49.162456,2025-01-31 23:58:52.970183,0 days 00:00:03.807727,relu,256,,32,90,0.0002884652669197629,4,512,False,PRUNED
1487,9.860234260559082,2025-01-31 23:58:52.988301,2025-01-31 23:58:57.228721,0 days 00:00:04.240420,tanh,256,,4,100,0.00010189839003034508,3,496,False,PRUNED
1488,8.694374084472656,2025-01-31 23:58:57.248387,2025-01-31 23:58:58.676633,0 days 00:00:01.428246,softplus,256,,4,90,0.00013933428516827917,4,480,False,PRUNED
1489,4.811596393585205,2025-01-31 23:58:58.696102,2025-01-31 23:59:00.677297,0 days 00:00:01.981195,softplus,128,,8,90,0.00021927291692647465,4,512,False,PRUNED
