number,value,datetime_start,datetime_complete,duration,params_activation,params_batch_size,params_dropout_rate,params_embedding_dim,params_epochs,params_learning_rate,params_n_hidden_layers,params_units_per_layer,params_use_dropout,state
404,2.4507107734680176,2025-01-25 22:51:15.435798,2025-01-25 22:51:23.929177,0 days 00:00:08.493379,softplus,128,,8,80,1.4915127229719882e-05,3,480,False,PRUNED
405,2.662635564804077,2025-01-25 22:51:23.934058,2025-01-25 22:51:27.014263,0 days 00:00:03.080205,softplus,1024,,2,65,2.8210745952500493e-05,3,464,False,PRUNED
406,2.436328887939453,2025-01-25 22:51:27.019125,2025-01-25 22:51:35.519472,0 days 00:00:08.500347,softplus,128,,8,90,2.0370975999071536e-05,3,512,False,PRUNED
407,2.265327215194702,2025-01-25 22:51:35.526054,2025-01-25 22:51:46.558189,0 days 00:00:11.032135,softplus,256,,4,10,0.00031246331510695547,3,496,False,COMPLETE
408,2.4345898628234863,2025-01-25 22:51:46.566134,2025-01-25 22:51:54.907108,0 days 00:00:08.340974,softplus,128,,8,95,1.0000438098569352e-05,3,480,False,PRUNED
409,2.2591612339019775,2025-01-25 22:51:54.912308,2025-01-25 22:52:08.724380,0 days 00:00:13.812072,softplus,256,,8,70,9.621331638438087e-05,3,448,False,COMPLETE
410,12.596060752868652,2025-01-25 22:52:08.732893,2025-01-25 22:52:17.955158,0 days 00:00:09.222265,relu,128,,8,30,3.7073257712791424e-05,3,512,False,PRUNED
411,2.3994123935699463,2025-01-25 22:52:17.960084,2025-01-25 22:52:21.385653,0 days 00:00:03.425569,softplus,512,,8,100,0.002390839662341707,3,464,False,PRUNED
412,2.3459513187408447,2025-01-25 22:52:21.390573,2025-01-25 22:52:29.831812,0 days 00:00:08.441239,softplus,128,,8,65,2.440024427280955e-05,3,496,False,PRUNED
413,2.40524959564209,2025-01-25 22:52:29.836406,2025-01-25 22:52:36.391808,0 days 00:00:06.555402,gelu,256,,64,70,1.2218038449463904e-05,3,512,False,PRUNED
414,2.4296040534973145,2025-01-25 22:52:36.396641,2025-01-25 22:52:44.697015,0 days 00:00:08.300374,softplus,128,,8,100,4.7736866316670275e-05,3,480,False,PRUNED
415,2.2574729919433594,2025-01-25 22:52:44.701572,2025-01-25 22:53:07.717707,0 days 00:00:23.016135,softplus,128,,8,70,3.1135384096190325e-05,3,496,False,COMPLETE
416,3.0449581146240234,2025-01-25 22:53:07.725824,2025-01-25 22:53:14.258941,0 days 00:00:06.533117,softplus,256,0.4,8,75,0.008909058390349776,3,480,True,PRUNED
417,2.6086277961730957,2025-01-25 22:53:14.263456,2025-01-25 22:53:18.005831,0 days 00:00:03.742375,selu,512,,4,95,1.686399779751425e-05,3,512,False,PRUNED
418,2.2252938747406006,2025-01-25 22:53:18.010374,2025-01-25 22:54:01.405220,0 days 00:00:43.394846,softplus,128,,8,60,2.1299021177641496e-05,3,496,False,COMPLETE
419,2.356066942214966,2025-01-25 22:54:01.413112,2025-01-25 22:54:06.529603,0 days 00:00:05.116491,softplus,256,,8,100,2.770098017383957e-05,3,496,False,PRUNED
420,2.373202323913574,2025-01-25 22:54:06.534494,2025-01-25 22:54:14.951487,0 days 00:00:08.416993,softplus,128,,8,100,3.548338774322079e-05,3,464,False,PRUNED
421,2.647315502166748,2025-01-25 22:54:14.956728,2025-01-25 22:54:23.702557,0 days 00:00:08.745829,softplus,128,,8,75,1.5483709559532777e-05,3,512,False,PRUNED
422,2.395390510559082,2025-01-25 22:54:23.707582,2025-01-25 22:54:28.862863,0 days 00:00:05.155281,softplus,256,,8,75,1.9221730917175927e-05,3,496,False,PRUNED
423,2.496762752532959,2025-01-25 22:54:28.867398,2025-01-25 22:54:37.394806,0 days 00:00:08.527408,softplus,128,,8,95,0.00138161317662545,3,480,False,PRUNED
424,2.4481937885284424,2025-01-25 22:54:37.399655,2025-01-25 22:54:41.040353,0 days 00:00:03.640698,softplus,512,,8,65,0.0005773109050664575,3,480,False,PRUNED
425,2.587395191192627,2025-01-25 22:54:41.044931,2025-01-25 22:54:45.921041,0 days 00:00:04.876110,softplus,256,,4,70,7.118701597840875e-05,3,464,False,PRUNED
426,2.932874917984009,2025-01-25 22:54:45.925641,2025-01-25 22:54:56.345661,0 days 00:00:10.420020,tanh,128,,32,100,2.3934760470015114e-05,3,512,False,PRUNED
427,2.466492176055908,2025-01-25 22:54:56.351895,2025-01-25 22:55:05.148163,0 days 00:00:08.796268,softplus,128,,8,70,0.0006999665938315241,3,496,False,PRUNED
428,2.368422746658325,2025-01-25 22:55:05.154007,2025-01-25 22:55:08.727375,0 days 00:00:03.573368,softplus,1024,,8,55,0.000364993939297388,3,496,False,PRUNED
429,2.447136878967285,2025-01-25 22:55:08.733987,2025-01-25 22:55:14.092216,0 days 00:00:05.358229,softplus,256,,8,60,4.3845643089173254e-05,3,512,False,PRUNED
430,2.5081074237823486,2025-01-25 22:55:14.098065,2025-01-25 22:55:22.730504,0 days 00:00:08.632439,softplus,128,,8,100,1.3175335909158535e-05,3,480,False,PRUNED
431,2.206210136413574,2025-01-25 22:55:22.736898,2025-01-25 22:56:07.851348,0 days 00:00:45.114450,softplus,128,,8,80,3.063884001207523e-05,3,496,False,COMPLETE
432,2.428412675857544,2025-01-25 22:56:07.861049,2025-01-25 22:56:11.688604,0 days 00:00:03.827555,softplus,512,,8,75,3.276697935131404e-05,3,480,False,PRUNED
433,2.3656997680664062,2025-01-25 22:56:11.694428,2025-01-25 22:56:19.179737,0 days 00:00:07.485309,softplus,256,,8,85,0.00011203345274466362,3,464,False,PRUNED
434,14.060993194580078,2025-01-25 22:56:19.185960,2025-01-25 22:56:29.526342,0 days 00:00:10.340382,softplus,128,0.30000000000000004,2,80,3.8908398085887274e-05,3,480,True,PRUNED
435,2.402578353881836,2025-01-25 22:56:29.532180,2025-01-25 22:56:38.441600,0 days 00:00:08.909420,softplus,128,,8,80,2.940185984930419e-05,3,480,False,PRUNED
436,2.594886302947998,2025-01-25 22:56:38.447427,2025-01-25 22:56:47.448925,0 days 00:00:09.001498,relu,256,,8,75,0.00090983664846704,3,496,False,PRUNED
437,2.378081798553467,2025-01-25 22:56:47.455188,2025-01-25 22:56:55.983842,0 days 00:00:08.528654,softplus,128,,4,80,5.482766553326799e-05,3,496,False,PRUNED
438,2.9290828704833984,2025-01-25 22:56:55.990019,2025-01-25 22:57:04.504259,0 days 00:00:08.514240,softplus,128,,8,85,2.635584715852441e-05,3,64,False,PRUNED
439,2.414451837539673,2025-01-25 22:57:04.510547,2025-01-25 22:57:12.454074,0 days 00:00:07.943527,softplus,256,,8,80,3.3512432083731066e-05,3,480,False,PRUNED
440,2.329329013824463,2025-01-25 22:57:12.461134,2025-01-25 22:57:20.435117,0 days 00:00:07.973983,gelu,512,,8,65,4.393062074667594e-05,5,496,False,PRUNED
441,2.6264336109161377,2025-01-25 22:57:20.441059,2025-01-25 22:57:29.128864,0 days 00:00:08.687805,softplus,128,,8,90,0.0005344858587886786,3,464,False,PRUNED
442,2.3691563606262207,2025-01-25 22:57:29.134998,2025-01-25 22:57:36.777892,0 days 00:00:07.642894,softplus,256,,64,70,2.2230354849160203e-05,3,496,False,PRUNED
443,2.3919286727905273,2025-01-25 22:57:36.795245,2025-01-25 22:57:45.617318,0 days 00:00:08.822073,softplus,128,,8,85,2.8153943827574133e-05,3,176,False,PRUNED
444,3.133650541305542,2025-01-25 22:57:45.623652,2025-01-25 22:57:54.299046,0 days 00:00:08.675394,selu,128,,8,75,3.6375350471438834e-05,3,448,False,PRUNED
445,2.3217508792877197,2025-01-25 22:57:54.303509,2025-01-25 22:58:06.935091,0 days 00:00:12.631582,softplus,256,,8,70,2.3040500348027465e-05,3,480,False,PRUNED
446,2.5545551776885986,2025-01-25 22:58:06.939981,2025-01-25 22:58:10.833637,0 days 00:00:03.893656,softplus,512,,4,60,5.172233581183955e-05,3,512,False,PRUNED
447,2.5130205154418945,2025-01-25 22:58:10.839523,2025-01-25 22:58:19.563702,0 days 00:00:08.724179,softplus,128,,8,50,1.8554119610339e-05,3,464,False,PRUNED
448,2.3563883304595947,2025-01-25 22:58:19.568641,2025-01-25 22:58:27.980865,0 days 00:00:08.412224,softplus,128,,8,60,2.9052564951586678e-05,3,496,False,PRUNED
449,2.4517953395843506,2025-01-25 22:58:27.985561,2025-01-25 22:58:33.188214,0 days 00:00:05.202653,softplus,256,,8,65,3.917273974005463e-05,3,432,False,PRUNED
450,2.4553098678588867,2025-01-25 22:58:33.193040,2025-01-25 22:58:41.706079,0 days 00:00:08.513039,softplus,128,,8,75,0.00045761115099377864,3,448,False,PRUNED
451,2.8176462650299072,2025-01-25 22:58:41.711305,2025-01-25 22:58:49.161286,0 days 00:00:07.449981,tanh,256,,32,75,6.240978999855251e-05,3,512,False,PRUNED
452,2.247739791870117,2025-01-25 22:58:49.166173,2025-01-25 22:59:17.184411,0 days 00:00:28.018238,softplus,128,,8,70,2.497771259728164e-05,3,496,False,COMPLETE
453,33.7999153137207,2025-01-25 22:59:17.192663,2025-01-25 22:59:22.381682,0 days 00:00:05.189019,softplus,512,0.2,8,80,2.01662413184834e-05,3,256,True,PRUNED
454,2.4895660877227783,2025-01-25 22:59:22.386664,2025-01-25 22:59:25.537259,0 days 00:00:03.150595,softplus,1024,,8,90,3.4296899439772714e-05,3,480,False,PRUNED
455,9.575488090515137,2025-01-25 22:59:25.542122,2025-01-25 22:59:33.974073,0 days 00:00:08.431951,softplus,128,,8,55,0.031504588899818296,3,496,False,PRUNED
456,2.3989295959472656,2025-01-25 22:59:33.978568,2025-01-25 22:59:39.003140,0 days 00:00:05.024572,softplus,256,,4,70,1.6002995911837353e-05,3,464,False,PRUNED
457,2.3041579723358154,2025-01-25 22:59:39.007715,2025-01-25 22:59:57.793098,0 days 00:00:18.785383,softplus,128,,8,65,0.0001986123212169461,3,512,False,COMPLETE
458,2.4179563522338867,2025-01-25 22:59:57.800930,2025-01-25 23:00:06.234359,0 days 00:00:08.433429,softplus,128,,8,65,0.012276089060840273,3,480,False,PRUNED
459,2.296295404434204,2025-01-25 23:00:06.239266,2025-01-25 23:00:18.348587,0 days 00:00:12.109321,softplus,256,,8,95,0.0002779463703286767,3,512,False,COMPLETE
460,2.4018666744232178,2025-01-25 23:00:18.356364,2025-01-25 23:00:22.104566,0 days 00:00:03.748202,softplus,512,,8,75,2.8873780149317922e-05,3,496,False,PRUNED
461,2.2369048595428467,2025-01-25 23:00:22.109131,2025-01-25 23:00:50.195229,0 days 00:00:28.086098,softplus,128,,2,65,0.00012956466038668542,3,480,False,COMPLETE
462,2.427302360534668,2025-01-25 23:00:50.202831,2025-01-25 23:00:55.420712,0 days 00:00:05.217881,softplus,256,,8,80,2.2641832416871793e-05,3,496,False,PRUNED
463,2.5656886100769043,2025-01-25 23:00:55.425387,2025-01-25 23:01:04.262623,0 days 00:00:08.837236,relu,128,,8,100,0.006222989728614154,3,496,False,PRUNED
464,2.3690576553344727,2025-01-25 23:01:04.268166,2025-01-25 23:01:12.818020,0 days 00:00:08.549854,softplus,128,,8,75,1.4028607334767486e-05,3,464,False,PRUNED
465,2.3486218452453613,2025-01-25 23:01:12.822564,2025-01-25 23:01:17.773528,0 days 00:00:04.950964,softplus,256,,8,70,3.2567500849662296e-05,3,512,False,PRUNED
466,2.405996322631836,2025-01-25 23:01:17.779081,2025-01-25 23:01:27.092286,0 days 00:00:09.313205,gelu,128,,8,70,0.0007060752679083768,3,368,False,PRUNED
467,3.3587779998779297,2025-01-25 23:01:27.097192,2025-01-25 23:01:30.819409,0 days 00:00:03.722217,softplus,512,,4,60,1.1872294542244015e-05,3,272,False,PRUNED
468,2.229285717010498,2025-01-25 23:01:30.824184,2025-01-25 23:02:00.342046,0 days 00:00:29.517862,softplus,128,,8,95,4.6956058390847396e-05,3,480,False,COMPLETE
469,2.5568959712982178,2025-01-25 23:02:00.350144,2025-01-25 23:02:06.480130,0 days 00:00:06.129986,softplus,256,,64,55,8.087236083674598e-05,3,512,False,PRUNED
470,2.397372007369995,2025-01-25 23:02:06.486029,2025-01-25 23:02:14.830370,0 days 00:00:08.344341,softplus,128,,8,100,0.002673943360990847,3,496,False,PRUNED
471,2.3893628120422363,2025-01-25 23:02:14.835310,2025-01-25 23:02:20.003942,0 days 00:00:05.168632,softplus,256,,8,95,1.8445062311843016e-05,3,480,False,PRUNED
472,2.2201709747314453,2025-01-25 23:02:20.008748,2025-01-25 23:03:14.334740,0 days 00:00:54.325992,softplus,128,,8,100,2.5755228190857486e-05,3,496,False,COMPLETE
473,3.9330761432647705,2025-01-25 23:03:14.342357,2025-01-25 23:03:23.882775,0 days 00:00:09.540418,selu,128,0.4,8,60,3.873445221527928e-05,3,512,True,PRUNED
474,2.3922815322875977,2025-01-25 23:03:23.887301,2025-01-25 23:03:28.874098,0 days 00:00:04.986797,softplus,256,,8,70,2.1191814792935725e-05,3,480,False,PRUNED
475,2.451298952102661,2025-01-25 23:03:28.879245,2025-01-25 23:03:32.450160,0 days 00:00:03.570915,softplus,512,,8,80,1.658606234508393e-05,3,464,False,PRUNED
476,2.551650285720825,2025-01-25 23:03:32.455107,2025-01-25 23:03:40.841632,0 days 00:00:08.386525,softplus,128,,4,65,3.0718683063776954e-05,3,96,False,PRUNED
477,2.939162254333496,2025-01-25 23:03:40.846331,2025-01-25 23:03:45.239628,0 days 00:00:04.393297,tanh,1024,,8,75,0.0030572064277187383,3,496,False,PRUNED
478,2.827786684036255,2025-01-25 23:03:45.244259,2025-01-25 23:03:54.549114,0 days 00:00:09.304855,softplus,256,,32,15,0.0002518780243194946,3,512,False,PRUNED
479,2.642055034637451,2025-01-25 23:03:54.553841,2025-01-25 23:04:02.713158,0 days 00:00:08.159317,softplus,128,,8,35,0.0037841385293542334,3,464,False,PRUNED
480,2.9333689212799072,2025-01-25 23:04:02.718070,2025-01-25 23:04:16.641186,0 days 00:00:13.923116,softplus,128,,8,95,4.574054139422079e-05,3,480,False,PRUNED
481,2.359415292739868,2025-01-25 23:04:16.645770,2025-01-25 23:04:21.916882,0 days 00:00:05.271112,softplus,256,,8,70,2.4769149572630184e-05,3,496,False,PRUNED
482,2.376204252243042,2025-01-25 23:04:21.923127,2025-01-25 23:04:25.403386,0 days 00:00:03.480259,softplus,512,,8,100,0.00017907299619312816,3,496,False,PRUNED
483,2.355048179626465,2025-01-25 23:04:25.408382,2025-01-25 23:04:34.001749,0 days 00:00:08.593367,softplus,128,,8,70,1.9462476358968226e-05,3,512,False,PRUNED
484,2.345018148422241,2025-01-25 23:04:34.006992,2025-01-25 23:04:42.525016,0 days 00:00:08.518024,softplus,128,,8,100,3.20520270070758e-05,3,480,False,PRUNED
485,2.1894216537475586,2025-01-25 23:04:42.529908,2025-01-25 23:05:21.919140,0 days 00:00:39.389232,softplus,256,,4,90,5.899021004846492e-05,4,512,False,COMPLETE
486,2.5404162406921387,2025-01-25 23:05:21.926760,2025-01-25 23:05:30.936832,0 days 00:00:09.010072,softplus,128,,4,90,3.8867200538695424e-05,4,288,False,PRUNED
487,2.4147818088531494,2025-01-25 23:05:30.941417,2025-01-25 23:05:35.945660,0 days 00:00:05.004243,softplus,256,,4,95,6.134723810794141e-05,3,512,False,PRUNED
488,2.206968069076538,2025-01-25 23:05:35.950257,2025-01-25 23:06:13.441902,0 days 00:00:37.491645,softplus,128,,4,90,5.762294853856815e-05,3,512,False,COMPLETE
489,2.4481890201568604,2025-01-25 23:06:13.449794,2025-01-25 23:06:18.873609,0 days 00:00:05.423815,relu,512,,4,90,5.574310602727494e-05,3,512,False,PRUNED
490,2.3724091053009033,2025-01-25 23:06:18.878203,2025-01-25 23:06:32.733430,0 days 00:00:13.855227,softplus,128,,4,85,7.234237667937768e-05,3,512,False,PRUNED
491,2.2036612033843994,2025-01-25 23:06:32.738406,2025-01-25 23:07:01.932293,0 days 00:00:29.193887,softplus,256,,4,95,6.458443991861719e-05,4,512,False,COMPLETE
492,2.9558165073394775,2025-01-25 23:07:01.941088,2025-01-25 23:07:07.599734,0 days 00:00:05.658646,softplus,256,,4,90,6.713555079527617e-05,4,512,False,PRUNED
493,43.22384262084961,2025-01-25 23:07:07.605904,2025-01-25 23:07:14.917286,0 days 00:00:07.311382,softplus,256,0.5,4,90,5.148049528369086e-05,4,512,True,PRUNED
494,2.4738662242889404,2025-01-25 23:07:14.921993,2025-01-25 23:07:21.048837,0 days 00:00:06.126844,gelu,256,,4,90,9.365286562667154e-05,5,512,False,PRUNED
495,2.3516058921813965,2025-01-25 23:07:21.053403,2025-01-25 23:07:27.031312,0 days 00:00:05.977909,softplus,256,,4,95,4.792196586294146e-05,4,512,False,PRUNED
496,2.7496469020843506,2025-01-25 23:07:27.036033,2025-01-25 23:07:32.760077,0 days 00:00:05.724044,softplus,256,,4,95,0.0011145071720688004,4,512,False,PRUNED
497,2.2183449268341064,2025-01-25 23:07:32.764985,2025-01-25 23:07:52.914887,0 days 00:00:20.149902,softplus,256,,4,85,8.317049183683368e-05,4,512,False,COMPLETE
498,2.9171440601348877,2025-01-25 23:07:52.922516,2025-01-25 23:07:58.251818,0 days 00:00:05.329302,selu,256,,4,90,6.33154446079575e-05,3,496,False,PRUNED
499,2.1848769187927246,2025-01-25 23:07:58.256604,2025-01-25 23:08:32.126781,0 days 00:00:33.870177,softplus,256,,4,95,4.78600305633012e-05,4,512,False,COMPLETE
500,2.25022292137146,2025-01-27 12:24:16.580066,2025-01-27 12:24:32.288959,0 days 00:00:15.708893,softplus,256,,4,90,5.452883835212077e-05,4,512,False,COMPLETE
501,2.1884186267852783,2025-01-27 12:24:32.299508,2025-01-27 12:24:53.316298,0 days 00:00:21.016790,softplus,256,,4,85,4.775892159865182e-05,4,496,False,COMPLETE
502,2.186382532119751,2025-01-27 12:24:53.323896,2025-01-27 12:25:15.819622,0 days 00:00:22.495726,softplus,256,,4,85,6.782565986733046e-05,4,512,False,COMPLETE
503,2.3960275650024414,2025-01-27 12:25:15.827521,2025-01-27 12:25:21.484154,0 days 00:00:05.656633,softplus,256,,4,85,5.480793444313277e-05,4,496,False,PRUNED
504,2.3795642852783203,2025-01-27 12:25:21.489145,2025-01-27 12:25:26.975425,0 days 00:00:05.486280,softplus,256,,4,85,7.156521087551426e-05,4,512,False,PRUNED
505,2.6021182537078857,2025-01-27 12:25:26.981000,2025-01-27 12:25:32.801873,0 days 00:00:05.820873,softplus,256,,4,85,6.0038896440655577e-05,4,496,False,PRUNED
506,2.189178466796875,2025-01-27 12:25:32.807243,2025-01-27 12:25:58.117206,0 days 00:00:25.309963,softplus,256,,4,85,8.550826681895499e-05,4,496,False,COMPLETE
507,3.6662847995758057,2025-01-27 12:25:58.124750,2025-01-27 12:26:03.672587,0 days 00:00:05.547837,softplus,256,,4,85,8.059462574313838e-05,4,32,False,PRUNED
508,2.1622021198272705,2025-01-27 12:26:03.677427,2025-01-27 12:26:26.215962,0 days 00:00:22.538535,softplus,256,,4,85,0.00010034477425220593,4,512,False,COMPLETE
509,2.6378724575042725,2025-01-27 12:26:26.223751,2025-01-27 12:26:34.330287,0 days 00:00:08.106536,tanh,256,,4,85,6.697367170355809e-05,4,512,False,PRUNED
510,2.391427755355835,2025-01-27 12:26:34.334987,2025-01-27 12:26:39.814922,0 days 00:00:05.479935,softplus,256,,4,85,9.889970325690627e-05,4,512,False,PRUNED
511,2.480093479156494,2025-01-27 12:26:39.820269,2025-01-27 12:26:45.641579,0 days 00:00:05.821310,softplus,256,,4,85,8.613333306330636e-05,4,512,False,PRUNED
512,2.1712379455566406,2025-01-27 12:26:45.646668,2025-01-27 12:27:12.373732,0 days 00:00:26.727064,softplus,256,,4,85,7.513689106360671e-05,4,512,False,COMPLETE
513,2.467210531234741,2025-01-27 12:27:12.381764,2025-01-27 12:27:18.501858,0 days 00:00:06.120094,softplus,256,,4,85,0.00010023362420638024,4,512,False,PRUNED
514,2.1806957721710205,2025-01-27 12:27:18.506813,2025-01-27 12:27:43.314813,0 days 00:00:24.808000,softplus,256,,4,90,6.936029426648848e-05,4,512,False,COMPLETE
515,2.174607038497925,2025-01-27 12:27:43.322328,2025-01-27 12:28:11.175127,0 days 00:00:27.852799,softplus,256,,4,90,8.543284066542141e-05,4,512,False,COMPLETE
516,2.2215073108673096,2025-01-27 12:28:11.183082,2025-01-27 12:28:27.032545,0 days 00:00:15.849463,softplus,256,,4,90,7.580845986455909e-05,4,512,False,COMPLETE
517,5.418574810028076,2025-01-27 12:28:27.040120,2025-01-27 12:28:34.081806,0 days 00:00:07.041686,softplus,256,0.1,4,90,0.0001151771339354737,4,512,True,PRUNED
518,2.344007730484009,2025-01-27 12:28:34.086357,2025-01-27 12:28:40.045247,0 days 00:00:05.958890,softplus,256,,4,90,8.689335295992714e-05,4,512,False,PRUNED
519,2.168314218521118,2025-01-27 12:28:40.050665,2025-01-27 12:29:08.056059,0 days 00:00:28.005394,softplus,256,,4,85,7.61610085665138e-05,4,512,False,COMPLETE
520,2.393409490585327,2025-01-27 12:29:08.063988,2025-01-27 12:29:13.738057,0 days 00:00:05.674069,softplus,256,,4,85,6.9666093765104e-05,4,512,False,PRUNED
521,2.5043129920959473,2025-01-27 12:29:13.743108,2025-01-27 12:29:21.419788,0 days 00:00:07.676680,relu,256,,4,85,8.542571923731366e-05,4,512,False,PRUNED
522,2.199687957763672,2025-01-27 12:29:21.424844,2025-01-27 12:29:38.540958,0 days 00:00:17.116114,softplus,256,,4,90,0.00011108271935734607,4,512,False,COMPLETE
523,2.176515579223633,2025-01-27 12:29:38.548811,2025-01-27 12:29:59.894280,0 days 00:00:21.345469,softplus,256,,4,90,9.73176973704176e-05,4,512,False,COMPLETE
524,2.19521427154541,2025-01-27 12:29:59.902098,2025-01-27 12:30:21.317015,0 days 00:00:21.414917,softplus,256,,4,90,9.743018342419994e-05,4,512,False,COMPLETE
525,2.380446195602417,2025-01-27 12:30:21.324878,2025-01-27 12:30:27.143956,0 days 00:00:05.819078,softplus,256,,4,90,0.00011438717125072263,4,512,False,PRUNED
526,2.525017261505127,2025-01-27 12:30:27.150446,2025-01-27 12:30:33.198184,0 days 00:00:06.047738,gelu,256,,4,90,0.00010123236030108687,4,512,False,PRUNED
527,2.4220571517944336,2025-01-27 12:30:33.204117,2025-01-27 12:30:38.942941,0 days 00:00:05.738824,softplus,256,,4,90,8.628853271936187e-05,4,512,False,PRUNED
528,2.207240581512451,2025-01-27 12:30:38.948290,2025-01-27 12:30:55.495716,0 days 00:00:16.547426,softplus,256,,4,90,0.00012611388159235531,4,512,False,COMPLETE
529,2.181880474090576,2025-01-27 12:30:55.503490,2025-01-27 12:31:18.227265,0 days 00:00:22.723775,softplus,256,,4,90,0.00010339222244970689,4,512,False,COMPLETE
530,2.222059726715088,2025-01-27 12:31:18.235309,2025-01-27 12:31:39.054533,0 days 00:00:20.819224,softplus,256,,4,90,0.00012558990686764522,4,512,False,COMPLETE
531,2.5046615600585938,2025-01-27 12:31:39.062437,2025-01-27 12:31:44.923989,0 days 00:00:05.861552,softplus,256,,4,90,0.00010559702494257216,4,512,False,PRUNED
532,2.306938886642456,2025-01-27 12:31:44.928490,2025-01-27 12:31:58.128110,0 days 00:00:13.199620,selu,256,,4,85,0.00012675100023608714,4,512,False,COMPLETE
533,2.8870127201080322,2025-01-27 12:31:58.135900,2025-01-27 12:32:04.169068,0 days 00:00:06.033168,softplus,256,,4,90,9.651017396348877e-05,4,512,False,PRUNED
534,2.186732053756714,2025-01-27 12:32:04.183381,2025-01-27 12:32:24.046292,0 days 00:00:19.862911,softplus,256,,4,90,7.80096004041174e-05,4,512,False,COMPLETE
535,2.3964757919311523,2025-01-27 12:32:24.054486,2025-01-27 12:32:29.903837,0 days 00:00:05.849351,softplus,256,,4,90,7.567665707047351e-05,4,512,False,PRUNED
536,2.5174591541290283,2025-01-27 12:32:29.908759,2025-01-27 12:32:39.618060,0 days 00:00:09.709301,softplus,256,,4,85,7.174597222097789e-05,4,512,False,PRUNED
537,2.1799449920654297,2025-01-27 12:32:39.623547,2025-01-27 12:33:09.025249,0 days 00:00:29.401702,softplus,256,,4,85,8.663359338003076e-05,4,512,False,COMPLETE
538,2.428274393081665,2025-01-27 12:33:09.032875,2025-01-27 12:33:14.899436,0 days 00:00:05.866561,softplus,256,,4,85,9.083362353263225e-05,4,512,False,PRUNED
539,2.5674290657043457,2025-01-27 12:33:14.917866,2025-01-27 12:33:20.843014,0 days 00:00:05.925148,tanh,256,,4,85,0.00010436179185691557,4,512,False,PRUNED
