number,value,datetime_start,datetime_complete,duration,params_activation,params_batch_size,params_dropout_rate,params_embedding_dim,params_epochs,params_learning_rate,params_n_hidden_layers,params_units_per_layer,params_use_dropout,state
2211,2.0192148685455322,2025-02-15 23:48:31.553136,2025-02-15 23:51:35.979456,0 days 00:03:04.426320,softplus,128,,4,90,0.0022590977529787773,4,432,False,COMPLETE
2212,2.0415399074554443,2025-02-15 23:51:35.992957,2025-02-15 23:54:34.702050,0 days 00:02:58.709093,softplus,128,,4,90,0.0022845501498652263,4,416,False,COMPLETE
2213,2.0176196098327637,2025-02-15 23:54:34.715822,2025-02-15 23:55:52.806974,0 days 00:01:18.091152,softplus,128,,4,90,0.002240735325717839,4,432,False,COMPLETE
2214,2.0351006984710693,2025-02-15 23:55:52.832963,2025-02-15 23:57:33.144585,0 days 00:01:40.311622,softplus,128,,4,90,0.00223721851111416,4,416,False,COMPLETE
2215,2.7760632038116455,2025-02-15 23:57:33.158757,2025-02-15 23:57:39.630247,0 days 00:00:06.471490,softplus,128,,4,90,0.0022547355443922426,4,416,False,PRUNED
2216,2.011314868927002,2025-02-15 23:57:39.662016,2025-02-15 23:59:02.644504,0 days 00:01:22.982488,softplus,128,,4,90,0.0023250885674872606,4,432,False,COMPLETE
2217,2.0453813076019287,2025-02-15 23:59:02.667881,2025-02-16 00:02:05.444835,0 days 00:03:02.776954,softplus,128,,4,90,0.002324686372316567,4,432,False,COMPLETE
2218,2.0187594890594482,2025-02-16 00:02:05.461365,2025-02-16 00:04:43.697452,0 days 00:02:38.236087,softplus,128,,4,90,0.0023977197941610524,4,432,False,COMPLETE
2219,2.0287652015686035,2025-02-16 00:04:43.710933,2025-02-16 00:06:21.264174,0 days 00:01:37.553241,softplus,128,,4,90,0.0023982127073851585,4,432,False,COMPLETE
2220,2.0036182403564453,2025-02-16 00:06:21.278013,2025-02-16 00:09:00.600735,0 days 00:02:39.322722,softplus,128,,4,90,0.0024831927231875675,4,432,False,COMPLETE
2221,2.0391910076141357,2025-02-16 00:09:00.613813,2025-02-16 00:11:45.087716,0 days 00:02:44.473903,softplus,128,,4,90,0.0024804432394946374,4,416,False,COMPLETE
2222,2.01975679397583,2025-02-16 00:11:45.101167,2025-02-16 00:13:07.557183,0 days 00:01:22.456016,softplus,128,,4,90,0.0025310012430471733,4,416,False,COMPLETE
2223,2.0379178524017334,2025-02-16 00:13:07.571209,2025-02-16 00:14:58.086583,0 days 00:01:50.515374,softplus,128,,4,90,0.0024889674675949484,4,416,False,COMPLETE
2224,3.0346317291259766,2025-02-16 00:14:58.099748,2025-02-16 00:15:04.828104,0 days 00:00:06.728356,softplus,128,,4,90,0.0025230522089487195,4,416,False,PRUNED
2225,2.0356876850128174,2025-02-16 00:15:04.848604,2025-02-16 00:17:12.783589,0 days 00:02:07.934985,softplus,128,,4,90,0.0026808867384731467,4,416,False,COMPLETE
2226,2.0438036918640137,2025-02-16 00:17:12.797244,2025-02-16 00:18:54.455045,0 days 00:01:41.657801,softplus,128,,4,90,0.0025358143545500286,4,416,False,COMPLETE
2227,2.019049644470215,2025-02-16 00:18:54.468706,2025-02-16 00:20:32.316950,0 days 00:01:37.848244,softplus,128,,4,90,0.0025502349906385406,4,416,False,COMPLETE
2228,8.460782051086426,2025-02-16 00:20:32.329739,2025-02-16 00:20:38.851555,0 days 00:00:06.521816,softplus,128,,4,90,0.0025974704030184027,4,416,False,PRUNED
2229,2.1375579833984375,2025-02-16 00:20:38.872562,2025-02-16 00:22:54.169425,0 days 00:02:15.296863,softplus,128,0.1,4,90,0.0025837459228209925,4,416,True,COMPLETE
2230,2.037379264831543,2025-02-16 00:22:54.182509,2025-02-16 00:25:44.471543,0 days 00:02:50.289034,softplus,128,,4,90,0.002503581198620958,4,416,False,COMPLETE
2231,3.0840566158294678,2025-02-16 00:25:44.497763,2025-02-16 00:25:51.222717,0 days 00:00:06.724954,softplus,128,,4,90,0.0027363681865248614,4,416,False,PRUNED
2232,2.0237953662872314,2025-02-16 00:25:51.245694,2025-02-16 00:27:22.717890,0 days 00:01:31.472196,softplus,128,,4,90,0.002057593881387802,4,400,False,COMPLETE
2233,2.0047366619110107,2025-02-16 00:27:22.730266,2025-02-16 00:28:52.374106,0 days 00:01:29.643840,softplus,128,,4,90,0.002068413026549585,4,400,False,COMPLETE
2234,2.001309633255005,2025-02-16 00:28:52.387373,2025-02-16 00:32:25.499380,0 days 00:03:33.112007,softplus,128,,4,90,0.002078386387066771,4,400,False,COMPLETE
2235,2.990158796310425,2025-02-16 00:32:25.512851,2025-02-16 00:32:38.241229,0 days 00:00:12.728378,softplus,128,,4,90,0.002049045105092459,4,400,False,PRUNED
2236,2.054238796234131,2025-02-16 00:32:38.541952,2025-02-16 00:35:21.322653,0 days 00:02:42.780701,softplus,128,,4,90,0.0020674650891771605,4,400,False,COMPLETE
2237,2.04394793510437,2025-02-16 00:35:21.335954,2025-02-16 00:40:27.717178,0 days 00:05:06.381224,softplus,128,,4,90,0.002484514756125523,4,400,False,COMPLETE
2238,2.9081881046295166,2025-02-16 00:40:27.730973,2025-02-16 00:40:34.177448,0 days 00:00:06.446475,softplus,128,,4,90,0.002037490754323982,4,432,False,PRUNED
2239,2.0137271881103516,2025-02-16 00:40:34.198013,2025-02-16 00:45:22.194978,0 days 00:04:47.996965,softplus,128,,4,90,0.002794926775064252,4,416,False,COMPLETE
2240,2.0270705223083496,2025-02-16 00:45:22.208999,2025-02-16 00:47:40.013919,0 days 00:02:17.804920,softplus,128,,4,90,0.0027087612937067426,4,432,False,COMPLETE
2241,2.0333807468414307,2025-02-16 00:47:40.027440,2025-02-16 00:52:12.441941,0 days 00:04:32.414501,softplus,128,,4,90,0.0027912082578738138,4,432,False,COMPLETE
2242,2.040585994720459,2025-02-16 00:52:12.455169,2025-02-16 00:56:36.517238,0 days 00:04:24.062069,softplus,128,,4,90,0.002735886813652441,4,432,False,COMPLETE
2243,3.642627716064453,2025-02-16 00:56:36.530920,2025-02-16 00:56:42.822247,0 days 00:00:06.291327,softplus,128,,4,90,0.002723780868118868,4,432,False,PRUNED
2244,2.0725255012512207,2025-02-16 00:56:42.843407,2025-02-16 00:59:19.604380,0 days 00:02:36.760973,softplus,128,,4,90,0.002852477396387829,4,432,False,COMPLETE
2245,2.8756937980651855,2025-02-16 00:59:19.617896,2025-02-16 00:59:26.381420,0 days 00:00:06.763524,softplus,128,,4,90,0.00286897250731788,4,400,False,PRUNED
2246,2.037287712097168,2025-02-16 00:59:26.402474,2025-02-16 01:01:40.972546,0 days 00:02:14.570072,softplus,128,,4,90,0.0026607480938091845,4,416,False,COMPLETE
2247,2.022555351257324,2025-02-16 01:01:40.994810,2025-02-16 01:06:21.687403,0 days 00:04:40.692593,softplus,128,,4,90,0.002054217150511754,4,432,False,COMPLETE
2248,2.0453760623931885,2025-02-16 01:06:21.701713,2025-02-16 01:08:28.587782,0 days 00:02:06.886069,softplus,128,,4,90,0.002009364599565476,4,432,False,COMPLETE
2249,2.8649837970733643,2025-02-16 01:08:28.600754,2025-02-16 01:08:36.307597,0 days 00:00:07.706843,softplus,128,0.2,4,90,0.002123057909570111,4,432,True,PRUNED
2250,2.0338876247406006,2025-02-16 01:08:36.328464,2025-02-16 01:11:20.337088,0 days 00:02:44.008624,softplus,128,,4,90,0.002115872962272541,4,432,False,COMPLETE
2251,2.033137798309326,2025-02-16 01:11:20.349591,2025-02-16 01:16:28.705272,0 days 00:05:08.355681,softplus,128,,4,90,0.002029470750997241,4,432,False,COMPLETE
2252,3.387063980102539,2025-02-16 01:16:28.718764,2025-02-16 01:16:34.944200,0 days 00:00:06.225436,softplus,128,,4,90,0.0018691569552500313,4,432,False,PRUNED
2253,1.9920873641967773,2025-02-16 01:16:34.965366,2025-02-16 01:17:59.336873,0 days 00:01:24.371507,softplus,128,,4,90,0.0019618654098994158,4,400,False,COMPLETE
2254,2.016551971435547,2025-02-16 01:17:59.371857,2025-02-16 01:19:14.659053,0 days 00:01:15.287196,softplus,128,,4,90,0.001956256972185731,4,400,False,COMPLETE
2255,2.031198263168335,2025-02-16 01:19:14.672932,2025-02-16 01:21:56.555813,0 days 00:02:41.882881,softplus,128,,4,90,0.0019046149157211575,4,400,False,COMPLETE
2256,2.0469396114349365,2025-02-16 01:21:56.579932,2025-02-16 01:23:17.260334,0 days 00:01:20.680402,softplus,128,,4,90,0.0019208802706213782,4,384,False,COMPLETE
2257,2.0566563606262207,2025-02-16 01:23:17.273866,2025-02-16 01:24:43.470961,0 days 00:01:26.197095,softplus,128,,4,90,0.0019112674525653907,4,400,False,COMPLETE
2258,2.0469284057617188,2025-02-16 01:24:43.485088,2025-02-16 01:26:14.288074,0 days 00:01:30.802986,softplus,128,,4,90,0.002083485356448221,4,400,False,COMPLETE
2259,2.0239691734313965,2025-02-16 01:26:14.301745,2025-02-16 01:27:50.764426,0 days 00:01:36.462681,softplus,128,,4,90,0.002447816030016496,4,400,False,COMPLETE
2260,2.0293946266174316,2025-02-16 01:27:50.801314,2025-02-16 01:29:19.020436,0 days 00:01:28.219122,softplus,128,,4,90,0.002421006914992412,4,384,False,COMPLETE
2261,2.0429728031158447,2025-02-16 01:29:19.042950,2025-02-16 01:31:05.930871,0 days 00:01:46.887921,softplus,128,,4,90,0.0025427707986127542,4,416,False,COMPLETE
2262,2.9023220539093018,2025-02-16 01:31:05.945133,2025-02-16 01:31:12.122348,0 days 00:00:06.177215,softplus,128,,4,90,0.0021070911608207523,4,400,False,PRUNED
2263,2.0213778018951416,2025-02-16 01:31:12.143429,2025-02-16 01:32:46.279786,0 days 00:01:34.136357,softplus,128,,4,90,0.002428240801596615,4,416,False,COMPLETE
2264,2.0124776363372803,2025-02-16 01:32:46.302402,2025-02-16 01:34:10.899257,0 days 00:01:24.596855,softplus,128,,4,90,0.0024496237761817766,4,400,False,COMPLETE
2265,2.030856132507324,2025-02-16 01:34:10.923188,2025-02-16 01:36:34.385818,0 days 00:02:23.462630,softplus,128,,4,90,0.0024559612205623067,4,400,False,COMPLETE
2266,2.034825563430786,2025-02-16 01:36:34.398806,2025-02-16 01:37:52.861368,0 days 00:01:18.462562,softplus,128,,4,90,0.002911700094956378,4,384,False,COMPLETE
2267,1.9844329357147217,2025-02-16 01:37:52.883892,2025-02-16 01:39:39.265180,0 days 00:01:46.381288,softplus,128,,4,90,0.0021337077624273464,4,400,False,COMPLETE
2268,2.0345797538757324,2025-02-16 01:39:39.278064,2025-02-16 01:42:35.771719,0 days 00:02:56.493655,softplus,128,,4,90,0.0020586543079908755,4,400,False,COMPLETE
2269,6.719517707824707,2025-02-16 01:42:35.785090,2025-02-16 01:42:42.952148,0 days 00:00:07.167058,softplus,128,0.5,4,90,0.0025039968114304273,4,400,True,PRUNED
2270,3.305346727371216,2025-02-16 01:42:42.972919,2025-02-16 01:43:11.582662,0 days 00:00:28.609743,softplus,128,,4,90,0.0019391396546437293,4,384,False,PRUNED
2271,2.0173163414001465,2025-02-16 01:43:11.607526,2025-02-16 01:47:21.083989,0 days 00:04:09.476463,softplus,128,,4,90,0.0030094009722717073,4,416,False,COMPLETE
2272,2.006744623184204,2025-02-16 01:47:21.097596,2025-02-16 01:50:09.621115,0 days 00:02:48.523519,softplus,128,,4,90,0.0030865995142194927,4,416,False,COMPLETE
2273,2.0398199558258057,2025-02-16 01:50:09.634912,2025-02-16 01:52:37.379964,0 days 00:02:27.745052,softplus,128,,4,90,0.0031072762789704634,4,400,False,COMPLETE
2274,2.039503574371338,2025-02-16 01:52:37.402939,2025-02-16 01:57:16.138170,0 days 00:04:38.735231,softplus,128,,4,90,0.003046729795118336,4,416,False,COMPLETE
2275,2.006979465484619,2025-02-16 01:57:16.161486,2025-02-16 01:59:33.901104,0 days 00:02:17.739618,softplus,128,,4,90,0.002120586599137442,4,384,False,COMPLETE
2276,2.0127005577087402,2025-02-16 01:59:33.913860,2025-02-16 02:04:19.511981,0 days 00:04:45.598121,softplus,128,,4,90,0.0018619153943403473,4,384,False,COMPLETE
2277,2.0339183807373047,2025-02-16 02:04:19.535665,2025-02-16 02:06:39.682333,0 days 00:02:20.146668,softplus,128,,4,90,0.0018650170519126518,4,384,False,COMPLETE
2278,2.0306286811828613,2025-02-16 02:06:39.695306,2025-02-16 02:11:12.001176,0 days 00:04:32.305870,softplus,128,,4,90,0.0021253979219488465,4,416,False,COMPLETE
2279,2.0412392616271973,2025-02-16 02:11:12.014411,2025-02-16 02:13:25.439573,0 days 00:02:13.425162,softplus,128,,4,90,0.001919820985283418,4,416,False,COMPLETE
2280,2.0443453788757324,2025-02-16 02:13:25.470526,2025-02-16 02:15:37.848229,0 days 00:02:12.377703,softplus,128,,4,90,0.0018130948462098601,4,384,False,COMPLETE
