number,value,datetime_start,datetime_complete,duration,params_activation,params_batch_size,params_dropout_rate,params_embedding_dim,params_epochs,params_learning_rate,params_n_hidden_layers,params_units_per_layer,params_use_dropout,state
2076,2.779554605484009,2025-02-02 20:53:46.174088,2025-02-02 20:53:50.564817,0 days 00:00:04.390729,softplus,256,,16,80,0.0009371609602615839,4,512,False,PRUNED
2077,3.037398099899292,2025-02-02 20:53:50.574500,2025-02-02 20:53:53.111967,0 days 00:00:02.537467,softplus,256,,4,90,0.00031710568160857767,4,496,False,PRUNED
2078,2.5595383644104004,2025-02-02 20:53:53.129577,2025-02-02 20:53:56.626923,0 days 00:00:03.497346,softplus,256,,4,80,0.00010144857122619705,3,512,False,PRUNED
2079,2.609151840209961,2025-02-02 20:53:56.646399,2025-02-02 20:54:00.245037,0 days 00:00:03.598638,softplus,256,,2,90,0.00011318215945883276,4,496,False,PRUNED
2080,2.540923833847046,2025-02-02 20:54:00.265369,2025-02-02 20:54:05.870364,0 days 00:00:05.604995,relu,256,,4,100,0.000746259400136019,4,512,False,PRUNED
2081,2.9048545360565186,2025-02-02 20:54:05.887337,2025-02-02 20:54:08.603781,0 days 00:00:02.716444,softplus,256,,8,90,0.00017230761872149417,4,464,False,PRUNED
2082,2.9629993438720703,2025-02-02 20:54:08.622397,2025-02-02 20:54:12.929441,0 days 00:00:04.307044,tanh,1024,,4,90,0.0030652503542412525,4,512,False,PRUNED
2083,3.1579253673553467,2025-02-02 20:54:12.946612,2025-02-02 20:54:16.283693,0 days 00:00:03.337081,softplus,128,,4,20,0.0001013585757326739,3,496,False,PRUNED
2084,3.4913671016693115,2025-02-02 20:54:16.300696,2025-02-02 20:54:19.218117,0 days 00:00:02.917421,selu,256,,64,80,0.00533935160543276,4,480,False,PRUNED
2085,2.8129985332489014,2025-02-02 20:54:19.235284,2025-02-02 20:54:21.700266,0 days 00:00:02.464982,softplus,256,,4,70,0.004844643071345854,4,512,False,PRUNED
2086,2.8206136226654053,2025-02-02 20:54:21.719331,2025-02-02 20:54:25.371813,0 days 00:00:03.652482,softplus,256,,4,90,0.00012463420578106868,4,512,False,PRUNED
2087,2.867640733718872,2025-02-02 20:54:25.390997,2025-02-02 20:54:27.682828,0 days 00:00:02.291831,softplus,256,,4,90,0.00010109187223120288,4,496,False,PRUNED
2088,2.985854387283325,2025-02-02 20:54:27.700289,2025-02-02 20:54:29.855276,0 days 00:00:02.154987,softplus,256,,4,100,0.00010109447481791863,3,512,False,PRUNED
2089,2.757446527481079,2025-02-02 20:54:29.873834,2025-02-02 20:54:32.602547,0 days 00:00:02.728713,softplus,256,,8,90,0.00011268303910273386,4,496,False,PRUNED
2090,3.2370636463165283,2025-02-02 20:54:32.621184,2025-02-02 20:54:35.164251,0 days 00:00:02.543067,softplus,256,,4,90,0.0019639783800827,4,480,False,PRUNED
2091,8.613728523254395,2025-02-02 20:54:35.181599,2025-02-02 20:54:38.122139,0 days 00:00:02.940540,softplus,128,,4,80,0.006159529574768382,2,496,False,PRUNED
2092,3.243114471435547,2025-02-02 20:54:38.363048,2025-02-02 20:54:41.146198,0 days 00:00:02.783150,selu,256,,32,90,0.00011348391852675754,4,512,False,PRUNED
2093,49.57862854003906,2025-02-02 20:54:41.166651,2025-02-02 20:54:44.983858,0 days 00:00:03.817207,softplus,256,0.4,4,90,0.00010120522522088275,4,512,True,PRUNED
2094,2.690450668334961,2025-02-02 20:54:45.002754,2025-02-02 20:54:48.846610,0 days 00:00:03.843856,relu,256,,4,60,0.0005627951087861326,4,512,False,PRUNED
2095,2.5461349487304688,2025-02-02 20:54:48.865916,2025-02-02 20:54:51.598378,0 days 00:00:02.732462,softplus,512,,4,90,0.00010126265123691592,4,496,False,PRUNED
2096,2.7074849605560303,2025-02-02 20:54:51.617039,2025-02-02 20:54:54.965766,0 days 00:00:03.348727,gelu,256,,8,80,0.006826536117663383,3,496,False,PRUNED
2097,2.509592294692993,2025-02-02 20:54:54.982635,2025-02-02 20:54:58.663734,0 days 00:00:03.681099,softplus,256,,4,90,0.00022760803909394306,4,512,False,PRUNED
2098,2.7952940464019775,2025-02-02 20:54:58.681790,2025-02-02 20:55:01.013772,0 days 00:00:02.331982,softplus,256,,4,100,0.001265223085708856,4,480,False,PRUNED
2099,2.611865997314453,2025-02-02 20:55:01.032747,2025-02-02 20:55:04.488249,0 days 00:00:03.455502,softplus,256,,4,90,0.0003597969129731685,4,512,False,PRUNED
2100,3.822094202041626,2025-02-02 20:55:04.506324,2025-02-02 20:55:07.898795,0 days 00:00:03.392471,softplus,128,,4,80,0.0001416279376268091,3,32,False,PRUNED
2101,2.55307936668396,2025-02-02 20:55:07.918310,2025-02-02 20:55:11.334895,0 days 00:00:03.416585,softplus,256,,4,90,0.0015105987723012014,4,480,False,PRUNED
2102,2.8893635272979736,2025-02-02 20:55:11.352539,2025-02-02 20:55:14.039655,0 days 00:00:02.687116,selu,256,,4,90,0.00010131118457715542,4,496,False,PRUNED
2103,2.981207847595215,2025-02-02 20:55:14.059340,2025-02-02 20:55:17.661010,0 days 00:00:03.601670,softplus,256,,16,90,0.001002532439161755,4,512,False,PRUNED
2104,4.310497760772705,2025-02-02 20:55:17.680073,2025-02-02 20:55:21.164292,0 days 00:00:03.484219,softplus,256,,8,80,0.0037718353813192113,4,496,False,PRUNED
2105,2.5802195072174072,2025-02-02 20:55:21.180378,2025-02-02 20:55:24.592577,0 days 00:00:03.412199,softplus,256,,4,90,0.00012241399906596942,3,512,False,PRUNED
2106,2.816497564315796,2025-02-02 20:55:24.609673,2025-02-02 20:55:26.535153,0 days 00:00:01.925480,softplus,1024,,4,90,0.0014907275237515077,4,512,False,PRUNED
2107,3.0320143699645996,2025-02-02 20:55:26.555277,2025-02-02 20:55:31.542352,0 days 00:00:04.987075,tanh,256,,4,100,0.00010120977259758996,4,448,False,PRUNED
2108,2.766792058944702,2025-02-02 20:55:31.561162,2025-02-02 20:55:34.976692,0 days 00:00:03.415530,softplus,256,,2,90,0.00023889421248560826,4,496,False,PRUNED
2109,2.954925775527954,2025-02-02 20:55:34.996039,2025-02-02 20:55:39.619102,0 days 00:00:04.623063,relu,256,,4,80,0.0006268373594747763,4,512,False,PRUNED
2110,3.4693994522094727,2025-02-02 20:55:39.637154,2025-02-02 20:55:45.049052,0 days 00:00:05.411898,softplus,128,,4,70,0.0011987353269143604,4,496,False,PRUNED
2111,2.898069143295288,2025-02-02 20:55:45.066497,2025-02-02 20:55:49.175543,0 days 00:00:04.109046,softplus,256,,4,10,0.0013424073557816365,3,512,False,PRUNED
2112,5.47866678237915,2025-02-02 20:55:49.193370,2025-02-02 20:55:53.629903,0 days 00:00:04.436533,softplus,256,0.30000000000000004,8,90,0.001653367837971467,5,496,True,PRUNED
2113,2.5790293216705322,2025-02-02 20:55:53.650332,2025-02-02 20:55:57.066715,0 days 00:00:03.416383,selu,256,,4,90,0.00010127647501800756,4,480,False,PRUNED
2114,3.2061474323272705,2025-02-02 20:55:57.085193,2025-02-02 20:55:59.377311,0 days 00:00:02.292118,softplus,256,,4,90,0.0001012206419223244,4,512,False,PRUNED
2115,3.3778467178344727,2025-02-02 20:55:59.396748,2025-02-02 20:56:03.780284,0 days 00:00:04.383536,softplus,256,,64,100,0.004436304344725256,4,496,False,PRUNED
2116,2.7595765590667725,2025-02-02 20:56:03.801016,2025-02-02 20:56:06.177013,0 days 00:00:02.375997,softplus,256,,4,90,0.00011319372893777333,4,512,False,PRUNED
2117,2.79632830619812,2025-02-02 20:56:06.194207,2025-02-02 20:56:08.746269,0 days 00:00:02.552062,softplus,256,,4,90,0.0001340989975963695,4,496,False,PRUNED
2118,2.7894480228424072,2025-02-02 20:56:08.764833,2025-02-02 20:56:10.976234,0 days 00:00:02.211401,softplus,512,,4,80,0.00010128725332785233,4,512,False,PRUNED
2119,3.6408114433288574,2025-02-02 20:56:10.994388,2025-02-02 20:56:16.067844,0 days 00:00:05.073456,softplus,128,,8,90,0.00018102541606255623,3,512,False,PRUNED
2120,2.858881711959839,2025-02-02 20:56:16.084465,2025-02-02 20:56:19.012731,0 days 00:00:02.928266,softplus,256,,32,80,0.00011268676011404932,4,480,False,PRUNED
2121,3.165536403656006,2025-02-02 20:56:19.031570,2025-02-02 20:56:21.346899,0 days 00:00:02.315329,selu,256,,4,90,0.0017365867589326323,4,496,False,PRUNED
2122,2.7478888034820557,2025-02-02 20:56:21.366282,2025-02-02 20:56:25.290830,0 days 00:00:03.924548,gelu,256,,4,90,0.00012350779243059705,4,496,False,PRUNED
2123,3.2324650287628174,2025-02-02 20:56:25.310272,2025-02-02 20:56:27.798990,0 days 00:00:02.488718,softplus,256,,4,100,0.00010105868711755241,4,400,False,PRUNED
2124,2.9513580799102783,2025-02-02 20:56:27.817782,2025-02-02 20:56:32.720249,0 days 00:00:04.902467,relu,256,,4,90,0.00010135048829038211,3,416,False,PRUNED
2125,2.5837066173553467,2025-02-02 20:56:32.738598,2025-02-02 20:56:36.500831,0 days 00:00:03.762233,softplus,256,,4,80,0.00015130578093869898,4,512,False,PRUNED
2126,3.0449376106262207,2025-02-02 20:56:36.519380,2025-02-02 20:56:38.993987,0 days 00:00:02.474607,softplus,256,,4,90,0.00029863565303490594,4,368,False,PRUNED
2127,2.5960750579833984,2025-02-02 20:56:39.014261,2025-02-02 20:56:42.788051,0 days 00:00:03.773790,softplus,256,,8,90,0.00263690891470736,4,320,False,PRUNED
2128,2.690711259841919,2025-02-02 20:56:42.806292,2025-02-02 20:56:48.114712,0 days 00:00:05.308420,softplus,128,,4,40,0.0001012864228560394,4,480,False,PRUNED
2129,3.0795233249664307,2025-02-02 20:56:48.131793,2025-02-02 20:56:51.577377,0 days 00:00:03.445584,softplus,256,,4,90,0.00020438203366550858,4,512,False,PRUNED
2130,2.832551956176758,2025-02-02 20:56:51.594776,2025-02-02 20:56:53.674091,0 days 00:00:02.079315,softplus,1024,,4,80,0.0004222086164084119,3,496,False,PRUNED
2131,3.460902690887451,2025-02-02 20:56:53.693733,2025-02-02 20:56:57.568654,0 days 00:00:03.874921,selu,256,0.1,4,90,0.0002708300258879387,4,512,True,PRUNED
2132,2.8957793712615967,2025-02-02 20:56:57.586108,2025-02-02 20:57:01.188918,0 days 00:00:03.602810,softplus,256,,16,100,0.00024977820364331855,4,512,False,PRUNED
2133,2.8792386054992676,2025-02-02 20:57:01.206130,2025-02-02 20:57:04.032158,0 days 00:00:02.826028,softplus,256,,2,90,0.0001123430780768071,4,480,False,PRUNED
2134,2.966539144515991,2025-02-02 20:57:04.051780,2025-02-02 20:57:06.408796,0 days 00:00:02.357016,softplus,256,,4,90,0.0029491632412994664,4,512,False,PRUNED
2135,3.038539171218872,2025-02-02 20:57:06.427541,2025-02-02 20:57:08.884817,0 days 00:00:02.457276,softplus,256,,8,80,0.00010139156194224124,3,496,False,PRUNED
2136,2.829303026199341,2025-02-02 20:57:08.903553,2025-02-02 20:57:11.464892,0 days 00:00:02.561339,relu,256,,4,90,0.00012175583309142527,4,512,False,PRUNED
2137,2.6906485557556152,2025-02-02 20:57:11.483215,2025-02-02 20:57:16.694490,0 days 00:00:05.211275,softplus,128,,4,90,0.00010104166356331935,4,512,False,PRUNED
2138,3.0393240451812744,2025-02-02 20:57:16.712469,2025-02-02 20:57:21.600909,0 days 00:00:04.888440,tanh,256,,4,100,0.00010127740088691545,4,496,False,PRUNED
2139,2.5677452087402344,2025-02-02 20:57:21.619485,2025-02-02 20:57:25.172433,0 days 00:00:03.552948,softplus,256,,4,80,0.00011370793267131579,4,464,False,PRUNED
2140,2.7448480129241943,2025-02-02 20:57:25.191915,2025-02-02 20:57:29.263632,0 days 00:00:04.071717,softplus,256,,64,90,0.0005563585805715587,3,496,False,PRUNED
2141,2.9681172370910645,2025-02-02 20:57:29.282445,2025-02-02 20:57:32.835060,0 days 00:00:03.552615,selu,256,,4,60,0.00010128446486699729,4,512,False,PRUNED
2142,3.0730936527252197,2025-02-02 20:57:32.852389,2025-02-02 20:57:35.238431,0 days 00:00:02.386042,softplus,256,,4,90,0.00010125035374621798,4,512,False,PRUNED
2143,2.605760335922241,2025-02-02 20:57:35.258095,2025-02-02 20:57:38.963792,0 days 00:00:03.705697,softplus,256,,8,90,0.00013096794598836998,4,496,False,PRUNED
2144,3.776991605758667,2025-02-02 20:57:38.983410,2025-02-02 20:57:41.149970,0 days 00:00:02.166560,softplus,512,,4,70,0.00010119477680210428,4,480,False,PRUNED
2145,2.5064377784729004,2025-02-02 20:57:41.169612,2025-02-02 20:57:44.559525,0 days 00:00:03.389913,softplus,256,,4,90,0.0001644983246325589,4,496,False,PRUNED
2146,2.8208162784576416,2025-02-02 20:57:44.577308,2025-02-02 20:57:46.979842,0 days 00:00:02.402534,softplus,256,,4,80,0.00014265611919710248,3,512,False,PRUNED
2147,3.1033849716186523,2025-02-02 20:57:46.999734,2025-02-02 20:57:50.765287,0 days 00:00:03.765553,gelu,128,,32,90,0.00011478462334467787,4,496,False,PRUNED
2148,2.503366231918335,2025-02-02 20:57:50.783009,2025-02-02 20:57:54.214240,0 days 00:00:03.431231,softplus,256,,4,100,0.0024279015174286794,4,512,False,PRUNED
2149,62.6593017578125,2025-02-02 20:57:54.230637,2025-02-02 20:57:58.189007,0 days 00:00:03.958370,softplus,256,0.30000000000000004,4,90,0.0001131778081680791,4,240,True,PRUNED
2150,2.7878763675689697,2025-02-02 20:57:58.206721,2025-02-02 20:58:00.751595,0 days 00:00:02.544874,selu,256,,8,80,0.00010118353627242635,4,512,False,PRUNED
2151,2.7318851947784424,2025-02-02 20:58:00.769227,2025-02-02 20:58:04.231505,0 days 00:00:03.462278,softplus,256,,4,90,0.0077333784949503125,3,496,False,PRUNED
2152,2.6465189456939697,2025-02-02 20:58:04.248878,2025-02-02 20:58:07.725201,0 days 00:00:03.476323,softplus,256,,4,90,0.00012368443018165111,4,480,False,PRUNED
2153,2.7666642665863037,2025-02-02 20:58:07.742524,2025-02-02 20:58:11.397793,0 days 00:00:03.655269,relu,1024,,4,90,0.0020156497216961104,4,512,False,PRUNED
2154,2.8961472511291504,2025-02-02 20:58:11.416759,2025-02-02 20:58:14.065770,0 days 00:00:02.649011,softplus,256,,4,80,0.00021204448399308085,4,512,False,PRUNED
2155,2.9553349018096924,2025-02-02 20:58:14.086160,2025-02-02 20:58:16.398739,0 days 00:00:02.312579,softplus,256,,4,90,0.0037489911757165434,4,496,False,PRUNED
2156,3.0744786262512207,2025-02-02 20:58:16.417415,2025-02-02 20:58:19.818700,0 days 00:00:03.401285,softplus,128,,4,100,0.002142059426534929,4,512,False,PRUNED
2157,2.857311248779297,2025-02-02 20:58:19.838134,2025-02-02 20:58:22.153029,0 days 00:00:02.314895,softplus,256,,8,90,0.00010138796535930284,3,464,False,PRUNED
2158,3.9068918228149414,2025-02-02 20:58:22.170996,2025-02-02 20:58:24.489343,0 days 00:00:02.318347,softplus,256,,4,90,0.0005844417673778429,4,496,False,PRUNED
2159,3.0579726696014404,2025-02-02 20:58:24.509327,2025-02-02 20:58:28.453951,0 days 00:00:03.944624,softplus,256,,2,90,0.00010123377397502736,4,512,False,PRUNED
2160,3.425171136856079,2025-02-02 20:58:28.472094,2025-02-02 20:58:31.041322,0 days 00:00:02.569228,softplus,256,,16,80,0.0010507602527025075,4,432,False,PRUNED
2161,2.716217041015625,2025-02-02 20:58:31.058985,2025-02-02 20:58:37.031093,0 days 00:00:05.972108,tanh,256,,4,90,0.0011848655267832746,4,480,False,PRUNED
2162,3.759479284286499,2025-02-02 20:58:37.048376,2025-02-02 20:58:39.754406,0 days 00:00:02.706030,selu,256,,4,50,0.0009167305335681234,3,512,False,PRUNED
2163,2.8891239166259766,2025-02-02 20:58:39.772094,2025-02-02 20:58:42.103288,0 days 00:00:02.331194,softplus,256,,4,90,0.00010141202640573721,4,496,False,PRUNED
2164,2.958838939666748,2025-02-02 20:58:42.121931,2025-02-02 20:58:44.728687,0 days 00:00:02.606756,softplus,256,,4,80,0.0007737885428556323,4,512,False,PRUNED
2165,2.880270481109619,2025-02-02 20:58:44.748491,2025-02-02 20:58:49.625455,0 days 00:00:04.876964,relu,256,,8,100,0.00010122782015136316,4,496,False,PRUNED
2166,2.8332486152648926,2025-02-02 20:58:49.645418,2025-02-02 20:58:52.868608,0 days 00:00:03.223190,softplus,128,,4,90,0.00011321054165072295,4,512,False,PRUNED
2167,2.8827290534973145,2025-02-02 20:58:52.886836,2025-02-02 20:58:55.086127,0 days 00:00:02.199291,softplus,512,,4,90,0.0001323997671069347,4,496,False,PRUNED
2168,7.089230060577393,2025-02-02 20:58:55.103941,2025-02-02 20:58:58.911582,0 days 00:00:03.807641,softplus,256,0.5,4,90,0.0053094722154022585,4,512,True,PRUNED
2169,2.9703562259674072,2025-02-02 20:58:58.930042,2025-02-02 20:59:02.046534,0 days 00:00:03.116492,softplus,256,,4,90,0.0008260886453355694,3,496,False,PRUNED
2170,2.8303849697113037,2025-02-02 20:59:02.063892,2025-02-02 20:59:04.683551,0 days 00:00:02.619659,selu,256,,4,80,0.00016087944235440642,4,512,False,PRUNED
2171,14.427605628967285,2025-02-02 20:59:04.700804,2025-02-02 20:59:07.538731,0 days 00:00:02.837927,softplus,256,,64,90,0.00010128542810204179,5,16,False,PRUNED
2172,2.7868146896362305,2025-02-02 20:59:07.557452,2025-02-02 20:59:10.103392,0 days 00:00:02.545940,softplus,256,,4,90,0.0014323221707782175,4,496,False,PRUNED
2173,3.014345645904541,2025-02-02 20:59:10.123196,2025-02-02 20:59:12.614832,0 days 00:00:02.491636,softplus,256,,8,100,0.0007313288019298781,4,336,False,PRUNED
2174,3.0735156536102295,2025-02-02 20:59:12.632896,2025-02-02 20:59:14.981136,0 days 00:00:02.348240,softplus,256,,4,70,0.00031056937424936415,4,512,False,PRUNED
2175,2.6432223320007324,2025-02-02 20:59:14.999439,2025-02-02 20:59:19.822409,0 days 00:00:04.822970,gelu,128,,4,80,0.00036977298248383245,1,480,False,PRUNED
2176,,2025-02-15 22:50:13.558957,2025-02-15 22:50:14.389647,0 days 00:00:00.830690,softplus,256,,4,90,0.000192395330163969,3,512,False,FAIL
2177,,2025-02-15 22:57:52.248036,2025-02-15 22:57:57.264207,0 days 00:00:05.016171,softplus,256,,32,90,0.00011336688744827116,3,512,False,FAIL
2178,2.9267940521240234,2025-02-15 23:02:42.203872,2025-02-15 23:02:47.124014,0 days 00:00:04.920142,softplus,256,,32,90,0.00010130094591029616,3,512,False,PRUNED
2179,,2025-02-15 23:02:47.135101,2025-02-15 23:02:52.522650,0 days 00:00:05.387549,softplus,256,,4,90,0.00011296760095170916,4,480,False,FAIL
2180,,2025-02-15 23:05:49.921343,2025-02-15 23:06:30.001587,0 days 00:00:40.080244,softplus,256,,4,90,0.00041771198872305533,4,496,False,FAIL
2181,2.44197154045105,2025-02-15 23:14:35.056567,2025-02-15 23:14:48.817158,0 days 00:00:13.760591,softplus,256,,4,90,0.0001130057706575192,4,480,False,PRUNED
2182,2.6960794925689697,2025-02-15 23:14:48.838264,2025-02-15 23:14:57.315987,0 days 00:00:08.477723,softplus,256,,4,90,0.00010120582097994305,4,496,False,PRUNED
2183,2.9493823051452637,2025-02-15 23:14:57.337795,2025-02-15 23:14:59.505244,0 days 00:00:02.167449,relu,1024,,4,80,0.00019162179948057753,4,512,False,PRUNED
2184,4.222991943359375,2025-02-15 23:14:59.535628,2025-02-15 23:15:03.460996,0 days 00:00:03.925368,selu,256,,4,90,0.006581590913050176,4,496,False,PRUNED
2185,3.7395949363708496,2025-02-15 23:15:03.492578,2025-02-15 23:15:07.714676,0 days 00:00:04.222098,softplus,256,,8,90,0.00025072648222645825,4,512,False,PRUNED
2186,7.721044540405273,2025-02-15 23:15:07.735784,2025-02-15 23:15:10.777584,0 days 00:00:03.041800,softplus,256,,4,100,0.005793968004492169,2,512,False,PRUNED
2187,3.3904848098754883,2025-02-15 23:15:10.799133,2025-02-15 23:15:21.958190,0 days 00:00:11.159057,softplus,256,,4,90,0.000475274979713762,3,496,False,PRUNED
2188,2.0446677207946777,2025-02-15 23:15:21.978156,2025-02-15 23:16:45.799286,0 days 00:01:23.821130,softplus,128,,4,90,0.002211934526479409,4,480,False,COMPLETE
2189,2.0243442058563232,2025-02-15 23:16:45.813651,2025-02-15 23:18:14.539172,0 days 00:01:28.725521,softplus,128,,4,90,0.0026927324033116404,4,480,False,COMPLETE
2190,2.036468982696533,2025-02-15 23:18:14.553224,2025-02-15 23:21:07.619224,0 days 00:02:53.066000,softplus,128,,4,90,0.0022310398527013134,4,464,False,COMPLETE
2191,2.0336225032806396,2025-02-15 23:21:07.632778,2025-02-15 23:22:30.226961,0 days 00:01:22.594183,softplus,128,,4,90,0.0023159875746883844,4,464,False,COMPLETE
2192,2.0464980602264404,2025-02-15 23:22:30.239757,2025-02-15 23:24:00.289363,0 days 00:01:30.049606,softplus,128,,4,90,0.0027250520744359547,4,464,False,COMPLETE
2193,2.0021514892578125,2025-02-15 23:24:00.302111,2025-02-15 23:25:25.901042,0 days 00:01:25.598931,softplus,128,,4,90,0.002428879948943586,4,464,False,COMPLETE
2194,2.052135944366455,2025-02-15 23:25:25.913496,2025-02-15 23:26:50.570167,0 days 00:01:24.656671,softplus,128,,4,90,0.0022986891739291424,4,464,False,COMPLETE
2195,2.047294855117798,2025-02-15 23:26:50.583334,2025-02-15 23:28:14.990528,0 days 00:01:24.407194,softplus,128,,4,90,0.0023125628376751326,4,432,False,COMPLETE
2196,2.0236759185791016,2025-02-15 23:28:15.219399,2025-02-15 23:30:42.398712,0 days 00:02:27.179313,softplus,128,,4,90,0.0021961011723334715,4,448,False,COMPLETE
2197,2.7855498790740967,2025-02-15 23:30:42.412861,2025-02-15 23:30:48.959688,0 days 00:00:06.546827,softplus,128,,4,90,0.0023076781505665246,4,448,False,PRUNED
2198,6.630128383636475,2025-02-15 23:30:48.980427,2025-02-15 23:30:56.711113,0 days 00:00:07.730686,softplus,128,0.4,4,30,0.0025181945109135333,4,448,True,PRUNED
2199,2.0489583015441895,2025-02-15 23:30:56.731146,2025-02-15 23:33:15.090053,0 days 00:02:18.358907,softplus,128,,4,90,0.0022232242433841086,4,448,False,COMPLETE
2200,2.043320655822754,2025-02-15 23:33:15.103151,2025-02-15 23:34:46.159966,0 days 00:01:31.056815,softplus,128,,4,90,0.0022288503769329416,4,448,False,COMPLETE
2201,2.0286858081817627,2025-02-15 23:34:46.172102,2025-02-15 23:36:09.736550,0 days 00:01:23.564448,softplus,128,,4,90,0.0022734284092323803,4,432,False,COMPLETE
2202,2.068251609802246,2025-02-15 23:36:09.749807,2025-02-15 23:37:34.542466,0 days 00:01:24.792659,softplus,128,,4,90,0.0023038870436413793,4,432,False,COMPLETE
2203,3.7722928524017334,2025-02-15 23:37:34.555122,2025-02-15 23:37:41.554998,0 days 00:00:06.999876,softplus,128,,4,90,0.002246970239006824,4,432,False,PRUNED
2204,1.9885663986206055,2025-02-15 23:37:41.576210,2025-02-15 23:39:07.315034,0 days 00:01:25.738824,softplus,128,,4,90,0.0022825619775502575,4,432,False,COMPLETE
2205,2.06180477142334,2025-02-15 23:39:07.327851,2025-02-15 23:40:46.533942,0 days 00:01:39.206091,softplus,128,,4,90,0.0023165356850913905,4,432,False,COMPLETE
2206,2.0576422214508057,2025-02-15 23:40:46.547044,2025-02-15 23:42:08.296332,0 days 00:01:21.749288,softplus,128,,4,90,0.0022540766463083075,4,432,False,COMPLETE
2207,2.0204665660858154,2025-02-15 23:42:08.309913,2025-02-15 23:44:32.624798,0 days 00:02:24.314885,softplus,128,,4,90,0.002329107759162121,4,432,False,COMPLETE
2208,2.0133931636810303,2025-02-15 23:44:32.637883,2025-02-15 23:45:54.661793,0 days 00:01:22.023910,softplus,128,,4,90,0.002332492532827054,4,432,False,COMPLETE
2209,2.753026008605957,2025-02-15 23:45:54.674748,2025-02-15 23:46:01.473565,0 days 00:00:06.798817,softplus,128,,4,90,0.002334159887970058,4,432,False,PRUNED
2210,2.0277369022369385,2025-02-15 23:46:01.494571,2025-02-15 23:48:31.531561,0 days 00:02:30.036990,softplus,128,,4,90,0.0022838862570933867,4,432,False,COMPLETE
