number,value,datetime_start,datetime_complete,duration,params_activation,params_batch_size,params_dropout_rate,params_embedding_dim,params_epochs,params_learning_rate,params_n_hidden_layers,params_units_per_layer,params_use_dropout,state
1220,2.6108086109161377,2025-01-28 01:17:42.073868,2025-01-28 01:17:45.526006,0 days 00:00:03.452138,selu,256,,4,100,0.002645698701949093,4,480,False,PRUNED
1221,2.605894088745117,2025-01-28 01:17:45.544450,2025-01-28 01:17:48.539457,0 days 00:00:02.995007,softplus,256,,4,90,0.00010227758041676101,3,512,False,PRUNED
1222,2.7634286880493164,2025-01-28 01:17:48.557286,2025-01-28 01:17:52.389123,0 days 00:00:03.831837,softplus,128,,4,90,0.0013169005271247694,5,496,False,PRUNED
1223,2.6897120475769043,2025-01-28 01:17:52.405819,2025-01-28 01:17:56.008268,0 days 00:00:03.602449,softplus,256,,16,90,0.0010232989533434241,4,496,False,PRUNED
1224,2.941647529602051,2025-01-28 01:17:56.026832,2025-01-28 01:17:58.315224,0 days 00:00:02.288392,softplus,256,,2,80,0.005704960201344411,4,480,False,PRUNED
1225,2.9029860496520996,2025-01-28 01:17:58.332662,2025-01-28 01:18:00.527730,0 days 00:00:02.195068,softplus,256,,4,90,0.004298762880224546,2,512,False,PRUNED
1226,2.8164680004119873,2025-01-28 01:18:00.546204,2025-01-28 01:18:03.022115,0 days 00:00:02.475911,tanh,256,,4,90,0.002736645165673352,4,512,False,PRUNED
1227,2.8617770671844482,2025-01-28 01:18:03.039399,2025-01-28 01:18:05.384776,0 days 00:00:02.345377,softplus,512,,4,100,0.0004255708035180804,4,512,False,PRUNED
1228,3.4228475093841553,2025-01-28 01:18:05.403113,2025-01-28 01:18:07.797982,0 days 00:00:02.394869,softplus,256,,8,90,0.00019553579988413198,3,496,False,PRUNED
1229,5.321467876434326,2025-01-28 01:18:07.816484,2025-01-28 01:18:11.573877,0 days 00:00:03.757393,selu,256,0.4,4,80,0.00011359034428843256,4,512,True,PRUNED
1230,3.0376923084259033,2025-01-28 01:18:11.590745,2025-01-28 01:18:13.954708,0 days 00:00:02.363963,softplus,256,,4,90,0.0006803128794905443,4,496,False,PRUNED
1231,3.0846524238586426,2025-01-28 01:18:13.973112,2025-01-28 01:18:20.752209,0 days 00:00:06.779097,softplus,128,,64,90,0.00010220148793644114,4,496,False,PRUNED
1232,2.572296619415283,2025-01-28 01:18:20.770597,2025-01-28 01:18:24.389077,0 days 00:00:03.618480,softplus,256,,4,90,0.00010224816923678363,4,512,False,PRUNED
1233,2.886960506439209,2025-01-28 01:18:24.407778,2025-01-28 01:18:29.398638,0 days 00:00:04.990860,relu,256,,4,80,0.00015524544021363473,3,480,False,PRUNED
1234,2.6776883602142334,2025-01-28 01:18:29.416093,2025-01-28 01:18:32.864855,0 days 00:00:03.448762,softplus,256,,4,90,0.000124330693083724,4,464,False,PRUNED
1235,4.008474826812744,2025-01-28 01:18:32.882453,2025-01-28 01:18:36.515858,0 days 00:00:03.633405,softplus,256,,8,100,0.00010221664857582033,4,512,False,PRUNED
1236,2.8729665279388428,2025-01-28 01:18:36.532973,2025-01-28 01:18:39.300731,0 days 00:00:02.767758,softplus,256,,4,90,0.00010235625333688835,4,496,False,PRUNED
1237,2.871809244155884,2025-01-28 01:18:39.320258,2025-01-28 01:18:41.775382,0 days 00:00:02.455124,softplus,256,,4,80,0.0001366552825463775,4,512,False,PRUNED
1238,2.990865468978882,2025-01-28 01:18:41.792048,2025-01-28 01:18:43.773451,0 days 00:00:01.981403,selu,1024,,4,90,0.0001778902745020892,4,480,False,PRUNED
1239,2.777276039123535,2025-01-28 01:18:43.791581,2025-01-28 01:18:46.353260,0 days 00:00:02.561679,softplus,256,,32,90,0.0001235083358217376,3,512,False,PRUNED
1240,3.1307373046875,2025-01-28 01:18:46.371355,2025-01-28 01:18:48.742315,0 days 00:00:02.370960,softplus,256,,4,90,0.0019616868665339932,4,112,False,PRUNED
1241,3.9677720069885254,2025-01-28 01:18:49.054966,2025-01-28 01:18:52.841131,0 days 00:00:03.786165,gelu,128,,4,90,0.0006591739257848795,4,512,False,PRUNED
1242,2.752465009689331,2025-01-28 01:18:52.858783,2025-01-28 01:18:56.256624,0 days 00:00:03.397841,softplus,256,,4,80,0.0003895304692619225,4,496,False,PRUNED
1243,2.5441946983337402,2025-01-28 01:18:56.276942,2025-01-28 01:18:59.857313,0 days 00:00:03.580371,softplus,256,,8,100,0.00011601147216238257,4,512,False,PRUNED
1244,3.1079533100128174,2025-01-28 01:18:59.873780,2025-01-28 01:19:03.188287,0 days 00:00:03.314507,softplus,256,,4,90,0.0011739902651205654,3,480,False,PRUNED
1245,2.6145293712615967,2025-01-28 01:19:03.205996,2025-01-28 01:19:08.233607,0 days 00:00:05.027611,softplus,256,,4,90,0.00010230027033148065,4,496,False,PRUNED
1246,2.514461040496826,2025-01-28 01:19:08.251973,2025-01-28 01:19:11.857247,0 days 00:00:03.605274,softplus,256,,4,90,0.00010221828781035936,4,512,False,PRUNED
1247,2.4834859371185303,2025-01-28 01:19:11.874560,2025-01-28 01:19:16.792223,0 days 00:00:04.917663,relu,256,,4,80,0.0019984502205580676,4,496,False,PRUNED
1248,3.2468185424804688,2025-01-28 01:19:16.820010,2025-01-28 01:19:20.561315,0 days 00:00:03.741305,selu,256,0.1,4,90,0.00010220896425484689,4,512,True,PRUNED
1249,3.4934332370758057,2025-01-28 01:19:20.580814,2025-01-28 01:19:23.769543,0 days 00:00:03.188729,softplus,128,,8,90,0.00030610445922522026,4,496,False,PRUNED
1250,2.5475447177886963,2025-01-28 01:19:24.088139,2025-01-28 01:19:28.425389,0 days 00:00:04.337250,softplus,256,,4,90,0.00011332090404167786,3,512,False,PRUNED
1251,2.9890310764312744,2025-01-28 01:19:28.444910,2025-01-28 01:19:30.600246,0 days 00:00:02.155336,softplus,512,,16,80,0.007885380511108462,4,496,False,PRUNED
1252,2.578007221221924,2025-01-28 01:19:30.618694,2025-01-28 01:19:34.198713,0 days 00:00:03.580019,softplus,256,,2,100,0.0006028758771197156,4,512,False,PRUNED
1253,2.6341278553009033,2025-01-28 01:19:34.217146,2025-01-28 01:19:37.328957,0 days 00:00:03.111811,tanh,256,,4,90,0.0015173789959434694,1,512,False,PRUNED
1254,3.2232682704925537,2025-01-28 01:19:37.345129,2025-01-28 01:19:39.603599,0 days 00:00:02.258470,softplus,256,,4,90,0.00010225521905393432,4,496,False,PRUNED
1255,2.8606059551239014,2025-01-28 01:19:39.918266,2025-01-28 01:19:42.434595,0 days 00:00:02.516329,softplus,256,,4,80,0.00034310589943614987,4,512,False,PRUNED
1256,2.8925063610076904,2025-01-28 01:19:42.452043,2025-01-28 01:19:45.622278,0 days 00:00:03.170235,softplus,256,,4,90,0.00011303622151612205,3,496,False,PRUNED
1257,2.5147392749786377,2025-01-28 01:19:45.640795,2025-01-28 01:19:49.272325,0 days 00:00:03.631530,softplus,256,,4,90,0.0002756851926382897,4,496,False,PRUNED
1258,2.9644975662231445,2025-01-28 01:19:49.288348,2025-01-28 01:19:52.208660,0 days 00:00:02.920312,selu,256,,64,100,0.00018999531556394584,4,480,False,PRUNED
1259,3.060333013534546,2025-01-28 01:19:52.225782,2025-01-28 01:19:55.954541,0 days 00:00:03.728759,softplus,128,,8,90,0.003677521777623539,4,512,False,PRUNED
1260,3.4252378940582275,2025-01-28 01:19:55.971121,2025-01-28 01:19:58.458724,0 days 00:00:02.487603,softplus,256,,4,80,0.0002317444444343648,4,512,False,PRUNED
1261,2.538508176803589,2025-01-28 01:19:58.477572,2025-01-28 01:20:04.541219,0 days 00:00:06.063647,relu,256,,4,90,0.0030816205734755264,4,432,False,PRUNED
1262,2.5418107509613037,2025-01-28 01:20:04.561121,2025-01-28 01:20:06.904147,0 days 00:00:02.343026,softplus,1024,,4,90,0.00013719119774696328,3,496,False,PRUNED
1263,2.499796152114868,2025-01-28 01:20:06.920409,2025-01-28 01:20:10.327551,0 days 00:00:03.407142,softplus,256,,4,90,0.0010916129784292645,4,512,False,PRUNED
1264,2.9331865310668945,2025-01-28 01:20:10.346570,2025-01-28 01:20:13.001915,0 days 00:00:02.655345,softplus,256,,4,80,0.0022164136603917244,4,496,False,PRUNED
1265,2.6515307426452637,2025-01-28 01:20:13.019400,2025-01-28 01:20:16.540640,0 days 00:00:03.521240,softplus,256,,8,90,0.00010193779357085814,4,384,False,PRUNED
1266,8.126290321350098,2025-01-28 01:20:16.557396,2025-01-28 01:20:20.804790,0 days 00:00:04.247394,softplus,256,0.5,32,100,0.0013856684336781345,4,480,True,PRUNED
1267,2.7869110107421875,2025-01-28 01:20:20.824509,2025-01-28 01:20:23.244125,0 days 00:00:02.419616,selu,256,,4,90,0.00011371182123464074,4,512,False,PRUNED
1268,2.8125412464141846,2025-01-28 01:20:23.260346,2025-01-28 01:20:26.586836,0 days 00:00:03.326490,softplus,128,,4,90,0.00011411428759940325,3,464,False,PRUNED
1269,2.5092809200286865,2025-01-28 01:20:26.604210,2025-01-28 01:20:30.548698,0 days 00:00:03.944488,gelu,256,,4,90,0.0001611984766751736,4,512,False,PRUNED
1270,2.535428285598755,2025-01-28 01:20:30.567533,2025-01-28 01:20:35.413421,0 days 00:00:04.845888,softplus,256,,4,90,0.00010216954992532577,4,512,False,PRUNED
1271,2.841317653656006,2025-01-28 01:20:35.430183,2025-01-28 01:20:37.851644,0 days 00:00:02.421461,softplus,256,,4,80,0.00010221706651751196,4,480,False,PRUNED
1272,2.7308661937713623,2025-01-28 01:20:37.870132,2025-01-28 01:20:41.473205,0 days 00:00:03.603073,softplus,256,,4,90,0.0001022818482966554,4,496,False,PRUNED
1273,2.8812594413757324,2025-01-28 12:21:18.407208,2025-01-28 12:21:21.395267,0 days 00:00:02.988059,softplus,256,,8,90,0.00012544323982380387,3,496,False,PRUNED
1274,3.0301272869110107,2025-01-28 12:21:21.403771,2025-01-28 12:21:24.008912,0 days 00:00:02.605141,softplus,256,,4,80,0.0008570290253953366,4,512,False,PRUNED
1275,2.793224573135376,2025-01-28 12:21:24.027404,2025-01-28 12:21:28.238665,0 days 00:00:04.211261,relu,512,,4,100,0.00010213820106499993,4,512,False,PRUNED
1276,3.241823673248291,2025-01-28 12:21:28.255276,2025-01-28 12:21:30.828188,0 days 00:00:02.572912,softplus,256,,4,90,0.00014837920588737255,4,496,False,PRUNED
1277,3.2221806049346924,2025-01-28 12:21:30.844935,2025-01-28 12:21:34.788985,0 days 00:00:03.944050,selu,256,,4,90,0.00011420739549922853,4,512,False,PRUNED
1278,3.4647676944732666,2025-01-28 12:21:34.807554,2025-01-28 12:21:40.136511,0 days 00:00:05.328957,tanh,128,,2,90,0.00401187323015856,4,496,False,PRUNED
1279,2.559760570526123,2025-01-28 12:21:40.153873,2025-01-28 12:21:43.500024,0 days 00:00:03.346151,softplus,256,,4,80,0.0010456099519475614,3,512,False,PRUNED
1280,2.515228271484375,2025-01-28 12:21:43.516902,2025-01-28 12:21:47.508319,0 days 00:00:03.991417,softplus,256,,16,90,0.00010192804147780953,4,496,False,PRUNED
1281,3.1168057918548584,2025-01-28 12:21:47.524808,2025-01-28 12:21:49.996050,0 days 00:00:02.471242,softplus,256,,4,100,0.00012748567907169142,4,512,False,PRUNED
1282,2.512099504470825,2025-01-28 12:21:50.014078,2025-01-28 12:21:54.187015,0 days 00:00:04.172937,softplus,256,,8,80,0.00010190060761395658,5,512,False,PRUNED
1283,2.7688357830047607,2025-01-28 12:21:54.204929,2025-01-28 12:21:56.731850,0 days 00:00:02.526921,softplus,256,,4,30,0.00010239188343031575,4,480,False,PRUNED
1284,2.759786367416382,2025-01-28 12:21:56.749917,2025-01-28 12:21:59.041827,0 days 00:00:02.291910,softplus,256,,4,90,0.0002080465021151908,4,496,False,PRUNED
1285,3.247849225997925,2025-01-28 12:21:59.058635,2025-01-28 12:22:03.220360,0 days 00:00:04.161725,softplus,256,0.2,64,90,0.006386611696857685,3,512,True,PRUNED
1286,3.34277081489563,2025-01-28 12:22:03.239578,2025-01-28 12:22:06.588023,0 days 00:00:03.348445,selu,128,,4,90,0.00010212638911329847,4,464,False,PRUNED
1287,3.0707101821899414,2025-01-28 12:22:06.607190,2025-01-28 12:22:08.491970,0 days 00:00:01.884780,softplus,1024,,4,90,0.0004216687313687848,4,496,False,PRUNED
1288,2.811349391937256,2025-01-28 12:22:08.510849,2025-01-28 12:22:10.977634,0 days 00:00:02.466785,softplus,256,,4,80,0.007840173348698541,4,304,False,PRUNED
1289,2.9015607833862305,2025-01-28 12:22:10.996686,2025-01-28 12:22:16.103147,0 days 00:00:05.106461,relu,256,,8,90,0.00011481444651068197,4,480,False,PRUNED
1290,3.206390142440796,2025-01-28 12:22:16.120172,2025-01-28 12:22:18.472092,0 days 00:00:02.351920,softplus,256,,4,90,0.00010202052152454195,4,512,False,PRUNED
1291,2.5414352416992188,2025-01-28 12:22:18.489351,2025-01-28 12:22:21.779196,0 days 00:00:03.289845,softplus,256,,4,100,0.0005217706898653561,3,496,False,PRUNED
1292,3.394338369369507,2025-01-28 12:22:21.796200,2025-01-28 12:22:24.538034,0 days 00:00:02.741834,gelu,256,,4,90,0.00017850647067578496,4,512,False,PRUNED
1293,2.6205742359161377,2025-01-28 12:22:24.556151,2025-01-28 12:22:28.394346,0 days 00:00:03.838195,softplus,256,,32,80,0.00011357905238908994,4,496,False,PRUNED
1294,2.83733868598938,2025-01-28 12:22:28.412020,2025-01-28 12:22:31.162789,0 days 00:00:02.750769,softplus,256,,4,90,0.00568075860099321,4,512,False,PRUNED
1295,2.940753221511841,2025-01-28 12:22:31.181413,2025-01-28 12:22:34.556079,0 days 00:00:03.374666,softplus,128,,4,90,0.000470243935698788,4,512,False,PRUNED
1296,3.6546504497528076,2025-01-28 12:22:34.572369,2025-01-28 12:22:36.793852,0 days 00:00:02.221483,softplus,256,,4,90,0.0002577280169046654,3,480,False,PRUNED
1297,2.9066059589385986,2025-01-28 12:22:36.811910,2025-01-28 12:22:39.253735,0 days 00:00:02.441825,softplus,256,,8,90,0.00013848364519870602,4,496,False,PRUNED
1298,2.5414698123931885,2025-01-28 12:22:39.270983,2025-01-28 12:22:42.767066,0 days 00:00:03.496083,selu,256,,4,40,0.00011305285254903697,4,512,False,PRUNED
1299,2.5816259384155273,2025-01-28 12:22:42.785184,2025-01-28 12:22:46.664912,0 days 00:00:03.879728,softplus,256,,4,80,0.00012689795628515935,4,512,False,PRUNED
1300,2.6151630878448486,2025-01-28 12:22:46.683782,2025-01-28 12:22:49.459920,0 days 00:00:02.776138,softplus,512,,4,100,0.0003324576465351465,4,496,False,PRUNED
1301,2.587203025817871,2025-01-28 12:22:49.476962,2025-01-28 12:22:52.992019,0 days 00:00:03.515057,softplus,256,,4,90,0.00010242445562121042,4,512,False,PRUNED
1302,2.556114435195923,2025-01-28 12:22:53.010585,2025-01-28 12:22:56.274756,0 days 00:00:03.264171,softplus,256,,4,90,0.00010202264806881098,3,496,False,PRUNED
1303,2.7832164764404297,2025-01-28 12:22:56.291823,2025-01-28 12:23:01.495308,0 days 00:00:05.203485,tanh,256,,8,80,0.001693476979274487,4,480,False,PRUNED
1304,65.33147430419922,2025-01-28 12:23:01.514655,2025-01-28 12:23:05.911888,0 days 00:00:04.397233,relu,256,0.30000000000000004,4,90,0.00015739027474922972,4,512,True,PRUNED
1305,2.932431221008301,2025-01-28 12:23:05.928187,2025-01-28 12:23:09.206402,0 days 00:00:03.278215,softplus,128,,4,90,0.006767392238013241,4,496,False,PRUNED
1306,3.509321689605713,2025-01-28 12:23:09.225791,2025-01-28 12:23:11.689301,0 days 00:00:02.463510,softplus,256,,2,20,0.0001023846283535276,4,288,False,PRUNED
1307,2.639277458190918,2025-01-28 12:23:11.708513,2025-01-28 12:23:15.538037,0 days 00:00:03.829524,softplus,256,,16,100,0.00010205636679407173,4,496,False,PRUNED
1308,2.8852360248565674,2025-01-28 12:23:15.557331,2025-01-28 12:23:17.973168,0 days 00:00:02.415837,selu,256,,4,90,0.005475330200257817,3,512,False,PRUNED
1309,2.5427842140197754,2025-01-28 12:23:17.991122,2025-01-28 12:23:21.628588,0 days 00:00:03.637466,softplus,256,,4,80,0.0005605514230064435,4,512,False,PRUNED
1310,3.1823976039886475,2025-01-28 12:23:21.645900,2025-01-28 12:23:24.047860,0 days 00:00:02.401960,softplus,256,,4,90,0.000787929016643384,4,496,False,PRUNED
1311,2.979146718978882,2025-01-28 12:23:24.065892,2025-01-28 12:23:25.947887,0 days 00:00:01.881995,softplus,1024,,4,90,0.00010182945587974089,4,512,False,PRUNED
1312,2.531684160232544,2025-01-28 12:23:25.966329,2025-01-28 12:23:29.721797,0 days 00:00:03.755468,softplus,256,,8,50,0.00012436992584356776,4,496,False,PRUNED
1313,2.5661733150482178,2025-01-28 12:23:29.738247,2025-01-28 12:23:33.365168,0 days 00:00:03.626921,softplus,256,,4,90,0.00010206940156915155,4,512,False,PRUNED
1314,2.9268150329589844,2025-01-28 12:23:33.383594,2025-01-28 12:23:37.168412,0 days 00:00:03.784818,softplus,128,,64,80,0.0003062168182386201,3,480,False,PRUNED
1315,3.01393985748291,2025-01-28 12:23:37.187376,2025-01-28 12:23:39.608338,0 days 00:00:02.420962,selu,256,,4,90,0.0002491074109616227,4,256,False,PRUNED
1316,3.0446536540985107,2025-01-28 12:23:39.624396,2025-01-28 12:23:42.279649,0 days 00:00:02.655253,softplus,256,,4,100,0.00011355463873903346,4,448,False,PRUNED
1317,3.1672472953796387,2025-01-28 12:23:42.296234,2025-01-28 12:23:45.226415,0 days 00:00:02.930181,gelu,256,,4,90,0.00010193428185548302,4,496,False,PRUNED
1318,2.9195315837860107,2025-01-28 12:23:45.245311,2025-01-28 12:23:49.922794,0 days 00:00:04.677483,relu,256,,4,90,0.00010205173245961706,2,352,False,PRUNED
1319,3.4852662086486816,2025-01-28 12:23:49.941060,2025-01-28 12:23:52.444315,0 days 00:00:02.503255,softplus,256,,8,80,0.00014173582606201383,4,512,False,PRUNED
1320,2.9345762729644775,2025-01-28 12:23:52.462919,2025-01-28 12:23:55.186850,0 days 00:00:02.723931,softplus,256,,4,90,0.0071458204913331085,5,480,False,PRUNED
1321,2.570633888244629,2025-01-28 12:23:55.205869,2025-01-28 12:23:58.884339,0 days 00:00:03.678470,softplus,256,,32,90,0.00011392654070859764,3,512,False,PRUNED
1322,2.531749963760376,2025-01-28 12:23:58.900179,2025-01-28 12:24:02.891008,0 days 00:00:03.990829,softplus,256,,4,80,0.00010194802888860561,4,496,False,PRUNED
1323,12.387354850769043,2025-01-28 12:24:02.908497,2025-01-28 12:24:07.765886,0 days 00:00:04.857389,softplus,128,0.4,4,90,0.00022267210799561225,4,512,True,PRUNED
1324,2.9620065689086914,2025-01-28 12:24:07.784619,2025-01-28 12:24:09.648293,0 days 00:00:01.863674,softplus,512,,4,90,0.0007539499403742624,4,496,False,PRUNED
1325,2.771998167037964,2025-01-28 12:24:09.666080,2025-01-28 12:24:12.149948,0 days 00:00:02.483868,softplus,256,,4,90,0.001451407380917235,4,80,False,PRUNED
1326,3.8732824325561523,2025-01-28 12:24:12.165833,2025-01-28 12:24:14.559515,0 days 00:00:02.393682,selu,256,,4,100,0.00010207777540563994,3,512,False,PRUNED
1327,3.2085087299346924,2025-01-28 12:24:14.577852,2025-01-28 12:24:18.138212,0 days 00:00:03.560360,softplus,256,,8,90,0.0002807121648683095,4,464,False,PRUNED
1328,3.1409621238708496,2025-01-28 12:24:18.155875,2025-01-28 12:24:20.579736,0 days 00:00:02.423861,softplus,256,,4,80,0.00010203969989856428,4,512,False,PRUNED
1329,3.452932596206665,2025-01-28 12:24:20.598136,2025-01-28 12:24:23.244382,0 days 00:00:02.646246,tanh,256,,4,90,0.0033488011721939464,4,480,False,PRUNED
1330,2.789764404296875,2025-01-28 12:24:23.261824,2025-01-28 12:24:25.939602,0 days 00:00:02.677778,softplus,256,,4,90,0.004840666859428848,4,512,False,PRUNED
1331,2.8046562671661377,2025-01-28 12:24:25.957998,2025-01-28 12:24:28.413935,0 days 00:00:02.455937,softplus,256,,4,100,0.00013447972346606127,4,496,False,PRUNED
1332,3.335395097732544,2025-01-28 12:24:28.431981,2025-01-28 12:24:33.822904,0 days 00:00:05.390923,relu,128,,16,90,0.0005804220866948257,3,496,False,PRUNED
1333,3.2175588607788086,2025-01-28 12:24:33.839550,2025-01-28 12:24:37.442261,0 days 00:00:03.602711,softplus,256,,4,80,0.00012325656321084794,4,512,False,PRUNED
1334,2.809798002243042,2025-01-28 12:24:37.460489,2025-01-28 12:24:39.466389,0 days 00:00:02.005900,softplus,1024,,2,90,0.00037922643537598015,4,480,False,PRUNED
1335,3.3003969192504883,2025-01-28 12:24:39.483621,2025-01-28 12:24:42.340020,0 days 00:00:02.856399,softplus,256,,4,90,0.00011328745650965415,4,512,False,PRUNED
1336,2.889972448348999,2025-01-28 12:24:42.358871,2025-01-28 12:24:45.046609,0 days 00:00:02.687738,selu,256,,8,90,0.0007206448480190505,4,512,False,PRUNED
1337,2.559390068054199,2025-01-28 12:24:45.065798,2025-01-28 12:24:48.257981,0 days 00:00:03.192183,softplus,256,,4,80,0.00011351536636428338,3,496,False,PRUNED
1338,2.95735764503479,2025-01-28 12:24:48.275489,2025-01-28 12:24:50.848150,0 days 00:00:02.572661,softplus,256,,4,90,0.00010209551977277676,4,400,False,PRUNED
1339,2.5308470726013184,2025-01-28 12:24:50.864753,2025-01-28 12:24:54.348027,0 days 00:00:03.483274,softplus,256,,4,100,0.0001687198758138772,4,496,False,PRUNED
1340,2.7896432876586914,2025-01-28 12:24:54.366160,2025-01-28 12:24:57.544251,0 days 00:00:03.178091,softplus,256,,64,90,0.00010199889628247753,4,496,False,PRUNED
1341,3.2499799728393555,2025-01-28 12:24:57.562237,2025-01-28 12:24:59.921518,0 days 00:00:02.359281,softplus,256,,4,90,0.00014890401072616455,4,512,False,PRUNED
1342,6.124462127685547,2025-01-28 12:24:59.939157,2025-01-28 12:25:04.532235,0 days 00:00:04.593078,softplus,128,0.1,4,90,0.00010172621132347866,4,512,True,PRUNED
1343,3.1331615447998047,2025-01-28 12:25:04.551780,2025-01-28 12:25:07.205405,0 days 00:00:02.653625,gelu,256,,8,80,0.00010197476220649898,3,480,False,PRUNED
1344,2.767395257949829,2025-01-28 12:25:07.222455,2025-01-28 12:25:11.156917,0 days 00:00:03.934462,softplus,256,,4,90,0.0001996571373618902,4,512,False,PRUNED
1345,2.5002636909484863,2025-01-28 12:25:11.174163,2025-01-28 12:25:14.737213,0 days 00:00:03.563050,softplus,256,,4,80,0.0008927876279182262,4,496,False,PRUNED
1346,3.2918217182159424,2025-01-28 12:25:14.755072,2025-01-28 12:25:17.222412,0 days 00:00:02.467340,selu,256,,4,100,0.000610142642487947,4,512,False,PRUNED
1347,3.3960022926330566,2025-01-28 12:25:17.239865,2025-01-28 12:25:21.000551,0 days 00:00:03.760686,relu,256,,4,90,0.004088597132493321,4,512,False,PRUNED
1348,3.7620818614959717,2025-01-28 12:25:21.017856,2025-01-28 12:25:23.100224,0 days 00:00:02.082368,softplus,256,,4,90,0.00012642556461647401,3,496,False,PRUNED
1349,2.828479290008545,2025-01-28 12:25:23.119137,2025-01-28 12:25:25.482936,0 days 00:00:02.363799,softplus,512,,4,90,0.00010188997870622864,4,496,False,PRUNED
1350,9.048820495605469,2025-01-28 12:25:25.502414,2025-01-28 12:25:29.448541,0 days 00:00:03.946127,softplus,256,,32,80,0.0023511879666729854,4,480,False,PRUNED
1351,2.8343546390533447,2025-01-28 12:25:29.466954,2025-01-28 12:25:32.899934,0 days 00:00:03.432980,softplus,128,,8,90,0.00011373251740287138,4,512,False,PRUNED
1352,2.826341152191162,2025-01-28 12:25:32.918398,2025-01-28 12:25:35.463392,0 days 00:00:02.544994,softplus,256,,4,90,0.00019134999824905175,4,512,False,PRUNED
1353,2.872757911682129,2025-01-28 12:25:35.480038,2025-01-28 12:25:38.125931,0 days 00:00:02.645893,softplus,256,,4,90,0.0012511940494090864,4,496,False,PRUNED
1354,2.9128236770629883,2025-01-28 12:25:38.143264,2025-01-28 12:25:40.596135,0 days 00:00:02.452871,selu,256,,4,100,0.00010206426304537395,3,480,False,PRUNED
