number,value,datetime_start,datetime_complete,duration,params_activation,params_batch_size,params_dropout_rate,params_embedding_dim,params_epochs,params_learning_rate,params_n_hidden_layers,params_units_per_layer,params_use_dropout,state
949,3.58433198928833,2025-01-27 22:16:27.267124,2025-01-27 22:16:30.871150,0 days 00:00:03.604026,softplus,256,,4,90,0.000995497494340598,4,496,False,PRUNED
950,3.1634910106658936,2025-01-27 22:16:30.886680,2025-01-27 22:16:34.538970,0 days 00:00:03.652290,gelu,256,,4,80,0.00010284387120932206,4,512,False,PRUNED
951,2.8420708179473877,2025-01-27 22:16:34.554708,2025-01-27 22:16:36.687203,0 days 00:00:02.132495,softplus,512,,4,90,0.00013112677349474868,4,512,False,PRUNED
952,2.822073221206665,2025-01-27 22:16:36.702230,2025-01-27 22:16:39.176405,0 days 00:00:02.474175,softplus,256,,16,90,0.00010338573838270193,4,496,False,PRUNED
953,3.285701036453247,2025-01-27 22:16:39.192955,2025-01-27 22:16:41.775361,0 days 00:00:02.582406,softplus,256,,4,90,0.00043441537894648954,4,512,False,PRUNED
954,2.772824287414551,2025-01-27 22:16:41.790986,2025-01-27 22:16:45.328723,0 days 00:00:03.537737,selu,256,,2,90,0.00011410315676446778,4,496,False,PRUNED
955,3.0163540840148926,2025-01-27 22:16:45.344318,2025-01-27 22:16:47.728259,0 days 00:00:02.383941,softplus,256,,4,80,0.0001032067923629488,4,512,False,PRUNED
956,2.5103249549865723,2025-01-27 22:16:47.745545,2025-01-27 22:16:51.169777,0 days 00:00:03.424232,softplus,256,,4,100,0.001965482152774036,4,496,False,PRUNED
957,3.0790491104125977,2025-01-27 22:16:51.185602,2025-01-27 22:16:53.592527,0 days 00:00:02.406925,softplus,256,,4,90,0.0001235425048536357,4,512,False,PRUNED
958,2.5106334686279297,2025-01-27 22:16:53.608742,2025-01-27 22:16:57.184646,0 days 00:00:03.575904,softplus,256,,4,80,0.0016863755183915592,4,480,False,PRUNED
959,2.5452659130096436,2025-01-27 22:16:57.201183,2025-01-27 22:17:01.370293,0 days 00:00:04.169110,softplus,256,,64,90,0.00040916756104807404,4,512,False,PRUNED
960,3.473921060562134,2025-01-27 22:17:01.386108,2025-01-27 22:17:03.406817,0 days 00:00:02.020709,softplus,1024,,4,90,0.0007546647963471111,4,496,False,PRUNED
961,2.460136890411377,2025-01-27 22:17:03.423174,2025-01-27 22:17:10.489821,0 days 00:00:07.066647,relu,256,,4,90,0.00014231410524007937,4,496,False,PRUNED
962,5.24185037612915,2025-01-27 22:17:10.505662,2025-01-27 22:17:15.539549,0 days 00:00:05.033887,tanh,256,0.30000000000000004,4,100,0.00010331979373360985,4,512,True,PRUNED
963,2.7692739963531494,2025-01-27 22:17:15.556328,2025-01-27 22:17:19.378270,0 days 00:00:03.821942,softplus,256,,4,80,0.0001029358855267609,4,480,False,PRUNED
964,3.774463653564453,2025-01-27 22:17:19.394276,2025-01-27 22:17:21.945888,0 days 00:00:02.551612,selu,256,,4,90,0.00032553291697489745,4,496,False,PRUNED
965,2.777517080307007,2025-01-27 22:17:21.962906,2025-01-27 22:17:24.347366,0 days 00:00:02.384460,softplus,256,,4,90,0.003597913346944148,4,352,False,PRUNED
966,2.5736374855041504,2025-01-27 22:17:24.362326,2025-01-27 22:17:27.702457,0 days 00:00:03.340131,softplus,256,,4,90,0.0002065344609617494,4,512,False,PRUNED
967,2.732987880706787,2025-01-27 22:17:27.718094,2025-01-27 22:17:31.655982,0 days 00:00:03.937888,softplus,256,,32,90,0.0001157234447808812,4,512,False,PRUNED
968,2.671725273132324,2025-01-27 22:17:31.673182,2025-01-27 22:17:35.014435,0 days 00:00:03.341253,softplus,256,,4,90,0.0014468400119378,4,496,False,PRUNED
969,2.8371689319610596,2025-01-27 22:17:35.033338,2025-01-27 22:17:37.657757,0 days 00:00:02.624419,softplus,256,,4,80,0.00010283033966026285,4,496,False,PRUNED
970,2.799239158630371,2025-01-27 22:17:37.674075,2025-01-27 22:17:40.009246,0 days 00:00:02.335171,softplus,256,,4,100,0.0012683256109119142,4,480,False,PRUNED
971,2.408121347427368,2025-01-27 22:17:40.027017,2025-01-27 22:17:44.625473,0 days 00:00:04.598456,softplus,256,,4,90,0.00010306102172446336,4,512,False,PRUNED
972,2.8972058296203613,2025-01-27 22:17:44.641839,2025-01-27 22:17:46.808501,0 days 00:00:02.166662,selu,512,,4,90,0.00015281231300522553,5,512,False,PRUNED
973,2.798922300338745,2025-01-27 22:17:46.824069,2025-01-27 22:17:48.870151,0 days 00:00:02.046082,softplus,256,,4,80,0.00011444475996063268,2,512,False,PRUNED
974,2.9891469478607178,2025-01-27 22:17:48.886144,2025-01-27 22:17:51.528831,0 days 00:00:02.642687,softplus,256,,4,90,0.00010286343588718508,4,480,False,PRUNED
975,2.594390869140625,2025-01-27 22:17:51.545674,2025-01-27 22:17:55.165085,0 days 00:00:03.619411,softplus,256,,4,90,0.0013654627753111287,4,512,False,PRUNED
976,2.938389539718628,2025-01-27 22:17:55.180622,2025-01-27 22:17:58.994029,0 days 00:00:03.813407,relu,256,,4,80,0.0001319687262691176,4,496,False,PRUNED
977,2.5063254833221436,2025-01-27 22:17:59.009248,2025-01-27 22:18:02.466563,0 days 00:00:03.457315,softplus,256,,2,90,0.00010277989779344998,4,512,False,PRUNED
978,2.768620491027832,2025-01-27 22:18:02.481440,2025-01-27 22:18:05.332553,0 days 00:00:02.851113,gelu,256,,4,90,0.00024184655088866258,4,464,False,PRUNED
979,3.0645556449890137,2025-01-27 22:18:05.348008,2025-01-27 22:18:07.990011,0 days 00:00:02.642003,softplus,256,,16,100,0.0001984686278104628,4,512,False,PRUNED
980,3.8105874061584473,2025-01-27 22:18:08.006256,2025-01-27 22:18:11.566637,0 days 00:00:03.560381,softplus,256,,4,90,0.00010284472226510849,4,432,False,PRUNED
981,2.8597664833068848,2025-01-27 22:18:11.581421,2025-01-27 22:18:13.871874,0 days 00:00:02.290453,softplus,256,,4,90,0.0012244405683775072,4,496,False,PRUNED
982,9.842652320861816,2025-01-27 22:18:13.887952,2025-01-27 22:18:17.318006,0 days 00:00:03.430054,selu,1024,0.5,4,80,0.00011397751541397708,4,512,True,PRUNED
983,2.914301633834839,2025-01-27 22:18:17.332599,2025-01-27 22:18:21.608939,0 days 00:00:04.276340,softplus,256,,64,90,0.0005214310188069117,4,480,False,PRUNED
984,2.6076183319091797,2025-01-27 22:18:21.627047,2025-01-27 22:18:26.171553,0 days 00:00:04.544506,softplus,256,,4,90,0.0008534857167064501,4,496,False,PRUNED
985,2.8740878105163574,2025-01-27 22:18:26.185762,2025-01-27 22:18:29.717466,0 days 00:00:03.531704,softplus,256,,4,90,0.00017227360923459427,4,496,False,PRUNED
986,2.4618113040924072,2025-01-27 22:18:29.733095,2025-01-27 22:18:34.310727,0 days 00:00:04.577632,softplus,256,,4,100,0.00023572522156781395,4,512,False,PRUNED
987,3.9565396308898926,2025-01-27 22:18:34.326452,2025-01-27 22:18:36.584429,0 days 00:00:02.257977,softplus,256,,4,90,0.00010278227054763317,4,512,False,PRUNED
988,3.018238067626953,2025-01-27 22:18:36.600693,2025-01-27 22:18:39.250934,0 days 00:00:02.650241,tanh,256,,4,80,0.00012390482018498364,4,496,False,PRUNED
989,2.565460205078125,2025-01-27 22:18:39.269116,2025-01-27 22:18:43.022704,0 days 00:00:03.753588,relu,256,,4,90,0.00010276680376940234,4,496,False,PRUNED
990,2.938689947128296,2025-01-27 22:18:43.038466,2025-01-27 22:18:47.862590,0 days 00:00:04.824124,softplus,256,,32,90,0.000723445943796518,4,512,False,PRUNED
991,4.612386703491211,2025-01-27 22:18:47.879325,2025-01-27 22:18:51.390596,0 days 00:00:03.511271,softplus,256,,4,80,0.00011393183979156365,4,480,False,PRUNED
992,2.525801181793213,2025-01-27 22:18:51.407348,2025-01-27 22:18:54.941951,0 days 00:00:03.534603,softplus,256,,4,90,0.002443232830523379,4,512,False,PRUNED
993,2.837766647338867,2025-01-27 22:18:54.957604,2025-01-27 22:18:58.322215,0 days 00:00:03.364611,selu,256,,4,90,0.00010258343179046326,4,496,False,PRUNED
994,3.105835437774658,2025-01-27 22:18:58.337643,2025-01-27 22:19:01.169643,0 days 00:00:02.832000,softplus,256,,4,100,0.002578161827726111,4,496,False,PRUNED
995,2.8241989612579346,2025-01-27 22:19:01.185261,2025-01-27 22:19:03.171703,0 days 00:00:01.986442,softplus,512,,4,90,0.0001033091948395655,4,512,False,PRUNED
996,2.493711471557617,2025-01-27 22:19:03.187676,2025-01-27 22:19:07.532027,0 days 00:00:04.344351,softplus,256,,4,80,0.00026779366921996807,4,192,False,PRUNED
997,,2025-01-27 22:19:07.546145,2025-01-27 22:19:09.607716,0 days 00:00:02.061571,softplus,256,,4,90,0.00013679995463771087,4,512,False,FAIL
998,3.0722646713256836,2025-01-27 22:19:30.577272,2025-01-27 22:19:34.837419,0 days 00:00:04.260147,softplus,256,,4,90,0.0001447605149020485,4,512,False,PRUNED
999,2.8155417442321777,2025-01-27 22:19:34.845042,2025-01-27 22:19:37.450837,0 days 00:00:02.605795,softplus,256,,4,90,0.0006464735213843682,4,480,False,PRUNED
1000,2.5742974281311035,2025-01-27 22:19:37.467054,2025-01-27 22:19:42.030190,0 days 00:00:04.563136,softplus,256,,4,90,0.0009095929797328531,4,512,False,PRUNED
1001,2.920358419418335,2025-01-27 22:19:42.046520,2025-01-27 22:19:44.702242,0 days 00:00:02.655722,softplus,256,,4,80,0.00011463096851157823,4,496,False,PRUNED
1002,3.858362913131714,2025-01-27 22:19:44.719486,2025-01-27 22:19:48.734299,0 days 00:00:04.014813,selu,256,0.30000000000000004,16,90,0.00012844126112804762,4,512,True,PRUNED
1003,2.803757429122925,2025-01-27 22:19:48.749780,2025-01-27 22:19:51.495761,0 days 00:00:02.745981,gelu,256,,2,100,0.00030047718796334216,4,496,False,PRUNED
1004,3.1745316982269287,2025-01-27 22:19:51.511120,2025-01-27 22:19:53.382930,0 days 00:00:01.871810,softplus,1024,,4,90,0.00010279996791411244,4,512,False,PRUNED
1005,10.372445106506348,2025-01-27 22:19:53.398736,2025-01-27 22:19:56.375202,0 days 00:00:02.976466,relu,256,,4,80,0.00010326778177612044,4,16,False,PRUNED
1006,2.597961187362671,2025-01-27 22:19:56.391775,2025-01-27 22:20:00.140872,0 days 00:00:03.749097,softplus,256,,4,90,0.00016209896629796453,4,496,False,PRUNED
1007,2.435326337814331,2025-01-27 22:20:00.156979,2025-01-27 22:20:04.834337,0 days 00:00:04.677358,softplus,256,,4,90,0.0001167781500152613,4,512,False,PRUNED
1008,2.5165529251098633,2025-01-27 22:20:04.849537,2025-01-27 22:20:09.686205,0 days 00:00:04.836668,softplus,256,,4,90,0.0018439657754778156,4,480,False,PRUNED
1009,2.781259298324585,2025-01-27 22:20:09.702885,2025-01-27 22:20:12.211212,0 days 00:00:02.508327,softplus,256,,4,90,0.0001139019980370633,5,496,False,PRUNED
1010,2.6752495765686035,2025-01-27 22:20:12.226232,2025-01-27 22:20:15.766284,0 days 00:00:03.540052,softplus,256,,4,100,0.0001028079567313361,4,512,False,PRUNED
1011,3.058156728744507,2025-01-27 22:20:15.781971,2025-01-27 22:20:18.351301,0 days 00:00:02.569330,softplus,256,,4,80,0.00010233541021773949,4,512,False,PRUNED
1012,2.6598079204559326,2025-01-27 22:20:18.366112,2025-01-27 22:20:22.409329,0 days 00:00:04.043217,selu,256,,64,90,0.0005961007576116387,4,496,False,PRUNED
1013,2.4280221462249756,2025-01-27 22:20:22.424384,2025-01-27 22:20:26.893034,0 days 00:00:04.468650,softplus,256,,4,90,0.00018395540796342216,4,496,False,PRUNED
1014,2.649524450302124,2025-01-27 22:20:26.908362,2025-01-27 22:20:30.346909,0 days 00:00:03.438547,softplus,256,,4,80,0.0001378983338768645,4,512,False,PRUNED
1015,2.856612205505371,2025-01-27 22:20:30.363060,2025-01-27 22:20:32.949106,0 days 00:00:02.586046,softplus,256,,32,90,0.0007038456074815085,4,384,False,PRUNED
1016,3.003817319869995,2025-01-27 22:20:32.965558,2025-01-27 22:20:37.832847,0 days 00:00:04.867289,softplus,256,,4,90,0.00035552408518358693,4,464,False,PRUNED
1017,2.6033802032470703,2025-01-27 22:20:37.847802,2025-01-27 22:20:42.603178,0 days 00:00:04.755376,relu,512,,4,100,0.00010335385676112862,4,512,False,PRUNED
1018,2.4470086097717285,2025-01-27 22:20:42.621155,2025-01-27 22:20:47.357017,0 days 00:00:04.735862,softplus,256,,4,90,0.000852753306033292,4,512,False,PRUNED
1019,2.8737716674804688,2025-01-27 22:20:47.372862,2025-01-27 22:20:52.445743,0 days 00:00:05.072881,tanh,256,0.2,4,90,0.0015254575194279542,4,496,True,PRUNED
1020,2.971176862716675,2025-01-27 22:20:52.460915,2025-01-27 22:20:54.711330,0 days 00:00:02.250415,softplus,256,,4,80,0.00012294056617702514,4,480,False,PRUNED
1021,2.503316640853882,2025-01-27 22:20:54.726432,2025-01-27 22:20:58.549121,0 days 00:00:03.822689,softplus,256,,4,90,0.00010299577809054085,4,512,False,PRUNED
1022,2.5588488578796387,2025-01-27 22:20:58.564593,2025-01-27 22:21:02.256083,0 days 00:00:03.691490,selu,256,,4,90,0.0011234473571133147,4,496,False,PRUNED
1023,2.792086362838745,2025-01-27 22:21:02.274436,2025-01-27 22:21:04.706492,0 days 00:00:02.432056,softplus,256,,4,90,0.00010280825723716868,4,512,False,PRUNED
1024,3.0665202140808105,2025-01-27 22:21:04.721870,2025-01-27 22:21:07.209086,0 days 00:00:02.487216,softplus,256,,4,80,0.00011507996940268046,4,512,False,PRUNED
1025,2.5884575843811035,2025-01-27 22:21:07.224982,2025-01-27 22:21:10.677939,0 days 00:00:03.452957,softplus,256,,4,90,0.00015296868270883615,4,496,False,PRUNED
1026,2.963397979736328,2025-01-27 22:21:10.693821,2025-01-27 22:21:12.523938,0 days 00:00:01.830117,softplus,1024,,4,100,0.0004786000654756177,4,480,False,PRUNED
1027,2.815865993499756,2025-01-27 22:21:12.539345,2025-01-27 22:21:15.776288,0 days 00:00:03.236943,softplus,256,,16,90,0.00538020992181531,4,512,False,PRUNED
1028,2.916710138320923,2025-01-27 22:21:15.793862,2025-01-27 22:21:18.147748,0 days 00:00:02.353886,softplus,256,,4,80,0.00010265853296546914,4,496,False,PRUNED
1029,3.472484827041626,2025-01-27 22:21:18.163347,2025-01-27 22:21:20.877723,0 days 00:00:02.714376,gelu,256,,2,90,0.0027642721468570013,4,512,False,PRUNED
1030,2.6991641521453857,2025-01-27 22:21:20.895555,2025-01-27 22:21:24.210077,0 days 00:00:03.314522,softplus,256,,4,90,0.00010301746715617504,4,496,False,PRUNED
1031,2.7958755493164062,2025-01-27 22:21:24.226919,2025-01-27 22:21:26.622689,0 days 00:00:02.395770,softplus,256,,4,90,0.00028791692974396735,4,512,False,PRUNED
1032,3.2091224193573,2025-01-27 22:21:26.639794,2025-01-27 22:21:29.503297,0 days 00:00:02.863503,selu,256,,64,100,0.0014296084943024598,4,496,False,PRUNED
1033,2.674971342086792,2025-01-27 22:21:29.519010,2025-01-27 22:21:34.211957,0 days 00:00:04.692947,softplus,256,,4,80,0.0036537099766527866,4,288,False,PRUNED
1034,2.9483540058135986,2025-01-27 22:21:34.228311,2025-01-27 22:21:38.973154,0 days 00:00:04.744843,relu,256,,4,90,0.00021025044521580478,4,480,False,PRUNED
1035,2.892274856567383,2025-01-27 22:21:38.988574,2025-01-27 22:21:41.426837,0 days 00:00:02.438263,softplus,256,,4,90,0.00012587001895115687,4,512,False,PRUNED
1036,2.6984028816223145,2025-01-27 22:21:41.442045,2025-01-27 22:21:44.963026,0 days 00:00:03.520981,softplus,256,,4,90,0.0009862348571704556,4,320,False,PRUNED
1037,2.5961906909942627,2025-01-27 22:21:45.275705,2025-01-27 22:21:49.722657,0 days 00:00:04.446952,softplus,256,,4,90,0.0021233733105542026,4,512,False,PRUNED
1038,27.879749298095703,2025-01-27 22:21:49.738222,2025-01-27 22:21:53.271933,0 days 00:00:03.533711,softplus,512,0.4,4,80,0.0024604373854815497,4,496,True,PRUNED
1039,2.5779807567596436,2025-01-27 22:21:53.289889,2025-01-27 22:21:56.833614,0 days 00:00:03.543725,softplus,256,,4,90,0.00010280103264396447,4,512,False,PRUNED
1040,2.8320817947387695,2025-01-27 22:21:56.849448,2025-01-27 22:21:59.522627,0 days 00:00:02.673179,softplus,256,,32,100,0.001775266394671417,4,496,False,PRUNED
1041,,2025-01-27 22:21:59.539621,,,tanh,256,,4,90,0.00011449597816913226,4,512,False,RUNNING
1042,2.9442973136901855,2025-01-27 22:26:30.424644,2025-01-27 22:26:32.935038,0 days 00:00:02.510394,tanh,256,,4,90,0.0005055132452273336,1,512,False,PRUNED
1043,2.8305110931396484,2025-01-27 22:26:32.943704,2025-01-27 22:26:35.401828,0 days 00:00:02.458124,selu,256,,4,80,0.00010268737768321585,4,480,False,PRUNED
1044,2.8602142333984375,2025-01-27 22:26:35.420427,2025-01-27 22:26:38.132249,0 days 00:00:02.711822,softplus,256,,4,90,0.00011407604651226424,4,512,False,PRUNED
1045,2.650294542312622,2025-01-27 22:26:38.148977,2025-01-27 22:26:42.044842,0 days 00:00:03.895865,softplus,256,,4,90,0.0011060230206260922,4,496,False,PRUNED
1046,4.31512975692749,2025-01-27 22:26:42.060888,2025-01-27 22:26:44.487637,0 days 00:00:02.426749,softplus,256,,4,90,0.00013637785595959853,4,512,False,PRUNED
1047,3.1601264476776123,2025-01-27 22:26:44.504766,2025-01-27 22:26:47.981669,0 days 00:00:03.476903,softplus,256,,4,80,0.0001025258252818952,4,496,False,PRUNED
1048,2.4295878410339355,2025-01-27 22:26:47.997033,2025-01-27 22:26:55.261512,0 days 00:00:07.264479,relu,256,,4,90,0.0001137752498804511,4,464,False,PRUNED
1049,2.949320077896118,2025-01-27 22:26:55.277841,2025-01-27 22:26:57.928377,0 days 00:00:02.650536,softplus,256,,4,90,0.0007750316223632513,5,512,False,PRUNED
1050,2.871049404144287,2025-01-27 22:26:57.946698,2025-01-27 22:27:00.352863,0 days 00:00:02.406165,softplus,1024,,16,100,0.004851843435978245,4,496,False,PRUNED
1051,2.993706703186035,2025-01-27 22:27:00.370421,2025-01-27 22:27:02.785356,0 days 00:00:02.414935,softplus,256,,4,90,0.0001026621545025612,4,512,False,PRUNED
1052,2.9838669300079346,2025-01-27 22:27:02.802542,2025-01-27 22:27:06.273464,0 days 00:00:03.470922,selu,256,,2,80,0.0018026196539072583,4,496,False,PRUNED
1053,2.6080873012542725,2025-01-27 22:27:06.289442,2025-01-27 22:27:09.629436,0 days 00:00:03.339994,softplus,256,,4,50,0.00010285301895840472,4,512,False,PRUNED
1054,3.1529886722564697,2025-01-27 22:27:09.646428,2025-01-27 22:27:12.065042,0 days 00:00:02.418614,softplus,256,,4,90,0.006882880650465184,4,480,False,PRUNED
1055,2.8797342777252197,2025-01-27 22:27:12.083924,2025-01-27 22:27:14.625982,0 days 00:00:02.542058,softplus,256,,4,90,0.004186551566307489,4,512,False,PRUNED
1056,3.4272732734680176,2025-01-27 22:27:14.644427,2025-01-27 22:27:17.339987,0 days 00:00:02.695560,gelu,256,,4,90,0.00037712611337126136,4,496,False,PRUNED
1057,3.000849962234497,2025-01-27 22:27:17.357671,2025-01-27 22:27:19.790121,0 days 00:00:02.432450,softplus,256,,4,90,0.00012590628982459925,4,160,False,PRUNED
1058,10.5921049118042,2025-01-27 22:27:19.807374,2025-01-27 22:27:23.554099,0 days 00:00:03.746725,softplus,256,0.1,4,80,0.00010286563363410162,4,464,True,PRUNED
1059,2.61661696434021,2025-01-27 22:27:23.571567,2025-01-27 22:27:27.989919,0 days 00:00:04.418352,softplus,256,,64,100,0.0002463127887794395,4,512,False,PRUNED
1060,2.768867015838623,2025-01-27 22:27:28.005715,2025-01-27 22:27:30.637664,0 days 00:00:02.631949,softplus,512,,4,90,0.00011459968647047876,4,496,False,PRUNED
1061,2.500840663909912,2025-01-27 22:27:30.656121,2025-01-27 22:27:36.286354,0 days 00:00:05.630233,relu,256,,4,90,0.00010279915500002356,4,512,False,PRUNED
1062,2.5691423416137695,2025-01-27 22:27:36.302826,2025-01-27 22:27:39.939104,0 days 00:00:03.636278,selu,256,,4,90,0.001261532999476438,4,496,False,PRUNED
1063,,2025-01-27 22:27:39.957246,2025-01-27 22:27:42.012501,0 days 00:00:02.055255,softplus,256,,4,80,0.00042712044074001774,4,480,False,FAIL
1064,2.7833683490753174,2025-01-27 22:29:06.204278,2025-01-27 22:29:09.370334,0 days 00:00:03.166056,softplus,256,,4,80,0.00042655240429594093,4,480,False,PRUNED
1065,2.8539950847625732,2025-01-27 22:29:09.379365,2025-01-27 22:29:13.102709,0 days 00:00:03.723344,softplus,256,,4,90,0.0001853130683932815,4,496,False,PRUNED
1066,2.5273611545562744,2025-01-27 22:29:13.120011,2025-01-27 22:29:17.075561,0 days 00:00:03.955550,softplus,256,,32,90,0.002968850831477112,4,512,False,PRUNED
1067,2.604325771331787,2025-01-27 22:29:17.093292,2025-01-27 22:29:21.836300,0 days 00:00:04.743008,softplus,256,,4,100,0.004014332012352107,4,64,False,PRUNED
1068,2.629363536834717,2025-01-27 22:29:21.853505,2025-01-27 22:29:25.315228,0 days 00:00:03.461723,softplus,256,,4,80,0.00016626606304821144,4,480,False,PRUNED
1069,3.0513436794281006,2025-01-27 22:29:25.332497,2025-01-27 22:29:30.185379,0 days 00:00:04.852882,tanh,256,,4,90,0.000102672899398858,4,512,False,PRUNED
1070,2.520193338394165,2025-01-27 22:29:30.203709,2025-01-27 22:29:35.068398,0 days 00:00:04.864689,softplus,256,,4,90,0.0005690755064736559,4,512,False,PRUNED
1071,2.8055689334869385,2025-01-27 22:29:35.088034,2025-01-27 22:29:38.510988,0 days 00:00:03.422954,softplus,256,,4,80,0.00039785088545822594,4,496,False,PRUNED
1072,,2025-01-27 22:29:38.527386,2025-01-27 22:29:40.364069,0 days 00:00:01.836683,softplus,256,,4,90,0.00010264971381230814,2,512,False,FAIL
1073,3.3640666007995605,2025-01-27 22:32:27.830048,2025-01-27 22:32:31.029926,0 days 00:00:03.199878,softplus,256,,4,90,0.00010250979331929786,4,512,False,PRUNED
1074,2.538012742996216,2025-01-27 22:32:31.038530,2025-01-27 22:32:34.892003,0 days 00:00:03.853473,selu,256,,4,90,0.0001480635707083959,4,512,False,PRUNED
1075,3.2669754028320312,2025-01-27 22:32:34.909348,2025-01-27 22:32:36.778001,0 days 00:00:01.868653,softplus,1024,,4,90,0.004763302793292211,4,496,False,PRUNED
1076,2.9179978370666504,2025-01-27 22:32:36.795463,2025-01-27 22:32:39.272525,0 days 00:00:02.477062,softplus,256,,4,100,0.00011399351498025364,4,512,False,PRUNED
1077,2.800286293029785,2025-01-27 22:32:39.290450,2025-01-27 22:32:41.396155,0 days 00:00:02.105705,softplus,256,,2,90,0.00033779117447648994,2,496,False,PRUNED
1078,71.19035339355469,2025-01-27 22:32:41.412742,2025-01-27 22:32:45.321502,0 days 00:00:03.908760,softplus,256,0.5,16,80,0.00012313136757873425,4,512,True,PRUNED
1079,3.6030564308166504,2025-01-27 22:32:45.338565,2025-01-27 22:32:51.690435,0 days 00:00:06.351870,relu,256,,4,90,0.00022396069096560943,4,496,False,PRUNED
1080,2.5013067722320557,2025-01-27 22:32:51.710634,2025-01-27 22:32:55.338788,0 days 00:00:03.628154,softplus,256,,4,90,0.00010271567667193193,4,480,False,PRUNED
1081,2.5256412029266357,2025-01-27 22:32:55.356132,2025-01-27 22:32:58.988853,0 days 00:00:03.632721,softplus,256,,4,90,0.00010266399611435883,4,512,False,PRUNED
1082,3.2839555740356445,2025-01-27 22:32:59.005574,2025-01-27 22:33:01.425100,0 days 00:00:02.419526,softplus,256,,4,80,0.00013633820225741333,4,496,False,PRUNED
1083,2.852976083755493,2025-01-27 22:33:01.444623,2025-01-27 22:33:04.380522,0 days 00:00:02.935899,selu,256,,64,100,0.00010260562293321011,4,512,False,PRUNED
1084,2.986729621887207,2025-01-27 22:33:04.399260,2025-01-27 22:33:06.651022,0 days 00:00:02.251762,softplus,512,,4,90,0.0001147293747779436,4,480,False,PRUNED
