number,value,datetime_start,datetime_complete,duration,params_activation,params_batch_size,params_dropout_rate,params_embedding_dim,params_epochs,params_learning_rate,params_n_hidden_layers,params_units_per_layer,params_use_dropout,state
1490,7.378695964813232,2025-01-31 23:59:00.696252,2025-01-31 23:59:02.093457,0 days 00:00:01.397205,softplus,256,,4,80,0.0004507571528535076,4,496,False,PRUNED
1491,5.197330951690674,2025-01-31 23:59:02.112682,2025-01-31 23:59:03.623821,0 days 00:00:01.511139,selu,256,,4,90,0.00011437144908821736,4,512,False,PRUNED
1492,15.087717056274414,2025-01-31 23:59:03.655491,2025-01-31 23:59:06.458011,0 days 00:00:02.802520,softplus,512,0.30000000000000004,4,90,0.00039710888455020513,4,496,True,PRUNED
1493,7.225742816925049,2025-01-31 23:59:06.477181,2025-01-31 23:59:08.126507,0 days 00:00:01.649326,softplus,256,,4,90,0.00010168305013254331,3,512,False,PRUNED
1494,7.4821391105651855,2025-01-31 23:59:08.157432,2025-01-31 23:59:09.598432,0 days 00:00:01.441000,softplus,256,,4,80,0.002854655083670064,4,496,False,PRUNED
1495,8.981690406799316,2025-01-31 23:59:09.630474,2025-01-31 23:59:11.113217,0 days 00:00:01.482743,softplus,256,,8,90,0.00010181547745271789,4,512,False,PRUNED
1496,7.321099281311035,2025-01-31 23:59:11.131570,2025-01-31 23:59:12.550272,0 days 00:00:01.418702,softplus,256,,4,100,0.00032310561180890054,4,512,False,PRUNED
1497,6.6257171630859375,2025-01-31 23:59:12.571331,2025-01-31 23:59:14.176082,0 days 00:00:01.604751,softplus,256,,4,90,0.0007364001060767162,4,480,False,PRUNED
1498,7.918519020080566,2025-01-31 23:59:14.461602,2025-01-31 23:59:16.039495,0 days 00:00:01.577893,gelu,256,,16,90,0.00016414292848994738,3,496,False,PRUNED
1499,5.211483001708984,2025-01-31 23:59:16.061185,2025-01-31 23:59:17.817003,0 days 00:00:01.755818,softplus,128,,4,80,0.0010440569451171126,4,512,False,PRUNED
1500,6.044582843780518,2025-01-31 23:59:17.835944,2025-01-31 23:59:19.349163,0 days 00:00:01.513219,selu,256,,4,70,0.00011409172808457032,4,496,False,PRUNED
1501,7.700031757354736,2025-01-31 23:59:19.368851,2025-01-31 23:59:20.735003,0 days 00:00:01.366152,softplus,256,,2,90,0.00012394473611013773,4,512,False,PRUNED
1502,6.474433422088623,2025-01-31 23:59:20.754974,2025-01-31 23:59:22.681578,0 days 00:00:01.926604,softplus,256,,4,100,0.0006412417880463584,4,352,False,PRUNED
1503,8.73276138305664,2025-01-31 23:59:22.708087,2025-01-31 23:59:24.144673,0 days 00:00:01.436586,softplus,256,,4,90,0.00010200171258150147,4,496,False,PRUNED
1504,18.74308204650879,2025-01-31 23:59:24.182856,2025-01-31 23:59:27.982435,0 days 00:00:03.799579,relu,1024,,8,90,0.00010181692310579265,4,512,False,PRUNED
1505,8.159562110900879,2025-01-31 23:59:28.015567,2025-01-31 23:59:29.789086,0 days 00:00:01.773519,softplus,256,,4,80,0.0018543049458031612,3,496,False,PRUNED
1506,9.736613273620605,2025-01-31 23:59:29.808560,2025-01-31 23:59:31.575638,0 days 00:00:01.767078,softplus,256,,64,90,0.00010188438908004428,4,512,False,PRUNED
1507,7.620452404022217,2025-01-31 23:59:31.608899,2025-01-31 23:59:32.937043,0 days 00:00:01.328144,softplus,256,,4,90,0.00020466791470888932,4,480,False,PRUNED
1508,4.067291736602783,2025-01-31 23:59:32.972140,2025-01-31 23:59:34.414249,0 days 00:00:01.442109,softplus,128,,4,80,0.00018947567869146003,4,512,False,PRUNED
1509,6.746976375579834,2025-01-31 23:59:34.433062,2025-01-31 23:59:36.033619,0 days 00:00:01.600557,selu,256,,4,100,0.00012998839476858448,4,272,False,PRUNED
1510,8.21418571472168,2025-01-31 23:59:36.052734,2025-01-31 23:59:37.721668,0 days 00:00:01.668934,softplus,256,,4,90,0.00011340209840189539,4,496,False,PRUNED
1511,30.128543853759766,2025-01-31 23:59:37.742307,2025-01-31 23:59:40.235763,0 days 00:00:02.493456,softplus,256,0.4,4,90,0.0001016820499211363,3,512,True,PRUNED
1512,7.522063255310059,2025-01-31 23:59:40.256184,2025-01-31 23:59:42.089291,0 days 00:00:01.833107,softplus,256,,8,90,0.00042423138770008705,4,480,False,PRUNED
1513,8.621800422668457,2025-01-31 23:59:42.108875,2025-01-31 23:59:44.072649,0 days 00:00:01.963774,tanh,256,,4,90,0.00010187705211319462,4,496,False,PRUNED
1514,6.101089954376221,2025-01-31 23:59:44.092428,2025-01-31 23:59:45.480370,0 days 00:00:01.387942,softplus,256,,4,80,0.005891929165390788,4,512,False,PRUNED
1515,12.281180381774902,2025-01-31 23:59:45.499531,2025-01-31 23:59:49.421347,0 days 00:00:03.921816,relu,256,,4,90,0.00011357934059051286,4,496,False,PRUNED
1516,29.081106185913086,2025-01-31 23:59:49.440798,2025-01-31 23:59:51.161703,0 days 00:00:01.720905,softplus,512,,32,90,0.0013802505598793046,3,512,False,PRUNED
1517,7.932775020599365,2025-01-31 23:59:51.180006,2025-01-31 23:59:52.991099,0 days 00:00:01.811093,softplus,256,,4,90,0.00010176529269904584,4,496,False,PRUNED
1518,8.379339218139648,2025-01-31 23:59:53.011183,2025-01-31 23:59:54.446831,0 days 00:00:01.435648,softplus,256,,4,80,0.00013931354676445816,4,480,False,PRUNED
1519,3.390136480331421,2025-01-31 23:59:54.466926,2025-01-31 23:59:55.871406,0 days 00:00:01.404480,softplus,128,,8,100,0.0005558667982201924,4,512,False,PRUNED
1520,6.489621162414551,2025-01-31 23:59:55.889927,2025-01-31 23:59:57.405279,0 days 00:00:01.515352,selu,256,,4,90,0.0003446406569906245,4,512,False,PRUNED
1521,21.409700393676758,2025-01-31 23:59:57.423311,2025-01-31 23:59:59.359328,0 days 00:00:01.936017,softplus,256,,4,90,0.0001017477182079934,4,112,False,PRUNED
1522,9.629155158996582,2025-01-31 23:59:59.376941,2025-02-01 00:00:00.731954,0 days 00:00:01.355013,softplus,256,,4,80,0.0001723388775096858,4,464,False,PRUNED
1523,12.83364200592041,2025-02-01 00:00:00.750431,2025-02-01 00:00:02.386599,0 days 00:00:01.636168,softplus,256,,4,70,0.00011907676304258044,3,416,False,PRUNED
1524,8.455266952514648,2025-02-01 00:00:02.406324,2025-02-01 00:00:03.909374,0 days 00:00:01.503050,softplus,256,,4,90,0.0008653305260522627,4,512,False,PRUNED
1525,8.682077407836914,2025-02-01 00:00:03.927915,2025-02-01 00:00:05.762161,0 days 00:00:01.834246,softplus,256,,2,90,0.00011239234814777275,4,496,False,PRUNED
1526,11.749103546142578,2025-02-01 00:00:05.781551,2025-02-01 00:00:07.635760,0 days 00:00:01.854209,softplus,1024,,16,90,0.00046388805259045123,4,480,False,PRUNED
1527,5.074819087982178,2025-02-01 00:00:07.675431,2025-02-01 00:00:08.994137,0 days 00:00:01.318706,softplus,128,,4,100,0.00013160569332152302,3,512,False,PRUNED
1528,30.27743148803711,2025-02-01 00:00:09.026454,2025-02-01 00:00:10.198051,0 days 00:00:01.171597,relu,256,,8,90,0.00010167631080409879,1,496,False,PRUNED
1529,7.276074409484863,2025-02-01 00:00:10.217373,2025-02-01 00:00:13.273786,0 days 00:00:03.056413,selu,256,0.1,4,80,0.0002527029087097213,4,512,True,PRUNED
1530,7.0888166427612305,2025-02-01 00:00:13.317783,2025-02-01 00:00:15.187198,0 days 00:00:01.869415,gelu,256,,4,90,0.0001570834225428213,5,480,False,PRUNED
1531,8.981928825378418,2025-02-01 00:00:15.219875,2025-02-01 00:00:16.580335,0 days 00:00:01.360460,softplus,256,,4,90,0.00010160781859255879,4,512,False,PRUNED
1532,9.236976623535156,2025-02-01 00:00:16.598898,2025-02-01 00:00:18.076657,0 days 00:00:01.477759,softplus,256,,4,80,0.00010181568468291944,4,496,False,PRUNED
1533,10.997926712036133,2025-02-01 00:00:18.096162,2025-02-01 00:00:20.128470,0 days 00:00:02.032308,softplus,256,,64,50,0.0001238449800936766,4,496,False,PRUNED
1534,12.205183029174805,2025-02-01 00:00:20.146712,2025-02-01 00:00:21.609414,0 days 00:00:01.462702,softplus,256,,4,90,0.00010167150507001536,3,512,False,PRUNED
1535,8.752586364746094,2025-02-01 00:00:21.629729,2025-02-01 00:00:23.296514,0 days 00:00:01.666785,softplus,256,,8,100,0.00011337713590462618,4,496,False,PRUNED
1536,9.195328712463379,2025-02-01 00:00:23.315731,2025-02-01 00:00:24.749384,0 days 00:00:01.433653,softplus,256,,4,90,0.00010184707960205959,4,512,False,PRUNED
1537,6.004571914672852,2025-02-01 00:00:24.786732,2025-02-01 00:00:29.262613,0 days 00:00:04.475881,tanh,128,,4,90,0.00010183663228816939,4,512,False,PRUNED
1538,7.931455135345459,2025-02-01 00:00:29.283244,2025-02-01 00:00:30.812190,0 days 00:00:01.528946,softplus,256,,4,60,0.0011278234059628116,4,496,False,PRUNED
1539,7.0220208168029785,2025-02-01 00:00:30.843489,2025-02-01 00:00:32.276221,0 days 00:00:01.432732,selu,256,,4,80,0.00010182579384079182,3,512,False,PRUNED
1540,12.296303749084473,2025-02-01 00:00:32.310167,2025-02-01 00:00:33.950117,0 days 00:00:01.639950,softplus,512,,4,90,0.003056590368064639,4,256,False,PRUNED
1541,8.904529571533203,2025-02-01 00:00:33.969602,2025-02-01 00:00:35.868705,0 days 00:00:01.899103,softplus,256,,4,90,0.00011342270380614829,4,400,False,PRUNED
1542,8.337594985961914,2025-02-01 00:00:35.886975,2025-02-01 00:00:37.791592,0 days 00:00:01.904617,softplus,256,,32,80,0.00015103124766212622,4,496,False,PRUNED
1543,9.591887474060059,2025-02-01 00:00:37.811499,2025-02-01 00:00:39.254509,0 days 00:00:01.443010,softplus,256,,8,90,0.0022565923103322182,3,512,False,PRUNED
1544,8.70779037475586,2025-02-01 00:00:39.272897,2025-02-01 00:00:41.066538,0 days 00:00:01.793641,relu,256,,4,90,0.00028084348972013236,4,496,False,PRUNED
1545,11.189329147338867,2025-02-01 00:00:41.085382,2025-02-01 00:00:42.937929,0 days 00:00:01.852547,softplus,128,,4,100,0.006495358470156249,4,512,False,PRUNED
1546,8.818788528442383,2025-02-01 00:00:42.958522,2025-02-01 00:00:44.301783,0 days 00:00:01.343261,softplus,256,,4,90,0.0001238738567335909,4,480,False,PRUNED
1547,8.924175262451172,2025-02-01 00:00:44.322097,2025-02-01 00:00:45.842726,0 days 00:00:01.520629,softplus,256,,4,90,0.0002358159856533233,4,512,False,PRUNED
1548,360.8837890625,2025-02-01 00:00:45.880224,2025-02-01 00:00:48.712725,0 days 00:00:02.832501,selu,256,0.30000000000000004,4,90,0.00010167334499242055,4,32,True,PRUNED
1549,9.517596244812012,2025-02-01 00:00:48.730693,2025-02-01 00:00:50.445924,0 days 00:00:01.715231,softplus,256,,8,80,0.005754687940665773,3,464,False,PRUNED
1550,8.084946632385254,2025-02-01 00:00:50.478290,2025-02-01 00:00:51.894271,0 days 00:00:01.415981,softplus,256,,4,90,0.00010164923031121494,4,496,False,PRUNED
1551,36.55125045776367,2025-02-01 00:00:51.931786,2025-02-01 00:00:53.914192,0 days 00:00:01.982406,gelu,1024,,4,90,0.00010187826625690684,4,512,False,PRUNED
1552,9.265387535095215,2025-02-01 00:00:53.932582,2025-02-01 00:00:55.291482,0 days 00:00:01.358900,softplus,256,,4,100,0.0001811910913694624,4,496,False,PRUNED
1553,6.918056964874268,2025-02-01 00:00:55.560317,2025-02-01 00:00:57.522037,0 days 00:00:01.961720,softplus,256,,16,80,0.0024901733774862563,4,512,False,PRUNED
1554,6.817041397094727,2025-02-01 00:00:57.541397,2025-02-01 00:00:58.906834,0 days 00:00:01.365437,softplus,256,,2,90,0.00011522752735040495,4,496,False,PRUNED
1555,7.810178756713867,2025-02-01 00:00:58.925652,2025-02-01 00:01:00.368353,0 days 00:00:01.442701,softplus,256,,4,90,0.00013412420997704018,4,480,False,PRUNED
1556,5.936661720275879,2025-02-01 00:01:00.386289,2025-02-01 00:01:02.316591,0 days 00:00:01.930302,softplus,128,,4,80,0.0001018282675161683,4,432,False,PRUNED
1557,8.558382987976074,2025-02-01 00:01:02.336308,2025-02-01 00:01:04.106013,0 days 00:00:01.769705,relu,256,,4,90,0.0006255281228577003,3,512,False,PRUNED
1558,8.385583877563477,2025-02-01 00:01:04.126813,2025-02-01 00:01:05.652801,0 days 00:00:01.525988,softplus,256,,8,90,0.00011247770584546865,4,496,False,PRUNED
1559,5.780171871185303,2025-02-01 00:01:05.672272,2025-02-01 00:01:07.100878,0 days 00:00:01.428606,selu,256,,4,100,0.0005162913920148701,4,512,False,PRUNED
1560,8.653939247131348,2025-02-01 00:01:07.121355,2025-02-01 00:01:08.696883,0 days 00:00:01.575528,softplus,256,,4,90,0.0001016821456683848,4,448,False,PRUNED
1561,6.187012195587158,2025-02-01 00:01:08.995528,2025-02-01 00:01:10.509551,0 days 00:00:01.514023,softplus,256,,4,90,0.0007492888193487572,4,480,False,PRUNED
1562,6.873517990112305,2025-02-01 00:01:10.529676,2025-02-01 00:01:11.953201,0 days 00:00:01.423525,softplus,256,,4,80,0.00010184595722033046,4,496,False,PRUNED
1563,6.551154136657715,2025-02-01 00:01:11.978947,2025-02-01 00:01:13.257359,0 days 00:00:01.278412,softplus,128,,4,90,0.00010151475115702223,3,512,False,PRUNED
1564,6.389378547668457,2025-02-01 00:01:13.292873,2025-02-01 00:01:15.106740,0 days 00:00:01.813867,softplus,256,,64,90,0.00029875513287254375,4,512,False,PRUNED
1565,18.498153686523438,2025-02-01 00:01:15.125589,2025-02-01 00:01:16.876821,0 days 00:00:01.751232,softplus,512,,8,70,0.00011291269999848242,4,496,False,PRUNED
1566,7.131567001342773,2025-02-01 00:01:16.896229,2025-02-01 00:01:19.292297,0 days 00:00:02.396068,tanh,256,,4,80,0.0035909290039029167,4,512,False,PRUNED
1567,89.90250396728516,2025-02-01 00:01:19.310161,2025-02-01 00:01:22.074641,0 days 00:00:02.764480,softplus,256,0.5,4,10,0.0005890991516215116,4,480,True,PRUNED
1568,10.803729057312012,2025-02-01 00:01:22.121017,2025-02-01 00:01:23.795819,0 days 00:00:01.674802,softplus,256,,4,90,0.003892775025307507,3,512,False,PRUNED
1569,12.069504737854004,2025-02-01 00:01:23.815420,2025-02-01 00:01:25.327013,0 days 00:00:01.511593,selu,256,,32,100,0.0001418488521085509,2,384,False,PRUNED
1570,7.373961925506592,2025-02-01 00:01:25.346403,2025-02-01 00:01:26.710883,0 days 00:00:01.364480,softplus,256,,4,90,0.0001017907456353189,4,496,False,PRUNED
1571,9.164999961853027,2025-02-01 00:01:26.730124,2025-02-01 00:01:28.211656,0 days 00:00:01.481532,softplus,256,,4,90,0.00010182423411165895,4,512,False,PRUNED
1572,8.687167167663574,2025-02-01 00:01:28.231243,2025-02-01 00:01:30.487523,0 days 00:00:02.256280,relu,256,,4,80,0.0001248733161695584,5,512,False,PRUNED
1573,,2025-02-01 15:34:54.273819,2025-02-01 15:34:58.733822,0 days 00:00:04.460003,softplus,128,,8,90,0.0009875204975104634,4,496,False,PRUNED
1574,,2025-02-01 15:34:58.751919,2025-02-01 15:35:01.799697,0 days 00:00:03.047778,softplus,256,,4,90,0.0001015886227522981,4,512,False,PRUNED
1575,,2025-02-01 15:35:01.816980,2025-02-01 15:35:03.855915,0 days 00:00:02.038935,softplus,1024,,4,90,0.0009172089597864666,4,496,False,PRUNED
1576,,2025-02-01 15:35:03.874091,2025-02-01 15:35:06.411271,0 days 00:00:02.537180,softplus,256,,4,100,0.00039482981035025285,3,512,False,PRUNED
1577,,2025-02-01 15:35:06.428510,2025-02-01 15:35:09.168486,0 days 00:00:02.739976,selu,256,,4,80,0.0003594151661409719,4,496,False,PRUNED
1578,,2025-02-01 15:35:09.186418,2025-02-01 15:35:12.276410,0 days 00:00:03.089992,softplus,256,,4,90,0.00011475013561904773,4,480,False,PRUNED
1579,,2025-02-01 15:35:12.293359,2025-02-01 15:35:14.988697,0 days 00:00:02.695338,softplus,256,,4,90,0.005149356840360437,4,512,False,PRUNED
1580,,2025-02-01 15:35:15.005184,2025-02-01 15:35:17.824101,0 days 00:00:02.818917,softplus,256,,8,90,0.00010180480779086313,4,512,False,PRUNED
1581,,2025-02-01 15:35:17.843314,2025-02-01 15:35:20.478278,0 days 00:00:02.634964,softplus,256,,16,90,0.00011434629300026888,3,496,False,PRUNED
1582,,2025-02-01 15:35:20.495650,2025-02-01 15:35:24.799038,0 days 00:00:04.303388,gelu,128,,4,80,0.0004570769309591449,4,480,False,PRUNED
1583,,2025-02-01 15:35:24.820852,2025-02-01 15:35:27.688167,0 days 00:00:02.867315,softplus,256,,2,90,0.000685076225541381,4,512,False,PRUNED
1584,,2025-02-01 15:35:27.707129,2025-02-01 15:35:30.503563,0 days 00:00:02.796434,softplus,256,,4,90,0.00010167949792232445,4,464,False,PRUNED
1585,,2025-02-01 15:35:30.522725,2025-02-01 15:35:33.570816,0 days 00:00:03.048091,softplus,256,,4,100,0.0002139934271100374,4,496,False,PRUNED
1586,,2025-02-01 15:35:33.587439,2025-02-01 15:35:38.769275,0 days 00:00:05.181836,relu,256,0.2,4,80,0.00010153248095828561,4,512,True,PRUNED
1587,,2025-02-01 15:35:38.787006,2025-02-01 15:35:41.302025,0 days 00:00:02.515019,softplus,256,,4,90,0.001171209371401964,3,496,False,PRUNED
1588,,2025-02-01 15:35:41.319747,2025-02-01 15:35:44.576891,0 days 00:00:03.257144,selu,256,,64,90,0.00016287673587710389,4,512,False,PRUNED
1589,,2025-02-01 15:35:44.593999,2025-02-01 15:35:47.714734,0 days 00:00:03.120735,softplus,256,,8,90,0.00012189189842982571,4,496,False,PRUNED
1590,,2025-02-01 15:35:47.733329,2025-02-01 15:35:50.162176,0 days 00:00:02.428847,softplus,512,,4,70,0.0014037813490632707,4,512,False,PRUNED
1591,,2025-02-01 15:35:50.179421,2025-02-01 15:35:55.303642,0 days 00:00:05.124221,tanh,256,,4,80,0.00019664182827287986,4,512,False,PRUNED
1592,,2025-02-01 15:35:55.321163,2025-02-01 15:35:57.716763,0 days 00:00:02.395600,softplus,256,,4,90,0.0001016673663005429,3,496,False,PRUNED
1593,,2025-02-01 15:35:57.733249,2025-02-01 15:36:01.947534,0 days 00:00:04.214285,softplus,128,,4,100,0.00014655028063317331,4,512,False,PRUNED
1594,,2025-02-01 15:36:01.965547,2025-02-01 15:36:04.553480,0 days 00:00:02.587933,softplus,256,,4,90,0.0006875517647417197,4,480,False,PRUNED
1595,,2025-02-01 15:36:04.570376,2025-02-01 15:36:07.144904,0 days 00:00:02.574528,softplus,256,,4,90,0.0019750515368622294,4,496,False,PRUNED
1596,,2025-02-01 15:36:07.162989,2025-02-01 15:36:09.955260,0 days 00:00:02.792271,softplus,256,,8,90,0.00021920364847924568,4,480,False,PRUNED
1597,,2025-02-01 15:36:09.973763,2025-02-01 15:36:13.122269,0 days 00:00:03.148506,selu,256,,4,60,0.003239924403061113,4,512,False,PRUNED
1598,,2025-02-01 15:36:13.138799,2025-02-01 15:36:15.559123,0 days 00:00:02.420324,softplus,256,,4,90,0.00011351701151935125,3,512,False,PRUNED
1599,,2025-02-01 15:36:15.576604,2025-02-01 15:36:17.338254,0 days 00:00:01.761650,softplus,1024,,4,80,0.002104621508939035,4,496,False,PRUNED
1600,,2025-02-01 15:36:17.354716,2025-02-01 15:36:22.302826,0 days 00:00:04.948110,relu,256,,4,90,0.00026758024131863625,4,496,False,PRUNED
1601,,2025-02-01 15:36:22.319974,2025-02-01 15:36:26.097500,0 days 00:00:03.777526,softplus,128,,4,20,0.00010159456265540803,4,512,False,PRUNED
1602,,2025-02-01 15:36:26.115965,2025-02-01 15:36:28.984878,0 days 00:00:02.868913,softplus,256,,32,90,0.000768135553610515,4,176,False,PRUNED
1603,,2025-02-01 15:36:29.002276,2025-02-01 15:36:31.474111,0 days 00:00:02.471835,softplus,256,,8,80,0.006772635950149798,3,496,False,PRUNED
1604,,2025-02-01 15:36:31.490738,2025-02-01 15:36:35.782359,0 days 00:00:04.291621,gelu,256,0.4,4,100,0.00010171398215890991,4,240,True,PRUNED
1605,,2025-02-01 15:36:35.800090,2025-02-01 15:36:38.539519,0 days 00:00:02.739429,softplus,256,,4,90,0.00010170882853882428,4,144,False,PRUNED
1606,,2025-02-01 15:36:38.558636,2025-02-01 15:36:41.201819,0 days 00:00:02.643183,softplus,256,,4,90,0.008796437277397944,4,512,False,PRUNED
1607,,2025-02-01 15:36:41.219076,2025-02-01 15:36:43.962847,0 days 00:00:02.743771,selu,256,,4,90,0.00012837208175530123,4,480,False,PRUNED
1608,,2025-02-01 15:36:43.980202,2025-02-01 15:36:47.128929,0 days 00:00:03.148727,softplus,256,,16,80,0.007294125986896477,3,512,False,PRUNED
1609,,2025-02-01 15:36:47.145873,2025-02-01 15:36:49.965590,0 days 00:00:02.819717,softplus,256,,2,100,0.00011364657026260617,4,496,False,PRUNED
1610,,2025-02-01 15:36:49.983992,2025-02-01 15:36:53.726461,0 days 00:00:03.742469,softplus,128,,4,90,0.00010168956778739,4,512,False,PRUNED
1611,,2025-02-01 15:36:53.744968,2025-02-01 15:36:56.308831,0 days 00:00:02.563863,softplus,256,,4,90,0.00010170022539489772,4,496,False,PRUNED
1612,,2025-02-01 15:36:56.326862,2025-02-01 15:36:59.285276,0 days 00:00:02.958414,softplus,256,,8,80,0.0002353237861644182,4,480,False,PRUNED
1613,,2025-02-01 15:36:59.302770,2025-02-01 15:37:03.484601,0 days 00:00:04.181831,relu,512,,4,90,0.00010176495022672205,4,512,False,PRUNED
1614,,2025-02-01 15:37:03.502289,2025-02-01 15:37:05.939440,0 days 00:00:02.437151,softplus,256,,4,90,0.0001762230887885671,3,512,False,PRUNED
1615,,2025-02-01 15:37:05.956343,2025-02-01 15:37:11.034566,0 days 00:00:05.078223,tanh,256,,4,70,0.0001356101870168943,4,336,False,PRUNED
1616,,2025-02-01 15:37:11.051937,2025-02-01 15:37:13.683575,0 days 00:00:02.631638,softplus,256,,4,90,0.0012541199345681134,4,496,False,PRUNED
1617,,2025-02-01 15:37:13.701697,2025-02-01 15:37:16.231588,0 days 00:00:02.529891,selu,256,,4,90,0.0001133950586486486,4,496,False,PRUNED
1618,,2025-02-01 15:37:16.250276,2025-02-01 15:37:18.885661,0 days 00:00:02.635385,softplus,256,,8,80,0.0001525432812960285,4,512,False,PRUNED
1619,,2025-02-01 15:37:18.901730,2025-02-01 15:37:23.416396,0 days 00:00:04.514666,softplus,128,,4,100,0.00010191398862474407,5,512,False,PRUNED
1620,,2025-02-01 15:37:23.433719,2025-02-01 15:37:25.818871,0 days 00:00:02.385152,softplus,256,,4,90,0.00012236333034612354,3,496,False,PRUNED
1621,,2025-02-01 15:37:25.835635,2025-02-01 15:37:29.150914,0 days 00:00:03.315279,softplus,256,,64,80,0.00011370467029474242,4,480,False,PRUNED
1622,,2025-02-01 15:37:29.169009,2025-02-01 15:37:32.102759,0 days 00:00:02.933750,softplus,256,,4,90,0.00010147352463438031,4,208,False,PRUNED
1623,,2025-02-01 15:37:32.120730,2025-02-01 15:37:35.373758,0 days 00:00:03.253028,softplus,1024,0.30000000000000004,4,90,0.0015320203248580173,4,512,True,PRUNED
1624,,2025-02-01 15:37:35.390218,2025-02-01 15:37:38.472369,0 days 00:00:03.082151,softplus,256,,32,90,0.0045897565854920875,4,496,False,PRUNED
1625,,2025-02-01 15:37:38.490113,2025-02-01 15:37:41.129326,0 days 00:00:02.639213,softplus,256,,4,80,0.00025919118272154306,4,512,False,PRUNED
1626,,2025-02-01 15:37:41.147275,2025-02-01 15:37:44.150170,0 days 00:00:03.002895,selu,256,,4,90,0.00011341324395055373,4,80,False,PRUNED
1627,,2025-02-01 15:37:44.168294,2025-02-01 15:37:46.773429,0 days 00:00:02.605135,softplus,256,,8,100,0.0003201983892144229,3,512,False,PRUNED
1628,,2025-02-01 15:37:46.792541,2025-02-01 15:37:49.376654,0 days 00:00:02.584113,softplus,256,,4,90,0.0004203492311794308,4,464,False,PRUNED
1629,,2025-02-01 15:37:49.395142,2025-02-01 15:37:55.279404,0 days 00:00:05.884262,relu,128,,4,90,0.00012409308099522098,2,496,False,PRUNED
1630,,2025-02-01 15:37:55.296543,2025-02-01 15:37:58.594141,0 days 00:00:03.297598,gelu,256,,4,90,0.00010183774390483726,4,512,False,PRUNED
1631,,2025-02-01 15:37:58.611450,2025-02-01 15:38:01.224104,0 days 00:00:02.612654,softplus,256,,4,40,0.0001871828016878252,4,496,False,PRUNED
