number,value,datetime_start,datetime_complete,duration,params_activation,params_batch_size,params_dropout_rate,params_embedding_dim,params_epochs,params_learning_rate,params_n_hidden_layers,params_units_per_layer,params_use_dropout,state
540,5.524050712585449,2025-01-27 12:33:20.847570,2025-01-27 12:33:28.125044,0 days 00:00:07.277474,softplus,256,0.2,4,85,0.00014437678266850576,4,512,True,PRUNED
541,2.167938470840454,2025-01-27 12:33:28.129570,2025-01-27 12:33:58.745765,0 days 00:00:30.616195,softplus,256,,4,90,7.789964424833363e-05,4,512,False,COMPLETE
542,2.591280221939087,2025-01-27 12:33:58.754642,2025-01-27 12:34:04.627388,0 days 00:00:05.872746,softplus,256,,4,90,8.360734795930391e-05,4,512,False,PRUNED
543,2.903035879135132,2025-01-27 12:34:04.645719,2025-01-27 12:34:14.355352,0 days 00:00:09.709633,softplus,256,,4,90,7.339069011430426e-05,4,512,False,PRUNED
544,2.1866939067840576,2025-01-27 12:34:14.372422,2025-01-27 12:34:39.305047,0 days 00:00:24.932625,softplus,256,,4,90,0.00010588631836644442,4,512,False,COMPLETE
545,2.4837517738342285,2025-01-27 12:34:39.312554,2025-01-27 12:34:44.980868,0 days 00:00:05.668314,softplus,256,,4,90,9.80191249198976e-05,4,512,False,PRUNED
546,2.621426582336426,2025-01-27 12:34:44.986772,2025-01-27 12:34:50.881803,0 days 00:00:05.895031,softplus,256,,4,90,8.365466000141282e-05,4,512,False,PRUNED
547,2.4721217155456543,2025-01-27 12:34:50.896815,2025-01-27 12:34:57.136846,0 days 00:00:06.240031,softplus,256,,4,85,0.00011088720792738008,4,512,False,PRUNED
548,2.2262492179870605,2025-01-27 12:34:57.153501,2025-01-27 12:35:13.173602,0 days 00:00:16.020101,softplus,256,,4,90,0.00016003653002363992,4,512,False,COMPLETE
549,2.559415340423584,2025-01-27 12:35:13.181267,2025-01-27 12:35:19.046316,0 days 00:00:05.865049,softplus,256,,4,85,6.313713752755949e-05,4,512,False,PRUNED
550,2.2292375564575195,2025-01-27 12:35:19.061168,2025-01-27 12:35:33.881040,0 days 00:00:14.819872,softplus,256,,4,90,0.00011033364045819528,4,512,False,COMPLETE
551,2.174001693725586,2025-01-27 12:35:33.888491,2025-01-27 12:36:02.055384,0 days 00:00:28.166893,relu,256,,4,90,7.467490852145246e-05,4,512,False,COMPLETE
552,2.3893730640411377,2025-01-27 12:36:02.063140,2025-01-27 12:36:10.171282,0 days 00:00:08.108142,relu,256,,4,90,8.324775106911461e-05,4,496,False,PRUNED
553,2.385244131088257,2025-01-27 12:36:10.176258,2025-01-27 12:36:16.251660,0 days 00:00:06.075402,relu,256,,4,85,9.640580045525074e-05,4,512,False,PRUNED
554,2.4828379154205322,2025-01-27 12:36:16.256213,2025-01-27 12:36:22.311597,0 days 00:00:06.055384,gelu,256,,4,90,0.00013975407954103401,4,496,False,PRUNED
555,2.2250750064849854,2025-01-27 12:36:22.316199,2025-01-27 12:36:40.161354,0 days 00:00:17.845155,relu,256,,4,85,7.361903725457104e-05,4,512,False,COMPLETE
556,2.4035115242004395,2025-01-27 12:36:40.168804,2025-01-27 12:36:46.464044,0 days 00:00:06.295240,relu,256,,4,90,0.00012200677774190164,4,496,False,PRUNED
557,2.34902024269104,2025-01-27 12:36:46.469028,2025-01-27 12:36:52.534036,0 days 00:00:06.065008,relu,256,,4,90,8.805338125459339e-05,4,512,False,PRUNED
558,2.2491023540496826,2025-01-27 12:36:52.538901,2025-01-27 12:37:14.884131,0 days 00:00:22.345230,relu,256,,4,85,6.648658820080843e-05,4,496,False,COMPLETE
559,106.72555541992188,2025-01-27 12:37:14.891948,2025-01-27 12:37:22.123177,0 days 00:00:07.231229,relu,256,0.5,4,85,0.00010400490465656705,4,512,True,PRUNED
560,2.3166139125823975,2025-01-27 12:37:22.139845,2025-01-27 12:37:31.621736,0 days 00:00:09.481891,relu,256,,4,90,7.733782552611068e-05,4,496,False,PRUNED
561,2.185379981994629,2025-01-27 12:37:31.626909,2025-01-27 12:37:57.412494,0 days 00:00:25.785585,selu,256,,4,90,9.271621051282222e-05,4,512,False,COMPLETE
562,2.197145938873291,2025-01-27 12:37:57.422100,2025-01-27 12:38:16.626378,0 days 00:00:19.204278,selu,256,,4,90,0.00011325524696589378,4,512,False,COMPLETE
563,2.3717877864837646,2025-01-27 12:38:16.635495,2025-01-27 12:38:22.345562,0 days 00:00:05.710067,selu,256,,4,90,0.0001454307790717775,4,512,False,PRUNED
564,2.2080466747283936,2025-01-27 12:38:22.362165,2025-01-27 12:38:41.515576,0 days 00:00:19.153411,selu,256,,4,90,0.00011022564078461459,4,512,False,COMPLETE
565,2.3696165084838867,2025-01-27 12:38:41.532186,2025-01-27 12:38:47.358821,0 days 00:00:05.826635,selu,256,,4,90,9.360082897262747e-05,4,512,False,PRUNED
566,2.5575873851776123,2025-01-27 12:38:47.364785,2025-01-27 12:38:53.194514,0 days 00:00:05.829729,selu,256,,4,90,0.0001308954987688398,4,512,False,PRUNED
567,2.3454108238220215,2025-01-27 12:38:53.201255,2025-01-27 12:38:59.205018,0 days 00:00:06.003763,selu,256,,4,85,7.797163387372798e-05,4,512,False,PRUNED
568,2.508413791656494,2025-01-27 12:38:59.234665,2025-01-27 12:39:05.272604,0 days 00:00:06.037939,selu,256,,4,90,0.00011491549553398004,4,512,False,PRUNED
569,2.2652010917663574,2025-01-27 12:39:05.301176,2025-01-27 12:39:20.119449,0 days 00:00:14.818273,selu,256,,4,85,9.323488617441631e-05,4,512,False,COMPLETE
570,2.4451019763946533,2025-01-27 12:39:20.128988,2025-01-27 12:39:26.037734,0 days 00:00:05.908746,selu,256,,4,85,6.565051341571913e-05,4,496,False,PRUNED
571,2.3458850383758545,2025-01-27 12:39:26.044154,2025-01-27 12:39:32.059870,0 days 00:00:06.015716,relu,256,,4,90,7.983902140846462e-05,4,512,False,PRUNED
572,2.4759607315063477,2025-01-27 12:39:32.092239,2025-01-27 12:39:37.966005,0 days 00:00:05.873766,selu,256,,4,90,0.00017263222695995523,4,496,False,PRUNED
573,2.379545211791992,2025-01-27 12:39:37.971992,2025-01-27 12:39:43.766308,0 days 00:00:05.794316,selu,256,,4,90,0.0001439396694622334,4,304,False,PRUNED
574,2.4383761882781982,2025-01-27 12:39:43.784376,2025-01-27 12:39:51.498976,0 days 00:00:07.714600,relu,256,,4,85,0.00010300199279983088,4,208,False,PRUNED
575,2.3430593013763428,2025-01-27 12:39:51.515069,2025-01-27 12:39:57.605885,0 days 00:00:06.090816,selu,256,,4,90,6.675110605852901e-05,4,512,False,PRUNED
576,2.3475539684295654,2025-01-27 12:39:57.611822,2025-01-27 12:40:03.743206,0 days 00:00:06.131384,relu,256,,4,85,8.9145215665967e-05,4,512,False,PRUNED
577,2.3793442249298096,2025-01-27 12:40:03.774409,2025-01-27 12:40:09.795574,0 days 00:00:06.021165,gelu,256,,4,85,0.00011969868335438595,4,496,False,PRUNED
578,2.4433674812316895,2025-01-27 12:40:09.801577,2025-01-27 12:40:15.866692,0 days 00:00:06.065115,selu,256,,4,90,7.684912251134666e-05,4,496,False,PRUNED
579,2.612082004547119,2025-01-27 12:40:15.872721,2025-01-27 12:40:21.934624,0 days 00:00:06.061903,selu,256,,4,90,5.7264532697188124e-05,4,512,False,PRUNED
580,3.495738983154297,2025-01-27 12:40:21.950001,2025-01-27 12:40:29.370523,0 days 00:00:07.420522,selu,256,0.4,4,85,9.692179362760408e-05,4,496,True,PRUNED
581,,2025-01-27 12:40:29.378141,2025-01-27 12:40:31.846554,0 days 00:00:02.468413,selu,256,,4,90,0.00015232295034541533,4,512,False,FAIL
582,2.8773651123046875,2025-01-27 18:14:09.569725,2025-01-27 18:14:13.187628,0 days 00:00:03.617903,selu,256,,4,90,7.002022416260656e-05,4,512,False,PRUNED
583,3.129037618637085,2025-01-27 18:14:13.206674,2025-01-27 18:14:16.665653,0 days 00:00:03.458979,selu,256,,4,85,0.00016137005623212113,4,512,False,PRUNED
584,2.627568483352661,2025-01-27 18:14:16.670439,2025-01-27 18:14:20.047935,0 days 00:00:03.377496,selu,256,,4,90,0.00012642707859460348,4,512,False,PRUNED
585,3.491312026977539,2025-01-27 18:14:20.052956,2025-01-27 18:14:23.593199,0 days 00:00:03.540243,selu,256,,4,90,8.63909009050341e-05,4,496,False,PRUNED
586,3.043971300125122,2025-01-27 18:14:23.598277,2025-01-27 18:14:28.349178,0 days 00:00:04.750901,tanh,256,,4,85,0.00011269252083469673,4,512,False,PRUNED
587,2.8176372051239014,2025-01-27 18:14:28.365175,2025-01-27 18:14:30.909696,0 days 00:00:02.544521,selu,256,,4,90,5.85502817800237e-05,4,496,False,PRUNED
588,2.641437530517578,2025-01-27 18:14:30.925795,2025-01-27 18:14:34.399112,0 days 00:00:03.473317,selu,256,,4,95,7.317707733463199e-05,4,512,False,PRUNED
589,2.549654245376587,2025-01-27 18:14:34.404847,2025-01-27 18:14:37.825588,0 days 00:00:03.420741,selu,256,,4,90,8.686278093250993e-05,4,496,False,PRUNED
590,2.8837087154388428,2025-01-27 18:14:37.842561,2025-01-27 18:14:42.683787,0 days 00:00:04.841226,relu,256,,4,85,6.339584594656938e-05,4,512,False,PRUNED
591,3.0026299953460693,2025-01-27 18:14:42.700456,2025-01-27 18:14:46.344937,0 days 00:00:03.644481,softplus,256,,4,95,0.00010412396824064411,4,512,False,PRUNED
592,2.53244686126709,2025-01-27 18:14:46.350047,2025-01-27 18:14:49.968687,0 days 00:00:03.618640,softplus,256,,4,85,0.00015499780759039365,4,496,False,PRUNED
593,2.5959882736206055,2025-01-27 18:14:49.973333,2025-01-27 18:14:53.808689,0 days 00:00:03.835356,softplus,256,,4,90,8.027976838337969e-05,4,512,False,PRUNED
594,2.5642755031585693,2025-01-27 18:14:53.813737,2025-01-27 18:14:57.261942,0 days 00:00:03.448205,softplus,256,,4,90,6.031325792640381e-05,4,496,False,PRUNED
595,3.0072717666625977,2025-01-27 18:14:57.267560,2025-01-27 18:14:59.697089,0 days 00:00:02.429529,tanh,256,,4,85,0.00012558902867968114,4,512,False,PRUNED
596,2.6080658435821533,2025-01-27 18:14:59.712401,2025-01-27 18:15:03.319515,0 days 00:00:03.607114,softplus,256,,4,95,9.7256382502371e-05,4,496,False,PRUNED
597,2.6444129943847656,2025-01-27 18:15:03.324404,2025-01-27 18:15:06.771564,0 days 00:00:03.447160,softplus,256,,4,90,6.75884300183404e-05,4,512,False,PRUNED
598,2.424227237701416,2025-01-27 18:15:06.776095,2025-01-27 18:15:11.206733,0 days 00:00:04.430638,softplus,256,,4,90,7.951495401129409e-05,4,512,False,PRUNED
599,38.0809326171875,2025-01-27 18:15:11.211455,2025-01-27 18:15:15.137407,0 days 00:00:03.925952,softplus,256,0.30000000000000004,4,95,0.00010310936926875115,4,496,True,PRUNED
600,2.52293062210083,2025-01-27 18:15:15.154669,2025-01-27 18:15:18.660458,0 days 00:00:03.505789,selu,256,,4,90,5.746871946394861e-05,4,512,False,PRUNED
601,2.8224117755889893,2025-01-27 18:15:18.666014,2025-01-27 18:15:20.934089,0 days 00:00:02.268075,softplus,256,,4,85,0.00012075518215340928,4,496,False,PRUNED
602,2.8240346908569336,2025-01-27 18:15:20.939581,2025-01-27 18:15:23.318935,0 days 00:00:02.379354,softplus,256,,4,85,0.00018600530769830308,4,496,False,PRUNED
603,2.501141309738159,2025-01-27 18:15:23.335096,2025-01-27 18:15:26.820970,0 days 00:00:03.485874,softplus,256,,4,90,0.0018796065754955137,4,400,False,PRUNED
604,3.000704526901245,2025-01-27 18:15:26.836770,2025-01-27 18:15:31.360232,0 days 00:00:04.523462,relu,256,,4,95,0.00014136618619771523,4,128,False,PRUNED
605,3.046586036682129,2025-01-27 18:15:31.377829,2025-01-27 18:15:33.702128,0 days 00:00:02.324299,softplus,256,,4,85,0.00022800339229181313,4,512,False,PRUNED
606,2.601803779602051,2025-01-27 18:15:33.716631,2025-01-27 18:15:37.247293,0 days 00:00:03.530662,softplus,256,,4,80,8.87645405990006e-05,4,320,False,PRUNED
607,2.521738290786743,2025-01-27 18:15:37.262317,2025-01-27 18:15:40.711548,0 days 00:00:03.449231,softplus,256,,4,90,7.231916649161151e-05,4,512,False,PRUNED
608,2.700519323348999,2025-01-27 18:15:40.727378,2025-01-27 18:15:45.115935,0 days 00:00:04.388557,softplus,256,,4,95,5.2611882477554514e-05,4,496,False,PRUNED
609,4.445305347442627,2025-01-27 18:15:45.130776,2025-01-27 18:15:48.526873,0 days 00:00:03.396097,softplus,256,,4,85,0.00010238907679869029,4,512,False,PRUNED
610,2.5799968242645264,2025-01-27 18:15:48.544026,2025-01-27 18:15:52.621500,0 days 00:00:04.077474,gelu,256,,4,90,8.605572760633713e-05,4,496,False,PRUNED
611,2.5410537719726562,2025-01-27 18:15:52.637069,2025-01-27 18:15:55.983736,0 days 00:00:03.346667,selu,256,,4,80,6.368082532115083e-05,4,512,False,PRUNED
612,2.615729570388794,2025-01-27 18:15:55.999526,2025-01-27 18:16:00.529326,0 days 00:00:04.529800,softplus,256,,4,90,7.549791621892718e-05,4,496,False,PRUNED
613,2.779762029647827,2025-01-27 18:16:00.544943,2025-01-27 18:16:02.830145,0 days 00:00:02.285202,softplus,256,,4,85,0.00011365516376768735,4,512,False,PRUNED
614,2.4579813480377197,2025-01-27 18:16:02.845757,2025-01-27 18:16:07.440577,0 days 00:00:04.594820,softplus,256,,4,95,0.0008018487344066212,4,512,False,PRUNED
615,3.0605928897857666,2025-01-27 18:16:07.456456,2025-01-27 18:16:10.059991,0 days 00:00:02.603535,softplus,256,,4,90,0.0001425541383056431,4,496,False,PRUNED
616,2.6547927856445312,2025-01-27 18:16:10.076927,2025-01-27 18:16:13.414731,0 days 00:00:03.337804,softplus,256,,4,85,8.896424045472901e-05,4,496,False,PRUNED
617,2.7429919242858887,2025-01-27 18:16:13.429511,2025-01-27 18:16:16.790917,0 days 00:00:03.361406,softplus,256,,4,95,5.0525392460665876e-05,4,512,False,PRUNED
618,54.34544372558594,2025-01-27 18:16:16.806840,2025-01-27 18:16:20.513689,0 days 00:00:03.706849,softplus,256,0.4,4,90,6.631771335727174e-05,4,512,True,PRUNED
619,2.518705129623413,2025-01-27 18:16:20.528271,2025-01-27 18:16:24.048330,0 days 00:00:03.520059,relu,256,,4,85,0.00010591444115579773,4,512,False,PRUNED
620,3.1919469833374023,2025-01-27 18:16:24.062577,2025-01-27 18:16:26.244981,0 days 00:00:02.182404,selu,256,,4,85,0.00016490801085370776,4,496,False,PRUNED
621,2.823791742324829,2025-01-27 18:16:26.261195,2025-01-27 18:16:28.864322,0 days 00:00:02.603127,softplus,256,,4,80,0.0038900643533518373,4,496,False,PRUNED
622,3.1154394149780273,2025-01-27 18:16:28.879812,2025-01-27 18:16:31.249393,0 days 00:00:02.369581,tanh,256,,4,95,7.748063800729634e-05,4,512,False,PRUNED
623,2.8631484508514404,2025-01-27 18:16:31.265338,2025-01-27 18:16:33.586851,0 days 00:00:02.321513,softplus,256,,4,90,5.732022535151181e-05,4,512,False,PRUNED
624,2.621173858642578,2025-01-27 18:16:33.602863,2025-01-27 18:16:38.132165,0 days 00:00:04.529302,softplus,256,,4,90,0.0020943361725873745,4,512,False,PRUNED
625,2.625756025314331,2025-01-27 18:16:38.147586,2025-01-27 18:16:42.805943,0 days 00:00:04.658357,softplus,256,,4,90,0.00012477233219626544,4,496,False,PRUNED
626,3.173302173614502,2025-01-27 18:16:42.820808,2025-01-27 18:16:45.243915,0 days 00:00:02.423107,softplus,256,,4,85,0.00020911685456219327,4,192,False,PRUNED
627,2.4695417881011963,2025-01-27 18:16:45.260680,2025-01-27 18:16:50.276260,0 days 00:00:05.015580,softplus,256,,4,95,0.0003481576059844698,4,512,False,PRUNED
628,2.8666462898254395,2025-01-27 18:16:50.291688,2025-01-27 18:16:52.565950,0 days 00:00:02.274262,softplus,256,,4,90,9.188524167255383e-05,4,512,False,PRUNED
629,3.055407762527466,2025-01-27 18:16:52.581677,2025-01-27 18:16:54.430546,0 days 00:00:01.848869,softplus,1024,,4,90,7.118557307966103e-05,4,496,False,PRUNED
630,2.8804497718811035,2025-01-27 18:16:54.446183,2025-01-27 18:16:56.795805,0 days 00:00:02.349622,selu,256,,4,85,5.350826391715648e-05,4,496,False,PRUNED
631,3.3066771030426025,2025-01-27 18:16:56.812422,2025-01-27 18:17:00.225230,0 days 00:00:03.412808,softplus,256,,4,80,9.93349800765003e-05,4,512,False,PRUNED
632,2.7749245166778564,2025-01-27 18:22:20.941820,2025-01-27 18:22:25.478827,0 days 00:00:04.537007,softplus,256,,4,95,0.0016033583189783477,4,512,False,PRUNED
633,2.49174165725708,2025-01-27 18:22:25.486163,2025-01-27 18:22:30.091001,0 days 00:00:04.604838,softplus,256,,4,85,8.063801287611498e-05,4,496,False,PRUNED
634,2.5254671573638916,2025-01-27 18:22:30.106570,2025-01-27 18:22:37.091580,0 days 00:00:06.985010,relu,256,,4,90,0.00012428898146165217,4,512,False,PRUNED
635,2.6441030502319336,2025-01-27 18:22:37.106084,2025-01-27 18:22:40.498112,0 days 00:00:03.392028,softplus,256,,4,95,6.167292891932472e-05,4,496,False,PRUNED
636,3.0187478065490723,2025-01-27 18:22:40.512830,2025-01-27 18:22:44.168740,0 days 00:00:03.655910,gelu,256,,4,90,0.00039640215719314903,4,496,False,PRUNED
637,10.18374252319336,2025-01-27 18:22:44.185261,2025-01-27 18:22:48.107915,0 days 00:00:03.922654,softplus,256,0.1,4,85,0.06668268801879128,4,512,True,PRUNED
638,2.519970655441284,2025-01-27 18:22:48.123821,2025-01-27 18:22:51.631533,0 days 00:00:03.507712,softplus,256,,4,90,0.00014722258512148636,4,512,False,PRUNED
639,2.541409492492676,2025-01-27 18:22:51.647491,2025-01-27 18:22:55.076355,0 days 00:00:03.428864,softplus,256,,4,85,9.069246737593806e-05,4,496,False,PRUNED
640,2.7995247840881348,2025-01-27 18:22:55.093966,2025-01-27 18:22:57.728456,0 days 00:00:02.634490,selu,256,,2,90,7.272256810291398e-05,4,512,False,PRUNED
641,2.555901288986206,2025-01-27 18:22:57.743966,2025-01-27 18:23:01.380991,0 days 00:00:03.637025,softplus,256,,4,85,0.0006236721365824069,4,512,False,PRUNED
642,2.6391003131866455,2025-01-27 18:23:01.395155,2025-01-27 18:23:06.244661,0 days 00:00:04.849506,softplus,256,,4,95,0.0010099653017631041,4,496,False,PRUNED
643,2.550696611404419,2025-01-27 18:23:06.260070,2025-01-27 18:23:09.691732,0 days 00:00:03.431662,softplus,256,,4,90,4.8840356438829325e-05,4,368,False,PRUNED
644,2.8290767669677734,2025-01-27 18:23:09.707009,2025-01-27 18:23:12.385593,0 days 00:00:02.678584,softplus,256,,64,80,6.228478933780141e-05,4,240,False,PRUNED
645,2.8379311561584473,2025-01-27 18:23:12.402031,2025-01-27 18:23:14.763238,0 days 00:00:02.361207,softplus,256,,4,90,0.00010956956311883697,4,496,False,PRUNED
646,2.8416950702667236,2025-01-27 18:23:14.777625,2025-01-27 18:23:17.326431,0 days 00:00:02.548806,relu,256,,4,95,9.896170582950479e-05,4,512,False,PRUNED
647,2.956378936767578,2025-01-27 18:23:17.342447,2025-01-27 18:23:19.645322,0 days 00:00:02.302875,softplus,256,,4,85,7.887495499997277e-05,4,496,False,PRUNED
648,4.576735496520996,2025-01-27 18:23:19.662590,2025-01-27 18:23:24.500163,0 days 00:00:04.837573,tanh,1024,,4,45,5.1953487907054835e-05,4,512,False,PRUNED
649,7.622480869293213,2025-01-27 18:23:24.516926,2025-01-27 18:23:26.920880,0 days 00:00:02.403954,softplus,256,,4,90,0.0002648538149225236,4,512,False,PRUNED
650,8.064422607421875,2025-01-27 18:23:26.936059,2025-01-27 18:23:29.339178,0 days 00:00:02.403119,selu,256,,4,80,0.01279948552141452,4,496,False,PRUNED
651,2.876622200012207,2025-01-27 18:23:29.355244,2025-01-27 18:23:32.284536,0 days 00:00:02.929292,softplus,256,,32,85,0.00018229911190939082,5,512,False,PRUNED
652,2.3975143432617188,2025-01-27 18:23:32.300420,2025-01-27 18:23:36.788721,0 days 00:00:04.488301,softplus,256,,4,90,0.00012302736829665755,4,496,False,PRUNED
653,25.316669464111328,2025-01-27 18:23:36.805036,2025-01-27 18:23:39.584032,0 days 00:00:02.778996,softplus,256,,4,90,0.03439668004114395,4,512,False,PRUNED
654,2.624440908432007,2025-01-27 18:23:39.599876,2025-01-27 18:23:44.093346,0 days 00:00:04.493470,softplus,256,,4,95,6.778045481131504e-05,4,496,False,PRUNED
655,2.8427278995513916,2025-01-27 18:23:44.108708,2025-01-27 18:23:46.391688,0 days 00:00:02.282980,softplus,256,,4,80,8.752292679767118e-05,4,512,False,PRUNED
656,34.335723876953125,2025-01-27 18:23:46.408832,2025-01-27 18:23:50.072387,0 days 00:00:03.663555,softplus,256,0.5,4,85,0.00014893463459988705,4,512,True,PRUNED
657,2.7136361598968506,2025-01-27 18:23:50.088821,2025-01-27 18:23:54.881514,0 days 00:00:04.792693,softplus,256,,4,90,0.0007321911114388813,4,496,False,PRUNED
658,2.867889881134033,2025-01-27 18:23:54.897345,2025-01-27 18:23:57.310349,0 days 00:00:02.413004,softplus,256,,4,95,0.00010653395821720261,4,512,False,PRUNED
659,2.985578775405884,2025-01-27 18:23:57.326591,2025-01-27 18:24:00.051020,0 days 00:00:02.724429,selu,256,,4,90,0.003572587899529325,4,496,False,PRUNED
660,2.6066231727600098,2025-01-27 18:24:00.066978,2025-01-27 18:24:03.548937,0 days 00:00:03.481959,softplus,256,,4,85,0.0009049058599933884,4,496,False,PRUNED
661,2.9983768463134766,2025-01-27 18:24:03.567017,2025-01-27 18:24:07.266654,0 days 00:00:03.699637,relu,256,,4,95,7.357659244286427e-05,4,512,False,PRUNED
662,2.5876410007476807,2025-01-27 18:24:07.282360,2025-01-27 18:24:10.950611,0 days 00:00:03.668251,softplus,256,,2,85,5.506520006308893e-05,4,512,False,PRUNED
663,3.065997362136841,2025-01-27 18:24:10.966102,2025-01-27 18:24:13.540142,0 days 00:00:02.574040,gelu,256,,16,90,8.870026953408635e-05,4,496,False,PRUNED
664,3.0183310508728027,2025-01-27 18:24:13.557372,2025-01-27 18:24:16.188006,0 days 00:00:02.630634,softplus,256,,4,90,0.0003184718349110089,4,512,False,PRUNED
665,2.4340994358062744,2025-01-27 18:24:16.205525,2025-01-27 18:24:21.739666,0 days 00:00:05.534141,softplus,256,,4,85,0.0005127307985360183,4,512,False,PRUNED
666,2.7812130451202393,2025-01-27 18:24:21.756651,2025-01-27 18:24:23.978006,0 days 00:00:02.221355,softplus,256,,4,95,0.00011198876787212745,4,496,False,PRUNED
667,2.5970404148101807,2025-01-27 18:24:23.994110,2025-01-27 18:24:27.361286,0 days 00:00:03.367176,softplus,256,,4,85,5.961456231892432e-05,4,512,False,PRUNED
668,3.0842299461364746,2025-01-27 18:24:27.377284,2025-01-27 18:24:29.668469,0 days 00:00:02.291185,softplus,256,,4,90,7.631513255368113e-05,4,496,False,PRUNED
669,2.8419244289398193,2025-01-27 18:24:29.684566,2025-01-27 18:24:32.954000,0 days 00:00:03.269434,selu,256,,64,90,4.624031073958555e-05,4,512,False,PRUNED
670,2.5534346103668213,2025-01-27 18:24:32.970781,2025-01-27 18:24:36.534557,0 days 00:00:03.563776,softplus,256,,4,85,0.00021738709899505246,4,336,False,PRUNED
671,88.20466613769531,2025-01-27 18:24:36.549863,2025-01-27 18:24:38.523460,0 days 00:00:01.973597,softplus,1024,,4,80,0.048990393837999406,4,496,False,PRUNED
672,2.643136978149414,2025-01-27 18:24:38.540020,2025-01-27 18:24:42.150767,0 days 00:00:03.610747,softplus,256,,4,95,0.00013898294222044214,4,512,False,PRUNED
673,3.0685181617736816,2025-01-27 18:24:42.166395,2025-01-27 18:24:46.290374,0 days 00:00:04.123979,tanh,256,,4,90,8.760181776760952e-05,4,512,False,PRUNED
674,2.515770673751831,2025-01-27 18:24:46.307098,2025-01-27 18:24:50.870411,0 days 00:00:04.563313,softplus,256,,4,90,6.483467609998184e-05,4,496,False,PRUNED
675,4.234007835388184,2025-01-27 18:24:50.885531,2025-01-27 18:24:54.985139,0 days 00:00:04.099608,relu,256,0.30000000000000004,4,95,0.008025522739953503,4,512,True,PRUNED
676,2.64986515045166,2025-01-27 18:24:55.000713,2025-01-27 18:24:58.473816,0 days 00:00:03.473103,softplus,256,,4,90,0.0013216575500975976,4,496,False,PRUNED
