number,value,datetime_start,datetime_complete,duration,params_activation,params_batch_size,params_dropout_rate,params_embedding_dim,params_epochs,params_learning_rate,params_n_hidden_layers,params_units_per_layer,params_use_dropout,state
1632,,2025-02-01 15:38:01.242215,2025-02-01 15:38:03.672706,0 days 00:00:02.430491,softplus,256,,4,80,0.0018826828001348485,3,512,False,PRUNED
1633,,2025-02-01 15:38:03.693379,2025-02-01 15:38:06.584805,0 days 00:00:02.891426,softplus,256,,4,90,0.00034547146473540725,4,496,False,PRUNED
1634,,2025-02-01 15:38:06.602334,2025-02-01 15:38:09.269712,0 days 00:00:02.667378,softplus,256,,8,90,0.008339223855920208,4,480,False,PRUNED
1635,,2025-02-01 15:38:09.287893,2025-02-01 15:38:11.935422,0 days 00:00:02.647529,softplus,256,,4,90,0.00013645344829560453,4,512,False,PRUNED
1636,,2025-02-01 15:38:11.954036,2025-02-01 15:38:14.198158,0 days 00:00:02.244122,selu,512,,2,100,0.00010138128660741389,4,512,False,PRUNED
1637,,2025-02-01 15:38:14.214659,2025-02-01 15:38:17.322117,0 days 00:00:03.107458,softplus,256,,16,90,0.00011289394418284467,4,496,False,PRUNED
1638,,2025-02-01 15:38:17.341103,2025-02-01 15:38:21.083388,0 days 00:00:03.742285,softplus,128,,4,80,0.0008453978845977313,4,512,False,PRUNED
1639,,2025-02-01 15:38:21.100839,2025-02-01 15:38:23.461387,0 days 00:00:02.360548,softplus,256,,4,90,0.00010195887335028421,3,496,False,PRUNED
1640,,2025-02-01 15:38:23.480763,2025-02-01 15:38:26.421363,0 days 00:00:02.940600,softplus,256,,4,90,0.0001017896811003227,4,512,False,PRUNED
1641,,2025-02-01 15:38:26.438052,2025-02-01 15:38:31.129499,0 days 00:00:04.691447,relu,256,,4,80,0.007829339331133863,4,480,False,PRUNED
1642,,2025-02-01 15:38:31.147522,2025-02-01 15:38:35.209176,0 days 00:00:04.061654,softplus,256,0.1,8,90,0.002553080202634844,4,464,True,PRUNED
1643,,2025-02-01 15:38:35.225881,2025-02-01 15:38:37.857898,0 days 00:00:02.632017,softplus,256,,4,60,0.0028361874595098126,4,512,False,PRUNED
1644,,2025-02-01 15:38:37.876270,2025-02-01 15:38:41.223576,0 days 00:00:03.347306,softplus,256,,64,90,0.0005495197745244715,3,496,False,PRUNED
1645,,2025-02-01 15:38:41.241540,2025-02-01 15:38:43.893751,0 days 00:00:02.652211,selu,256,,4,100,0.00010142146838370201,4,512,False,PRUNED
1646,,2025-02-01 15:38:43.911244,2025-02-01 15:38:49.859415,0 days 00:00:05.948171,tanh,128,,4,80,0.00014717046926862427,4,480,False,PRUNED
1647,,2025-02-01 15:38:49.878268,2025-02-01 15:38:52.762937,0 days 00:00:02.884669,softplus,256,,4,90,0.00016202961815041722,4,496,False,PRUNED
1648,,2025-02-01 15:38:52.782114,2025-02-01 15:38:55.467107,0 days 00:00:02.684993,softplus,256,,4,90,0.00010157939844100179,4,512,False,PRUNED
1649,,2025-02-01 15:38:55.485029,2025-02-01 15:38:58.093797,0 days 00:00:02.608768,softplus,256,,4,70,0.0011513018178629273,4,496,False,PRUNED
1650,,2025-02-01 15:38:58.111783,2025-02-01 15:39:00.551506,0 days 00:00:02.439723,softplus,256,,8,90,0.006462114260416261,3,512,False,PRUNED
1651,,2025-02-01 15:39:00.569730,2025-02-01 15:39:03.934835,0 days 00:00:03.365105,softplus,256,,32,80,0.00010156745959380785,4,480,False,PRUNED
1652,,2025-02-01 15:39:03.951973,2025-02-01 15:39:05.979344,0 days 00:00:02.027371,softplus,1024,,4,90,0.00012384796488594597,4,512,False,PRUNED
1653,,2025-02-01 15:39:05.996764,2025-02-01 15:39:08.618636,0 days 00:00:02.621872,softplus,256,,4,90,0.0021707372787219768,4,496,False,PRUNED
1654,,2025-02-01 15:39:08.636183,2025-02-01 15:39:11.504240,0 days 00:00:02.868057,selu,256,,4,100,0.00010177630631678168,4,496,False,PRUNED
1655,,2025-02-01 15:39:11.522638,2025-02-01 15:39:14.220701,0 days 00:00:02.698063,gelu,256,,4,50,0.0009859519979993894,3,512,False,PRUNED
1656,,2025-02-01 15:39:14.240461,2025-02-01 15:39:17.955317,0 days 00:00:03.714856,softplus,128,,4,90,0.00011320983991827769,4,512,False,PRUNED
1657,,2025-02-01 15:39:17.971808,2025-02-01 15:39:20.839589,0 days 00:00:02.867781,relu,256,,8,80,0.00010168910201834525,4,496,False,PRUNED
1658,,2025-02-01 15:39:20.858469,2025-02-01 15:39:23.879831,0 days 00:00:03.021362,softplus,256,,4,90,0.0027179579402633316,4,512,False,PRUNED
1659,,2025-02-01 15:39:23.897039,2025-02-01 15:39:26.514912,0 days 00:00:02.617873,softplus,256,,4,90,0.00021359322211856907,4,496,False,PRUNED
1660,,2025-02-01 15:39:26.533417,2025-02-01 15:39:29.201027,0 days 00:00:02.667610,softplus,256,,4,90,0.00011296749495832516,4,512,False,PRUNED
1661,,2025-02-01 15:39:29.219142,2025-02-01 15:39:33.036295,0 days 00:00:03.817153,softplus,256,0.2,4,100,0.004149510290028653,3,496,True,PRUNED
1662,,2025-02-01 15:39:33.058634,2025-02-01 15:39:35.616828,0 days 00:00:02.558194,softplus,512,,16,80,0.0001327797475837574,4,512,False,PRUNED
1663,,2025-02-01 15:39:35.633283,2025-02-01 15:39:38.237636,0 days 00:00:02.604353,softplus,256,,4,90,0.00029496017568467626,4,480,False,PRUNED
1664,,2025-02-01 15:39:38.254486,2025-02-01 15:39:40.923138,0 days 00:00:02.668652,softplus,256,,2,90,0.00010188314148042102,4,512,False,PRUNED
1665,,2025-02-01 15:39:40.939907,2025-02-01 15:39:44.917243,0 days 00:00:03.977336,softplus,128,,4,90,0.000101547769890833,3,496,False,PRUNED
1666,,2025-02-01 15:39:44.936893,2025-02-01 15:39:47.816557,0 days 00:00:02.879664,selu,256,,8,90,0.00017052720081248897,4,512,False,PRUNED
1667,,2025-02-01 15:39:47.833465,2025-02-01 15:39:50.437660,0 days 00:00:02.604195,softplus,256,,4,80,0.00010170039089861173,4,496,False,PRUNED
1668,,2025-02-01 15:39:50.455069,2025-02-01 15:39:53.411429,0 days 00:00:02.956360,tanh,256,,4,90,0.0008114230509646038,4,512,False,PRUNED
1669,,2025-02-01 15:39:53.427931,2025-02-01 15:39:56.112724,0 days 00:00:02.684793,softplus,256,,4,90,0.00010165185189655874,4,512,False,PRUNED
1670,,2025-02-01 15:39:56.131239,2025-02-01 15:39:58.724326,0 days 00:00:02.593087,softplus,256,,4,100,0.0015625446127901198,4,496,False,PRUNED
1671,,2025-02-01 15:39:58.742171,2025-02-01 15:40:03.222904,0 days 00:00:04.480733,relu,1024,,4,90,0.001766129016631017,4,512,False,PRUNED
1672,,2025-02-01 15:40:03.240662,2025-02-01 15:40:06.728726,0 days 00:00:03.488064,softplus,256,,64,80,0.001254239407500035,3,512,False,PRUNED
1673,,2025-02-01 16:22:04.566151,2025-02-01 16:22:07.990927,0 days 00:00:03.424776,softplus,256,,8,90,0.00010168158065887328,4,448,False,PRUNED
1674,,2025-02-01 16:22:08.011765,2025-02-01 16:22:10.213974,0 days 00:00:02.202209,softplus,256,,4,90,0.00012261755038469588,1,480,False,PRUNED
1675,,2025-02-01 16:22:10.232148,2025-02-01 16:22:14.076512,0 days 00:00:03.844364,softplus,128,,4,80,0.00011364696870762387,4,496,False,PRUNED
1676,,2025-02-01 16:22:14.094840,2025-02-01 16:22:17.162821,0 days 00:00:03.067981,selu,256,,4,90,0.00019538460740712893,5,288,False,PRUNED
1677,,2025-02-01 16:22:17.181189,2025-02-01 16:22:19.873226,0 days 00:00:02.692037,softplus,256,,4,90,0.0001016119610110175,4,16,False,PRUNED
1678,,2025-02-01 16:22:19.891669,2025-02-01 16:22:22.965161,0 days 00:00:03.073492,softplus,256,,32,100,0.00023517356292823235,4,496,False,PRUNED
1679,,2025-02-01 16:22:22.983125,2025-02-01 16:22:25.555436,0 days 00:00:02.572311,softplus,256,,4,90,0.0006416918892033292,3,512,False,PRUNED
1680,,2025-02-01 16:22:25.573460,2025-02-01 16:22:28.853570,0 days 00:00:03.280110,gelu,256,,4,70,0.0001345804676151207,4,480,False,PRUNED
1681,,2025-02-01 16:22:28.873175,2025-02-01 16:22:31.752577,0 days 00:00:02.879402,softplus,256,,8,80,0.0003320287068898255,4,512,False,PRUNED
1682,,2025-02-01 16:22:31.769763,2025-02-01 16:22:34.560965,0 days 00:00:02.791202,softplus,256,,4,90,0.0001133375492696608,4,496,False,PRUNED
1683,,2025-02-01 16:22:34.579667,2025-02-01 16:22:40.067235,0 days 00:00:05.487568,softplus,128,0.5,4,90,0.007461985315667943,4,512,True,PRUNED
1684,,2025-02-01 16:22:40.084835,2025-02-01 16:22:42.606648,0 days 00:00:02.521813,selu,256,,4,80,0.0001015721141137237,3,464,False,PRUNED
1685,,2025-02-01 16:22:42.623711,2025-02-01 16:22:47.651642,0 days 00:00:05.027931,relu,256,,4,90,0.000909781586121391,4,496,False,PRUNED
1686,,2025-02-01 16:22:47.669430,2025-02-01 16:22:50.493506,0 days 00:00:02.824076,softplus,256,,4,90,0.00011320773463498032,4,512,False,PRUNED
1687,,2025-02-01 16:22:50.512392,2025-02-01 16:22:53.046061,0 days 00:00:02.533669,softplus,512,,4,100,0.0001019115580936845,4,496,False,PRUNED
1688,,2025-02-01 16:22:53.063220,2025-02-01 16:22:55.736701,0 days 00:00:02.673481,softplus,256,,8,90,0.00010149335070883002,4,512,False,PRUNED
1689,,2025-02-01 16:22:55.755143,2025-02-01 16:22:58.544139,0 days 00:00:02.788996,softplus,256,,4,90,0.00010142135863421036,4,480,False,PRUNED
1690,,2025-02-01 16:22:58.562104,2025-02-01 16:23:01.328837,0 days 00:00:02.766733,softplus,256,,16,90,0.0033041288882190126,3,480,False,PRUNED
1691,,2025-02-01 16:23:01.346952,2025-02-01 16:23:04.231275,0 days 00:00:02.884323,softplus,256,,4,80,0.00012431840451979692,4,496,False,PRUNED
1692,,2025-02-01 16:23:04.250655,2025-02-01 16:23:09.312423,0 days 00:00:05.061768,tanh,256,,2,90,0.00010146422220384757,4,512,False,PRUNED
1693,,2025-02-01 16:23:09.329171,2025-02-01 16:23:13.066550,0 days 00:00:03.737379,softplus,128,,4,90,0.0010260343056132755,4,496,False,PRUNED
1694,,2025-02-01 16:23:13.083718,2025-02-01 16:23:16.130520,0 days 00:00:03.046802,selu,256,,4,100,0.00010159652340472267,4,512,False,PRUNED
1695,,2025-02-01 16:23:16.149739,2025-02-01 16:23:18.591150,0 days 00:00:02.441411,softplus,256,,4,90,0.00011304990657919207,3,512,False,PRUNED
1696,,2025-02-01 16:23:18.608579,2025-02-01 16:23:20.727048,0 days 00:00:02.118469,softplus,1024,,8,80,0.0002696861489323446,4,512,False,PRUNED
1697,,2025-02-01 16:23:20.744843,2025-02-01 16:23:23.352132,0 days 00:00:02.607289,softplus,256,,4,90,0.0016703197022323142,4,496,False,PRUNED
1698,,2025-02-01 16:23:23.373311,2025-02-01 16:23:27.799140,0 days 00:00:04.425829,softplus,256,0.30000000000000004,4,90,0.0023635417415749393,4,512,True,PRUNED
1699,,2025-02-01 16:23:27.816420,2025-02-01 16:23:30.709835,0 days 00:00:02.893415,relu,256,,4,80,0.00042726405727502826,4,496,False,PRUNED
1700,,2025-02-01 16:23:30.727173,2025-02-01 16:23:33.406648,0 days 00:00:02.679475,softplus,256,,4,90,0.0014363041361862721,4,512,False,PRUNED
1701,,2025-02-01 16:23:33.423451,2025-02-01 16:23:35.924134,0 days 00:00:02.500683,softplus,256,,4,100,0.004793647415987019,3,496,False,PRUNED
1702,,2025-02-01 16:23:35.944054,2025-02-01 16:23:40.150341,0 days 00:00:04.206287,softplus,128,,4,60,0.00010148172184462411,4,512,False,PRUNED
1703,,2025-02-01 16:23:40.167557,2025-02-01 16:23:42.949053,0 days 00:00:02.781496,softplus,256,,4,90,0.0001424486423010043,4,384,False,PRUNED
1704,,2025-02-01 16:23:42.967433,2025-02-01 16:23:45.738265,0 days 00:00:02.770832,selu,256,,8,90,0.0001626356144577501,4,480,False,PRUNED
1705,,2025-02-01 16:23:45.756712,2025-02-01 16:23:49.291723,0 days 00:00:03.535011,softplus,256,,64,80,0.0001263098208736887,4,496,False,PRUNED
1706,,2025-02-01 16:23:49.310435,2025-02-01 16:23:52.475957,0 days 00:00:03.165522,softplus,256,,32,90,0.0007124319923534868,4,512,False,PRUNED
1707,,2025-02-01 16:23:52.493118,2025-02-01 16:23:54.872935,0 days 00:00:02.379817,softplus,256,,4,70,0.0058300664692176474,3,496,False,PRUNED
1708,,2025-02-01 16:23:54.892497,2025-02-01 16:23:57.854333,0 days 00:00:02.961836,gelu,256,,4,90,0.00010173071057579786,4,512,False,PRUNED
1709,,2025-02-01 16:23:58.133827,2025-02-01 16:24:00.206291,0 days 00:00:02.072464,softplus,512,,4,90,0.00010144184607325388,4,496,False,PRUNED
1710,,2025-02-01 16:24:00.222761,2025-02-01 16:24:02.923043,0 days 00:00:02.700282,softplus,256,,4,30,0.00011319628582336265,4,512,False,PRUNED
1711,,2025-02-01 16:24:02.941568,2025-02-01 16:24:05.698767,0 days 00:00:02.757199,softplus,256,,8,80,0.00019975178004505014,4,464,False,PRUNED
1712,,2025-02-01 16:24:05.716263,2025-02-01 16:24:11.707783,0 days 00:00:05.991520,relu,128,,4,90,0.00010163425902793144,3,480,False,PRUNED
1713,,2025-02-01 16:24:11.727245,2025-02-01 16:24:14.161366,0 days 00:00:02.434121,softplus,256,,4,90,0.00010158648977201042,3,512,False,PRUNED
1714,,2025-02-01 16:24:14.180339,2025-02-01 16:24:16.763765,0 days 00:00:02.583426,selu,256,,4,100,0.0005476878202058312,4,512,False,PRUNED
1715,,2025-02-01 16:24:16.781355,2025-02-01 16:24:19.747356,0 days 00:00:02.966001,softplus,256,,4,90,0.0038439394203940375,4,352,False,PRUNED
1716,,2025-02-01 16:24:19.766908,2025-02-01 16:24:22.368253,0 days 00:00:02.601345,softplus,256,,4,80,0.005060149333101949,4,480,False,PRUNED
1717,,2025-02-01 16:24:22.385950,2025-02-01 16:24:26.363375,0 days 00:00:03.977425,softplus,256,0.4,4,90,0.0004739486080771795,4,496,True,PRUNED
1718,,2025-02-01 16:24:26.383364,2025-02-01 16:24:29.421618,0 days 00:00:03.038254,softplus,256,,16,90,0.00015244044690979527,4,512,False,PRUNED
1719,,2025-02-01 16:24:29.440993,2025-02-01 16:24:31.595279,0 days 00:00:02.154286,softplus,1024,,8,80,0.000178143513588175,4,512,False,PRUNED
1720,,2025-02-01 16:24:31.614048,2025-02-01 16:24:36.439078,0 days 00:00:04.825030,tanh,256,,2,100,0.00011240953940395655,4,496,False,PRUNED
1721,,2025-02-01 16:24:36.456365,2025-02-01 16:24:40.235584,0 days 00:00:03.779219,softplus,128,,4,90,0.00010170395869787578,4,496,False,PRUNED
1722,,2025-02-01 16:24:40.254091,2025-02-01 16:24:43.136681,0 days 00:00:02.882590,softplus,256,,4,90,0.0005851973641635943,4,512,False,PRUNED
1723,,2025-02-01 16:24:43.155597,2025-02-01 16:24:45.824544,0 days 00:00:02.668947,selu,256,,4,90,0.00012320694520573294,4,512,False,PRUNED
1724,,2025-02-01 16:24:45.843545,2025-02-01 16:24:48.223606,0 days 00:00:02.380061,softplus,256,,4,90,0.0030862251405929866,3,496,False,PRUNED
1725,,2025-02-01 16:24:48.241922,2025-02-01 16:24:50.902612,0 days 00:00:02.660690,softplus,256,,4,80,0.00010155327333148232,4,512,False,PRUNED
1726,,2025-02-01 16:24:50.920615,2025-02-01 16:24:54.033932,0 days 00:00:03.113317,softplus,256,,8,90,0.0010891550149347794,4,496,False,PRUNED
1727,,2025-02-01 16:24:54.051646,2025-02-01 16:24:58.825652,0 days 00:00:04.774006,relu,256,,4,90,0.00038467188531181285,4,480,False,PRUNED
1728,,2025-02-01 16:24:58.843673,2025-02-01 16:25:01.334573,0 days 00:00:02.490900,softplus,256,,4,100,0.00010168112037672499,3,512,False,PRUNED
1729,,2025-02-01 16:25:01.351741,2025-02-01 16:25:04.392556,0 days 00:00:03.040815,softplus,256,,64,90,0.00010151402361877757,4,496,False,PRUNED
1730,,2025-02-01 16:25:04.410625,2025-02-01 16:25:08.605103,0 days 00:00:04.194478,softplus,128,,4,80,0.00011287102647813218,4,480,False,PRUNED
1731,,2025-02-01 16:25:08.623458,2025-02-01 16:25:11.044131,0 days 00:00:02.420673,softplus,256,,4,90,0.00013390393007127393,2,512,False,PRUNED
1732,,2025-02-01 16:25:11.063120,2025-02-01 16:25:13.801196,0 days 00:00:02.738076,gelu,256,,4,70,0.0017405047077053407,4,512,False,PRUNED
1733,,2025-02-01 16:25:13.820510,2025-02-01 16:25:16.523945,0 days 00:00:02.703435,selu,512,,32,90,0.0002838910830774007,4,496,False,PRUNED
1734,,2025-02-01 16:25:16.542093,2025-02-01 16:25:19.181607,0 days 00:00:02.639514,softplus,256,,4,90,0.0001229363192316574,4,496,False,PRUNED
1735,,2025-02-01 16:25:19.201001,2025-02-01 16:25:22.241641,0 days 00:00:03.040640,softplus,256,,8,80,0.00011367195488440075,5,480,False,PRUNED
1736,,2025-02-01 16:25:22.260344,2025-02-01 16:25:26.602173,0 days 00:00:04.341829,softplus,256,0.2,4,90,0.00037712449824579266,4,512,True,PRUNED
1737,,2025-02-01 16:25:26.620005,2025-02-01 16:25:29.244871,0 days 00:00:02.624866,softplus,256,,4,100,0.002143303371602028,3,304,False,PRUNED
1738,,2025-02-01 16:25:29.262461,2025-02-01 16:25:31.879840,0 days 00:00:02.617379,softplus,256,,4,90,0.00010172941338232115,4,496,False,PRUNED
1739,,2025-02-01 16:25:31.897022,2025-02-01 16:25:35.674162,0 days 00:00:03.777140,softplus,128,,4,90,0.0005242322563166848,4,512,False,PRUNED
1740,,2025-02-01 16:25:35.692557,2025-02-01 16:25:40.655912,0 days 00:00:04.963355,relu,256,,4,80,0.00010162144943566481,4,512,False,PRUNED
1741,,2025-02-01 16:25:40.674293,2025-02-01 16:25:43.312368,0 days 00:00:02.638075,softplus,256,,8,90,0.00020979186771712173,4,496,False,PRUNED
1742,,2025-02-01 16:25:43.330594,2025-02-01 16:25:45.760937,0 days 00:00:02.430343,softplus,256,,4,90,0.00010142133484526914,3,512,False,PRUNED
1743,,2025-02-01 16:25:45.778906,2025-02-01 16:25:48.768501,0 days 00:00:02.989595,selu,256,,4,80,0.0007833992646297419,4,368,False,PRUNED
1744,,2025-02-01 16:25:48.786446,2025-02-01 16:25:50.868026,0 days 00:00:02.081580,softplus,1024,,4,100,0.0002470076194134331,4,480,False,PRUNED
1745,,2025-02-01 16:25:50.886877,2025-02-01 16:25:53.683036,0 days 00:00:02.796159,softplus,256,,4,90,0.00014594832918153332,4,464,False,PRUNED
1746,,2025-02-01 16:25:53.701996,2025-02-01 16:25:56.673126,0 days 00:00:02.971130,tanh,256,,16,90,0.00011339437231765811,4,512,False,PRUNED
1747,,2025-02-01 16:25:56.690353,2025-02-01 16:25:59.612773,0 days 00:00:02.922420,softplus,256,,4,50,0.00010148249379235232,4,496,False,PRUNED
1748,,2025-02-01 16:25:59.629942,2025-02-01 16:26:02.256586,0 days 00:00:02.626644,softplus,256,,2,90,0.005430275834312177,3,512,False,PRUNED
1749,,2025-02-01 16:26:02.275458,2025-02-01 16:26:05.919977,0 days 00:00:03.644519,softplus,128,,4,90,0.00010152714135496062,4,496,False,PRUNED
1750,,2025-02-01 16:26:05.937923,2025-02-01 16:26:08.863263,0 days 00:00:02.925340,softplus,256,,8,80,0.00032913435407202823,4,512,False,PRUNED
1751,,2025-02-01 16:26:08.880981,2025-02-01 16:26:11.525237,0 days 00:00:02.644256,softplus,256,,4,90,0.0001207309482509475,4,480,False,PRUNED
1752,,2025-02-01 16:26:11.542159,2025-02-01 16:26:14.130812,0 days 00:00:02.588653,selu,256,,4,90,0.00013619144327809562,4,512,False,PRUNED
1753,,2025-02-01 16:26:14.149933,2025-02-01 16:26:16.519310,0 days 00:00:02.369377,softplus,256,,4,100,0.00017614189308394043,3,496,False,PRUNED
1754,,2025-02-01 16:26:16.797238,2025-02-01 16:26:20.119735,0 days 00:00:03.322497,softplus,256,,64,80,0.00011242083367590293,4,512,False,PRUNED
1755,,2025-02-01 16:26:20.139254,2025-02-01 16:26:23.017457,0 days 00:00:02.878203,relu,256,,4,90,0.007030971113087073,4,496,False,PRUNED
1756,,2025-02-01 16:26:23.035790,2025-02-01 16:26:27.114819,0 days 00:00:04.079029,softplus,256,0.1,4,90,0.00010180298602863434,4,512,True,PRUNED
1757,,2025-02-01 16:26:27.131374,2025-02-01 16:26:29.721839,0 days 00:00:02.590465,softplus,512,,4,60,0.00010131437431250097,4,480,False,PRUNED
1758,,2025-02-01 16:26:29.739455,2025-02-01 16:26:33.911752,0 days 00:00:04.172297,gelu,128,,8,90,0.00010140797144332106,4,512,False,PRUNED
1759,,2025-02-01 16:26:33.928603,2025-02-01 16:26:36.312423,0 days 00:00:02.383820,softplus,256,,4,90,0.00015996280256636903,3,496,False,PRUNED
1760,,2025-02-01 16:26:36.328922,2025-02-01 16:26:39.043465,0 days 00:00:02.714543,softplus,256,,4,80,0.0001013541487523276,4,336,False,PRUNED
1761,,2025-02-01 16:26:39.062020,2025-02-01 16:26:42.307232,0 days 00:00:03.245212,softplus,256,,32,100,0.00012348939122581393,4,512,False,PRUNED
1762,,2025-02-01 16:26:42.323534,2025-02-01 16:26:45.101946,0 days 00:00:02.778412,selu,256,,4,90,0.0009169093716490603,4,496,False,PRUNED
1763,,2025-02-01 16:26:45.119464,2025-02-01 16:26:47.804093,0 days 00:00:02.684629,softplus,256,,4,70,0.0006538271432937986,4,512,False,PRUNED
1764,,2025-02-01 16:26:47.822683,2025-02-01 16:26:50.727842,0 days 00:00:02.905159,softplus,256,,4,90,0.00022610838664807032,4,464,False,PRUNED
1765,,2025-02-01 16:26:50.745699,2025-02-01 16:26:53.265664,0 days 00:00:02.519965,softplus,256,,8,80,0.000479899119774021,3,496,False,PRUNED
1766,,2025-02-01 16:26:53.284935,2025-02-01 16:26:55.946320,0 days 00:00:02.661385,softplus,256,,4,90,0.0013260614782154086,4,512,False,PRUNED
1767,,2025-02-01 16:26:55.968125,2025-02-01 16:27:00.133249,0 days 00:00:04.165124,softplus,128,,4,90,0.00011335568882164294,4,432,False,PRUNED
1768,,2025-02-01 16:27:00.152161,2025-02-01 16:27:02.221675,0 days 00:00:02.069514,softplus,1024,,4,90,0.00010180381854273242,4,496,False,PRUNED
1769,,2025-02-01 16:27:02.240817,2025-02-01 16:27:05.409502,0 days 00:00:03.168685,relu,256,,4,80,0.0004157026573711556,5,512,False,PRUNED
1770,,2025-02-01 16:27:05.428458,2025-02-01 16:27:08.194336,0 days 00:00:02.765878,tanh,256,,4,100,0.0027173667342263947,4,496,False,PRUNED
1771,,2025-02-01 16:27:08.500392,2025-02-01 16:27:10.963650,0 days 00:00:02.463258,softplus,256,,4,90,0.0002954297820712147,3,512,False,PRUNED
1772,,2025-02-01 16:27:10.981599,2025-02-01 16:27:13.731170,0 days 00:00:02.749571,selu,256,,8,90,0.00010148882667719622,4,128,False,PRUNED
1773,,2025-02-01 16:47:27.210349,2025-02-01 16:47:31.950909,0 days 00:00:04.740560,softplus,256,0.5,16,90,0.0005117055217097667,4,496,True,PRUNED
1774,,2025-02-01 16:47:31.959596,2025-02-01 16:47:34.850339,0 days 00:00:02.890743,softplus,256,,4,90,0.0001909196203021393,4,512,False,PRUNED
1775,,2025-02-01 16:47:34.867503,2025-02-01 16:47:37.661132,0 days 00:00:02.793629,softplus,256,,2,80,0.00011347552119771745,4,496,False,PRUNED
1776,,2025-02-01 16:47:37.679591,2025-02-01 16:47:41.612100,0 days 00:00:03.932509,softplus,128,,4,90,0.00010158301752590882,3,512,False,PRUNED
1777,,2025-02-01 16:47:41.630985,2025-02-01 16:47:44.443062,0 days 00:00:02.812077,softplus,256,,4,90,0.00010135615327857649,4,480,False,PRUNED
1778,,2025-02-01 16:47:44.461465,2025-02-01 16:47:47.106057,0 days 00:00:02.644592,softplus,256,,4,100,0.00013559124031958138,4,512,False,PRUNED
1779,,2025-02-01 16:47:47.123226,2025-02-01 16:47:50.023437,0 days 00:00:02.900211,softplus,256,,4,90,0.0001016578309206405,4,512,False,PRUNED
1780,,2025-02-01 16:47:50.041846,2025-02-01 16:47:52.841639,0 days 00:00:02.799793,softplus,256,,8,80,0.0005859104222835656,4,496,False,PRUNED
1781,,2025-02-01 16:47:52.860646,2025-02-01 16:47:55.366936,0 days 00:00:02.506290,selu,512,,64,90,0.00010148960922877701,4,192,False,PRUNED
1782,,2025-02-01 16:47:55.386677,2025-02-01 16:47:57.890543,0 days 00:00:02.503866,softplus,256,,4,90,0.00011350281616329797,3,480,False,PRUNED
1783,,2025-02-01 16:47:57.908549,2025-02-01 16:48:02.947578,0 days 00:00:05.039029,relu,256,,4,90,0.0001521572004181394,4,496,False,PRUNED
