number,value,datetime_start,datetime_complete,duration,params_activation,params_batch_size,params_dropout_rate,params_embedding_dim,params_epochs,params_learning_rate,params_n_hidden_layers,params_units_per_layer,params_use_dropout,state
813,3.319277048110962,2025-01-27 20:35:22.631282,2025-01-27 20:35:25.671485,0 days 00:00:03.040203,softplus,256,,64,90,0.00011655622539867172,4,480,False,PRUNED
814,2.5134897232055664,2025-01-27 20:35:25.687221,2025-01-27 20:35:29.256259,0 days 00:00:03.569038,softplus,256,,4,90,0.00015723097557339316,4,512,False,PRUNED
815,3.284653902053833,2025-01-27 20:35:29.272192,2025-01-27 20:35:31.391548,0 days 00:00:02.119356,selu,1024,,4,80,0.00022851274763179802,4,256,False,PRUNED
816,2.645603656768799,2025-01-27 20:35:31.407245,2025-01-27 20:35:36.197505,0 days 00:00:04.790260,softplus,256,,4,90,0.0003915726953930697,5,496,False,PRUNED
817,2.765852928161621,2025-01-27 20:35:36.213701,2025-01-27 20:35:38.752385,0 days 00:00:02.538684,relu,256,,4,90,0.00020247541725978895,4,512,False,PRUNED
818,3.2120211124420166,2025-01-27 20:35:38.768674,2025-01-27 20:35:41.433880,0 days 00:00:02.665206,softplus,256,,4,90,0.00010312562113155344,4,480,False,PRUNED
819,2.7945468425750732,2025-01-27 20:35:41.452634,2025-01-27 20:35:43.791775,0 days 00:00:02.339141,softplus,256,,4,80,0.00010394564407063977,4,496,False,PRUNED
820,2.5647361278533936,2025-01-27 20:35:43.809357,2025-01-27 20:35:47.516998,0 days 00:00:03.707641,softplus,256,,32,90,0.00031138631081599645,4,512,False,PRUNED
821,2.522282361984253,2025-01-27 20:35:47.532700,2025-01-27 20:35:50.973761,0 days 00:00:03.441061,softplus,256,,4,90,0.00010426688821261806,4,496,False,PRUNED
822,2.6439340114593506,2025-01-27 20:35:50.988897,2025-01-27 20:35:54.473871,0 days 00:00:03.484974,softplus,256,,4,90,0.0005717606831869615,4,512,False,PRUNED
823,2.5491185188293457,2025-01-27 20:35:54.489169,2025-01-27 20:35:58.437015,0 days 00:00:03.947846,gelu,256,,4,80,0.00023841438711702843,4,368,False,PRUNED
824,2.835843324661255,2025-01-27 20:35:58.452347,2025-01-27 20:36:00.838186,0 days 00:00:02.385839,softplus,256,,4,90,0.0006776901180275369,4,512,False,PRUNED
825,3.968169689178467,2025-01-27 20:36:00.854127,2025-01-27 20:36:03.216662,0 days 00:00:02.362535,selu,256,,4,90,0.00013558944851307868,4,496,False,PRUNED
826,3.011997938156128,2025-01-27 20:36:03.233697,2025-01-27 20:36:05.538638,0 days 00:00:02.304941,softplus,256,,4,80,0.0005054840227293098,4,512,False,PRUNED
827,10.62859058380127,2025-01-27 20:36:05.556370,2025-01-27 20:36:09.264616,0 days 00:00:03.708246,softplus,256,0.5,4,90,0.00045007661097221525,4,512,True,PRUNED
828,2.6106669902801514,2025-01-27 20:36:09.280670,2025-01-27 20:36:14.098512,0 days 00:00:04.817842,softplus,256,,4,90,0.0001150848496522762,4,496,False,PRUNED
829,2.7542107105255127,2025-01-27 20:36:14.113342,2025-01-27 20:36:17.550713,0 days 00:00:03.437371,softplus,256,,4,90,0.00010396093108446916,4,480,False,PRUNED
830,3.0122995376586914,2025-01-27 20:36:17.568116,2025-01-27 20:36:19.597589,0 days 00:00:02.029473,softplus,256,,4,90,0.0001493681998085536,1,496,False,PRUNED
831,3.0841481685638428,2025-01-27 20:36:19.613556,2025-01-27 20:36:22.374780,0 days 00:00:02.761224,tanh,256,,16,80,0.00010381963039048163,4,512,False,PRUNED
832,2.5607316493988037,2025-01-27 20:36:22.390443,2025-01-27 20:36:28.099750,0 days 00:00:05.709307,relu,256,,2,90,0.00011557455740636691,4,480,False,PRUNED
833,2.8263018131256104,2025-01-27 20:36:28.114169,2025-01-27 20:36:30.916339,0 days 00:00:02.802170,softplus,256,,4,90,0.0007689584953166344,4,496,False,PRUNED
834,3.3095054626464844,2025-01-27 20:36:30.931951,2025-01-27 20:36:32.620919,0 days 00:00:01.688968,softplus,1024,,4,80,0.0003522836767953283,4,512,False,PRUNED
835,2.925401449203491,2025-01-27 20:36:32.638009,2025-01-27 20:36:35.063278,0 days 00:00:02.425269,selu,256,,4,90,0.0008501412699799506,4,512,False,PRUNED
836,3.167116165161133,2025-01-27 20:36:35.079084,2025-01-27 20:36:37.486806,0 days 00:00:02.407722,softplus,256,,4,90,0.00010430780945167428,4,512,False,PRUNED
837,3.179025173187256,2025-01-27 20:52:18.252137,2025-01-27 20:52:22.547288,0 days 00:00:04.295151,softplus,256,,4,90,0.0002622454518164363,4,496,False,PRUNED
838,2.536933660507202,2025-01-27 20:52:22.554828,2025-01-27 20:52:27.046892,0 days 00:00:04.492064,softplus,256,,64,80,0.00012710115463981575,4,512,False,PRUNED
839,3.1563210487365723,2025-01-27 20:52:27.061711,2025-01-27 20:52:30.451601,0 days 00:00:03.389890,softplus,256,,4,90,0.00010443326093192882,4,496,False,PRUNED
840,2.7481892108917236,2025-01-27 20:52:30.468246,2025-01-27 20:52:34.067772,0 days 00:00:03.599526,softplus,256,,4,90,0.00018767736507124564,4,512,False,PRUNED
841,2.833303213119507,2025-01-27 20:52:34.082470,2025-01-27 20:52:36.489041,0 days 00:00:02.406571,softplus,256,,4,80,0.0001037654866183904,4,432,False,PRUNED
842,2.6904377937316895,2025-01-27 20:52:36.505113,2025-01-27 20:52:40.446256,0 days 00:00:03.941143,softplus,256,,4,90,0.00011683011770075373,4,480,False,PRUNED
843,,2025-01-27 20:52:40.462227,2025-01-27 20:52:43.051264,0 days 00:00:02.589037,gelu,256,,4,90,0.0018577445305465326,4,128,False,FAIL
844,2.766942262649536,2025-01-27 20:57:24.165118,2025-01-27 20:57:27.416064,0 days 00:00:03.250946,gelu,256,,4,90,0.00010330885220228111,4,304,False,PRUNED
845,3.330299139022827,2025-01-27 20:57:27.424044,2025-01-27 20:57:30.113695,0 days 00:00:02.689651,softplus,256,,32,90,0.00015781037560439503,4,496,False,PRUNED
846,2.5379414558410645,2025-01-27 20:57:30.128672,2025-01-27 20:57:34.025766,0 days 00:00:03.897094,selu,256,,4,40,0.00010367655150107396,5,496,False,PRUNED
847,77.56229400634766,2025-01-27 20:57:34.041613,2025-01-27 20:57:38.979969,0 days 00:00:04.938356,relu,256,0.30000000000000004,4,10,0.00011811543651116158,4,512,True,PRUNED
848,3.1150717735290527,2025-01-27 20:57:38.995506,2025-01-27 20:57:41.704867,0 days 00:00:02.709361,softplus,256,,4,80,0.00022585841150879588,4,512,False,PRUNED
849,3.3929545879364014,2025-01-27 20:57:41.719926,2025-01-27 20:57:44.288268,0 days 00:00:02.568342,softplus,256,,4,90,0.00010331235512822959,4,96,False,PRUNED
850,2.6068572998046875,2025-01-27 20:57:44.303807,2025-01-27 20:57:47.954289,0 days 00:00:03.650482,softplus,256,,4,90,0.0012918743064147125,4,496,False,PRUNED
851,4.316396713256836,2025-01-27 20:57:47.971237,2025-01-27 20:57:50.373828,0 days 00:00:02.402591,softplus,256,,4,90,0.00010363511928150272,4,512,False,PRUNED
852,2.571101188659668,2025-01-27 20:57:50.390130,2025-01-27 20:57:55.117038,0 days 00:00:04.726908,softplus,256,,4,80,0.0002790272147586683,4,480,False,PRUNED
853,3.3677029609680176,2025-01-27 20:57:55.132781,2025-01-27 20:57:57.683700,0 days 00:00:02.550919,softplus,256,,4,90,0.0001347455958179497,4,496,False,PRUNED
854,2.919605255126953,2025-01-27 20:57:57.699517,2025-01-27 20:58:00.128059,0 days 00:00:02.428542,softplus,256,,4,90,0.00011581604038817692,4,512,False,PRUNED
855,2.533909797668457,2025-01-27 20:58:00.144154,2025-01-27 20:58:03.682401,0 days 00:00:03.538247,selu,256,,4,90,0.000983884049775419,4,496,False,PRUNED
856,2.8215560913085938,2025-01-27 20:58:03.699575,2025-01-27 20:58:06.347231,0 days 00:00:02.647656,softplus,256,,16,90,0.0001032375267690414,4,512,False,PRUNED
857,9.483221054077148,2025-01-27 20:58:06.364969,2025-01-27 20:58:10.651053,0 days 00:00:04.286084,tanh,1024,,4,80,0.00010345288890357585,4,144,False,PRUNED
858,2.657503128051758,2025-01-27 20:58:10.666329,2025-01-27 20:58:14.474469,0 days 00:00:03.808140,softplus,256,,2,90,0.00017712779528442004,4,496,False,PRUNED
859,5.4488019943237305,2025-01-27 20:58:14.490910,2025-01-27 20:58:16.961565,0 days 00:00:02.470655,softplus,256,,4,90,0.0001231069743563345,4,512,False,PRUNED
860,2.677781581878662,2025-01-27 20:58:16.978979,2025-01-27 20:58:20.460879,0 days 00:00:03.481900,softplus,256,,4,90,0.00010326760626678948,4,512,False,PRUNED
861,2.775070905685425,2025-01-27 20:58:20.476638,2025-01-27 20:58:22.956835,0 days 00:00:02.480197,softplus,256,,4,90,0.00014576828537191266,4,176,False,PRUNED
862,2.655813455581665,2025-01-27 20:58:22.973430,2025-01-27 20:58:27.977744,0 days 00:00:05.004314,relu,256,,4,80,0.00011573695117411421,4,512,False,PRUNED
863,2.941509485244751,2025-01-27 20:58:27.992848,2025-01-27 20:58:30.738452,0 days 00:00:02.745604,softplus,256,,4,90,0.00039947944318198823,4,496,False,PRUNED
864,3.0792763233184814,2025-01-27 20:58:30.753747,2025-01-27 20:58:33.730968,0 days 00:00:02.977221,softplus,256,,64,90,0.00010343148791204161,4,480,False,PRUNED
865,2.705076217651367,2025-01-27 20:58:33.745903,2025-01-27 20:58:37.286358,0 days 00:00:03.540455,selu,256,,4,80,0.00046534852084823605,4,208,False,PRUNED
866,55.72740173339844,2025-01-27 20:58:37.301882,2025-01-27 20:58:41.148771,0 days 00:00:03.846889,softplus,256,0.4,4,90,0.00011439130151819231,4,512,True,PRUNED
867,3.6822075843811035,2025-01-27 20:58:41.165115,2025-01-27 20:58:44.640890,0 days 00:00:03.475775,softplus,256,,4,90,0.00010351865287458361,4,496,False,PRUNED
868,2.5038371086120605,2025-01-27 20:58:44.655295,2025-01-27 20:58:49.561888,0 days 00:00:04.906593,softplus,256,,4,90,0.0002825340677270754,4,416,False,PRUNED
869,2.7408885955810547,2025-01-27 20:58:49.577387,2025-01-27 20:58:54.575230,0 days 00:00:04.997843,softplus,256,,32,30,0.0001276852011660907,4,512,False,PRUNED
870,2.505977153778076,2025-01-27 20:58:54.590105,2025-01-27 20:58:58.021369,0 days 00:00:03.431264,softplus,256,,4,80,0.0005505827480573864,4,480,False,PRUNED
871,3.3620989322662354,2025-01-27 20:58:58.036731,2025-01-27 20:59:00.662164,0 days 00:00:02.625433,gelu,256,,4,90,0.001161124756558842,4,496,False,PRUNED
872,2.687732458114624,2025-01-27 20:59:00.680696,2025-01-27 20:59:05.264589,0 days 00:00:04.583893,softplus,256,,4,90,0.00010348113511305938,4,512,False,PRUNED
873,3.5740373134613037,2025-01-27 20:59:05.281662,2025-01-27 20:59:07.965438,0 days 00:00:02.683776,softplus,256,,4,90,0.00034675760956973876,4,496,False,PRUNED
874,3.192535400390625,2025-01-27 20:59:07.983472,2025-01-27 20:59:10.601935,0 days 00:00:02.618463,selu,256,,4,80,0.00010336709398336515,4,512,False,PRUNED
875,2.6787328720092773,2025-01-27 20:59:10.617944,2025-01-27 20:59:14.000716,0 days 00:00:03.382772,softplus,256,,4,90,0.00016761304972873263,4,496,False,PRUNED
876,3.265127182006836,2025-01-27 20:59:14.017745,2025-01-27 20:59:18.146126,0 days 00:00:04.128381,relu,1024,,4,90,0.00010344503268348443,4,480,False,PRUNED
877,3.063488483428955,2025-01-27 20:59:18.163037,2025-01-27 20:59:20.544246,0 days 00:00:02.381209,softplus,256,,4,90,0.00011506393172770953,4,512,False,PRUNED
878,2.569751739501953,2025-01-27 20:59:20.559638,2025-01-27 20:59:24.457124,0 days 00:00:03.897486,softplus,256,,4,80,0.002536803981309615,4,512,False,PRUNED
879,3.0454697608947754,2025-01-27 20:59:24.474650,2025-01-27 20:59:26.908212,0 days 00:00:02.433562,softplus,256,,16,90,0.00020161795755509012,4,512,False,PRUNED
880,2.775142192840576,2025-01-27 20:59:26.924728,2025-01-27 20:59:29.129451,0 days 00:00:02.204723,softplus,256,,4,90,0.0006729740053548835,4,496,False,PRUNED
881,3.063077926635742,2025-01-27 20:59:29.146601,2025-01-27 20:59:31.368795,0 days 00:00:02.222194,softplus,256,,4,90,0.0001408032763867429,4,496,False,PRUNED
882,2.5635008811950684,2025-01-27 20:59:31.384348,2025-01-27 20:59:34.607522,0 days 00:00:03.223174,softplus,256,,4,80,0.00010319784446316482,4,512,False,PRUNED
883,3.024547576904297,2025-01-27 20:59:34.622661,2025-01-27 20:59:39.852147,0 days 00:00:05.229486,tanh,256,,2,90,0.00010381823114630506,5,480,False,PRUNED
884,2.804436683654785,2025-01-27 20:59:39.867611,2025-01-27 20:59:43.268559,0 days 00:00:03.400948,softplus,256,,4,90,0.0001283658422087984,4,512,False,PRUNED
885,2.819772243499756,2025-01-27 20:59:43.285171,2025-01-27 20:59:47.049988,0 days 00:00:03.764817,selu,256,0.1,4,80,0.0019937240143920332,4,480,True,PRUNED
886,2.9519457817077637,2025-01-27 20:59:47.065238,2025-01-27 20:59:50.512261,0 days 00:00:03.447023,softplus,256,,4,90,0.00010327258568253318,4,512,False,PRUNED
887,2.4473142623901367,2025-01-27 20:59:50.528933,2025-01-27 20:59:56.118520,0 days 00:00:05.589587,softplus,256,,64,90,0.00011518626431223343,4,496,False,PRUNED
888,2.6114888191223145,2025-01-27 20:59:56.133512,2025-01-27 20:59:59.985141,0 days 00:00:03.851629,softplus,256,,4,90,0.00023089643601926645,4,512,False,PRUNED
889,4.041549205780029,2025-01-27 21:00:00.000894,2025-01-27 21:00:04.739258,0 days 00:00:04.738364,relu,256,,4,80,0.00025059100335752323,4,496,False,PRUNED
890,2.8800859451293945,2025-01-27 21:00:04.756808,2025-01-27 21:00:07.092052,0 days 00:00:02.335244,softplus,256,,4,90,0.0015145045870083723,4,512,False,PRUNED
891,2.8050942420959473,2025-01-27 21:00:07.108547,2025-01-27 21:00:10.736280,0 days 00:00:03.627733,softplus,256,,4,90,0.00010344917857579046,4,496,False,PRUNED
892,2.8538622856140137,2025-01-27 21:00:10.751001,2025-01-27 21:00:13.181721,0 days 00:00:02.430720,softplus,256,,4,90,0.00010331012151657473,4,512,False,PRUNED
893,2.818242311477661,2025-01-27 21:00:13.197693,2025-01-27 21:00:15.931113,0 days 00:00:02.733420,softplus,256,,4,80,0.00011466768469979215,4,496,False,PRUNED
894,2.8540613651275635,2025-01-27 21:00:15.947187,2025-01-27 21:00:18.383332,0 days 00:00:02.436145,selu,256,,4,90,0.00010331433701260793,4,512,False,PRUNED
895,2.9680285453796387,2025-01-27 21:00:18.398531,2025-01-27 21:00:20.935848,0 days 00:00:02.537317,softplus,256,,32,90,0.001240482854173436,4,496,False,PRUNED
896,2.771977663040161,2025-01-27 21:00:20.952610,2025-01-27 21:00:24.434964,0 days 00:00:03.482354,softplus,256,,4,90,0.0043004829884523855,4,512,False,PRUNED
897,2.5765187740325928,2025-01-27 21:00:24.451548,2025-01-27 21:00:26.934871,0 days 00:00:02.483323,gelu,1024,,4,80,0.0006544838600988437,4,512,False,PRUNED
898,2.782151937484741,2025-01-27 21:00:26.952197,2025-01-27 21:00:29.560962,0 days 00:00:02.608765,softplus,256,,4,90,0.0003363715013598129,4,496,False,PRUNED
899,2.749908447265625,2025-01-27 21:00:29.577823,2025-01-27 21:00:32.962745,0 days 00:00:03.384922,softplus,256,,4,20,0.00012424765498657763,4,512,False,PRUNED
900,2.58682918548584,2025-01-27 21:00:32.979297,2025-01-27 21:00:36.483963,0 days 00:00:03.504666,softplus,256,,4,100,0.0001491365220085656,4,480,False,PRUNED
901,2.8192687034606934,2025-01-27 21:00:36.500247,2025-01-27 21:00:38.761917,0 days 00:00:02.261670,softplus,256,,4,90,0.003296370598735728,4,496,False,PRUNED
902,2.5404224395751953,2025-01-27 21:00:38.779215,2025-01-27 21:00:42.098951,0 days 00:00:03.319736,softplus,256,,4,90,0.0017618910172794427,4,32,False,PRUNED
903,2.593916654586792,2025-01-27 21:00:42.113164,2025-01-27 21:00:48.385545,0 days 00:00:06.272381,relu,256,,16,80,0.0003113341666879909,4,512,False,PRUNED
904,3.007261037826538,2025-01-27 21:00:48.401089,2025-01-27 21:00:50.829539,0 days 00:00:02.428450,selu,256,,4,90,0.0011121871029779174,4,496,False,PRUNED
905,12.589653015136719,2025-01-27 21:00:50.847776,2025-01-27 21:00:54.582096,0 days 00:00:03.734320,softplus,256,0.4,2,90,0.002908055830569646,4,512,True,PRUNED
906,2.816375732421875,2025-01-27 21:00:54.598493,2025-01-27 21:00:58.133521,0 days 00:00:03.535028,softplus,256,,4,100,0.0005391730212940749,4,496,False,PRUNED
907,3.015895366668701,2025-01-27 21:00:58.149822,2025-01-27 21:01:00.395081,0 days 00:00:02.245259,softplus,256,,4,80,0.004701494655217504,4,480,False,PRUNED
908,3.467251777648926,2025-01-27 21:01:00.410973,2025-01-27 21:01:03.011684,0 days 00:00:02.600711,softplus,256,,4,90,0.00043412571796861137,4,512,False,PRUNED
909,3.0027475357055664,2025-01-27 21:01:03.026801,2025-01-27 21:01:07.472096,0 days 00:00:04.445295,tanh,256,,4,90,0.00011493698798060348,4,512,False,PRUNED
910,3.2070000171661377,2025-01-27 21:01:07.488392,2025-01-27 21:01:09.747599,0 days 00:00:02.259207,softplus,256,,4,90,0.0005952499641557693,4,480,False,PRUNED
911,2.5183029174804688,2025-01-27 21:01:09.764612,2025-01-27 21:01:14.152661,0 days 00:00:04.388049,softplus,256,,64,90,0.0007911912019624865,4,512,False,PRUNED
912,2.5165348052978516,2025-01-27 21:01:14.168702,2025-01-27 21:01:17.594610,0 days 00:00:03.425908,softplus,256,,4,80,0.0014491270047954168,4,496,False,PRUNED
913,2.5399200916290283,2025-01-27 21:01:17.610442,2025-01-27 21:01:21.429379,0 days 00:00:03.818937,softplus,256,,4,90,0.0009291242984658783,4,512,False,PRUNED
914,2.899702548980713,2025-01-27 21:01:21.445775,2025-01-27 21:01:24.889741,0 days 00:00:03.443966,selu,256,,4,90,0.0022150182023027657,4,496,False,PRUNED
915,3.51466965675354,2025-01-27 21:01:24.904966,2025-01-27 21:01:27.872442,0 days 00:00:02.967476,softplus,256,,4,100,0.00010318764063675531,2,512,False,PRUNED
916,3.2647461891174316,2025-01-27 21:01:27.888571,2025-01-27 21:01:30.158069,0 days 00:00:02.269498,softplus,256,,4,90,0.0009420754221158157,4,496,False,PRUNED
917,2.6278886795043945,2025-01-27 21:01:30.174298,2025-01-27 21:01:34.083650,0 days 00:00:03.909352,relu,1024,,4,80,0.00021486607471466138,4,512,False,PRUNED
918,,2025-01-27 21:01:34.100486,2025-01-27 21:01:35.356070,0 days 00:00:01.255584,softplus,256,,32,90,0.0001034196359523753,4,272,False,FAIL
919,2.558732032775879,2025-01-27 22:14:46.593812,2025-01-27 22:14:51.006492,0 days 00:00:04.412680,softplus,256,,32,90,0.00013456099697501536,4,496,False,PRUNED
920,2.943727493286133,2025-01-27 22:14:51.013539,2025-01-27 22:14:53.356281,0 days 00:00:02.342742,softplus,256,,4,90,0.00010373492331138017,4,128,False,PRUNED
921,2.872936964035034,2025-01-27 22:14:53.372893,2025-01-27 22:14:56.987557,0 days 00:00:03.614664,softplus,256,,4,90,0.0001150073408176478,4,512,False,PRUNED
922,2.7682368755340576,2025-01-27 22:14:57.001859,2025-01-27 22:15:00.618918,0 days 00:00:03.617059,softplus,256,,4,80,0.0001029924872859706,4,480,False,PRUNED
923,3.0395524501800537,2025-01-27 22:15:00.634107,2025-01-27 22:15:03.232254,0 days 00:00:02.598147,softplus,256,,4,90,0.0034113820504955606,4,512,False,PRUNED
924,2.582568645477295,2025-01-27 22:15:03.247527,2025-01-27 22:15:07.060961,0 days 00:00:03.813434,selu,256,,4,100,0.00018917320876837092,5,496,False,PRUNED
925,12.55785846710205,2025-01-27 22:15:07.077653,2025-01-27 22:15:10.986716,0 days 00:00:03.909063,gelu,256,0.1,4,90,0.0001033860008529918,4,512,True,PRUNED
926,2.8515408039093018,2025-01-27 22:15:11.002657,2025-01-27 22:15:13.704621,0 days 00:00:02.701964,softplus,256,,4,90,0.00015572294280588475,4,496,False,PRUNED
927,2.764352798461914,2025-01-27 22:15:13.721228,2025-01-27 22:15:15.946726,0 days 00:00:02.225498,softplus,256,,4,80,0.00010357166448609835,4,496,False,PRUNED
928,2.47965669631958,2025-01-27 22:15:15.963724,2025-01-27 22:15:19.969258,0 days 00:00:04.005534,softplus,256,,4,90,0.0002661168665216892,1,512,False,PRUNED
929,2.829551935195923,2025-01-27 22:15:19.985711,2025-01-27 22:15:22.606769,0 days 00:00:02.621058,softplus,256,,2,90,0.0001029335777201317,4,512,False,PRUNED
930,2.55511474609375,2025-01-27 22:15:22.622632,2025-01-27 22:15:26.229155,0 days 00:00:03.606523,softplus,256,,16,100,0.00011432752631364622,4,480,False,PRUNED
931,3.0241570472717285,2025-01-27 22:15:26.243261,2025-01-27 22:15:28.702292,0 days 00:00:02.459031,softplus,256,,4,90,0.00012522148881513403,4,512,False,PRUNED
932,2.7561702728271484,2025-01-27 22:15:28.717732,2025-01-27 22:15:32.162119,0 days 00:00:03.444387,softplus,256,,4,80,0.0003709334229119947,4,496,False,PRUNED
933,2.610548973083496,2025-01-27 22:15:32.177538,2025-01-27 22:15:35.905836,0 days 00:00:03.728298,selu,256,,4,90,0.0001374872391942027,4,512,False,PRUNED
934,2.8547892570495605,2025-01-27 22:15:35.921553,2025-01-27 22:15:40.597375,0 days 00:00:04.675822,softplus,256,,4,40,0.0002927110656920338,4,496,False,PRUNED
935,2.772282361984253,2025-01-27 22:15:40.612048,2025-01-27 22:15:43.510250,0 days 00:00:02.898202,softplus,256,,64,90,0.00011609364835086506,4,480,False,PRUNED
936,2.60845947265625,2025-01-27 22:15:43.528307,2025-01-27 22:15:49.273032,0 days 00:00:05.744725,relu,256,,4,80,0.00010314011128783063,4,512,False,PRUNED
937,3.0490758419036865,2025-01-27 22:15:49.290494,2025-01-27 22:15:52.780079,0 days 00:00:03.489585,softplus,256,,4,90,0.00017811736914405188,4,400,False,PRUNED
938,2.7909843921661377,2025-01-27 22:15:52.797011,2025-01-27 22:15:57.562150,0 days 00:00:04.765139,tanh,256,,4,90,0.0006344065471896111,4,496,False,PRUNED
939,2.9546258449554443,2025-01-27 22:15:57.577563,2025-01-27 22:16:00.120905,0 days 00:00:02.543342,softplus,1024,,4,100,0.0004898051826881998,4,512,False,PRUNED
940,5.262783050537109,2025-01-27 22:16:00.136365,2025-01-27 22:16:02.642485,0 days 00:00:02.506120,softplus,256,,4,90,0.00010290841914441492,4,336,False,PRUNED
941,2.684776782989502,2025-01-27 22:16:02.657938,2025-01-27 22:16:06.175941,0 days 00:00:03.518003,softplus,256,,4,80,0.00010306829129201313,4,480,False,PRUNED
942,6.274021148681641,2025-01-27 22:16:06.190613,2025-01-27 22:16:10.190915,0 days 00:00:04.000302,softplus,256,0.2,32,90,0.001651205422847287,4,512,True,PRUNED
943,2.9601223468780518,2025-01-27 22:16:10.205686,2025-01-27 22:16:14.195527,0 days 00:00:03.989841,selu,256,,4,90,0.00010321735382492476,4,480,False,PRUNED
944,3.3435988426208496,2025-01-27 22:16:14.211302,2025-01-27 22:16:16.505986,0 days 00:00:02.294684,softplus,256,,4,80,0.00010302010809509527,4,512,False,PRUNED
945,2.6339120864868164,2025-01-27 22:16:16.522622,2025-01-27 22:16:19.991254,0 days 00:00:03.468632,softplus,256,,4,90,0.00012252497144746804,4,496,False,PRUNED
946,2.810670852661133,2025-01-27 22:16:20.007154,2025-01-27 22:16:22.285118,0 days 00:00:02.277964,softplus,256,,4,90,0.0001657520007872191,4,496,False,PRUNED
947,4.6742706298828125,2025-01-27 22:16:22.300607,2025-01-27 22:16:24.913721,0 days 00:00:02.613114,relu,256,,4,100,0.00010289467305787115,4,512,False,PRUNED
948,3.142998695373535,2025-01-27 22:16:24.930706,2025-01-27 22:16:27.250285,0 days 00:00:02.319579,softplus,256,,4,90,0.00011348688606073645,4,272,False,PRUNED
