number,value,datetime_start,datetime_complete,duration,params_activation,params_batch_size,params_dropout_rate,params_embedding_dim,params_epochs,params_learning_rate,params_n_hidden_layers,params_units_per_layer,params_use_dropout,state
1085,2.513166904449463,2025-01-27 22:33:06.669491,2025-01-27 22:33:10.334396,0 days 00:00:03.664905,gelu,256,,4,90,0.0001976470690225995,4,512,False,PRUNED
1086,3.2349941730499268,2025-01-27 22:33:10.351926,2025-01-27 22:33:13.024859,0 days 00:00:02.672933,softplus,256,,4,90,0.0023760237266183225,4,512,False,PRUNED
1087,2.8301753997802734,2025-01-27 22:33:13.042561,2025-01-27 22:33:16.488616,0 days 00:00:03.446055,softplus,256,,4,80,0.001606988614020446,4,496,False,PRUNED
1088,3.0714735984802246,2025-01-27 22:33:16.507247,2025-01-27 22:33:20.023161,0 days 00:00:03.515914,softplus,256,,4,90,0.00010272167124736125,4,512,False,PRUNED
1089,2.6193771362304688,2025-01-27 22:33:20.039810,2025-01-27 22:33:23.505658,0 days 00:00:03.465848,softplus,256,,4,90,0.00012500739030175893,4,496,False,PRUNED
1090,3.4612550735473633,2025-01-27 22:33:23.521101,2025-01-27 22:33:26.198413,0 days 00:00:02.677312,softplus,256,,32,90,0.00010282099721829088,4,448,False,PRUNED
1091,2.9060912132263184,2025-01-27 22:33:26.217819,2025-01-27 22:33:31.092599,0 days 00:00:04.874780,relu,256,,4,100,0.00011477346630101904,4,480,False,PRUNED
1092,2.900184392929077,2025-01-27 22:33:31.110066,2025-01-27 22:33:33.529582,0 days 00:00:02.419516,softplus,256,,4,80,0.0033964534441959706,4,512,False,PRUNED
1093,2.9777443408966064,2025-01-27 22:33:33.546540,2025-01-27 22:33:36.073582,0 days 00:00:02.527042,selu,256,,4,90,0.00010250860488719003,4,496,False,PRUNED
1094,3.0756893157958984,2025-01-27 22:33:36.089856,2025-01-27 22:33:37.860143,0 days 00:00:01.770287,softplus,1024,,4,90,0.0030139011166161,4,496,False,PRUNED
1095,2.7716591358184814,2025-01-27 22:33:37.878727,2025-01-27 22:33:41.499433,0 days 00:00:03.620706,softplus,256,,4,80,0.0006127130973122545,4,512,False,PRUNED
1096,2.808502674102783,2025-01-27 22:33:41.517240,2025-01-27 22:33:46.834380,0 days 00:00:05.317140,tanh,256,,4,30,0.00046146162387670397,5,480,False,PRUNED
1097,54.35429763793945,2025-01-27 22:33:46.851822,2025-01-27 22:33:50.717855,0 days 00:00:03.866033,softplus,256,0.4,4,20,0.00010289984364321707,4,512,True,PRUNED
1098,2.401154041290283,2025-01-27 22:33:50.735347,2025-01-27 22:33:55.191304,0 days 00:00:04.455957,softplus,256,,4,90,0.0001136550775601436,4,496,False,PRUNED
1099,2.732363224029541,2025-01-27 22:33:55.208090,2025-01-27 22:33:58.705711,0 days 00:00:03.497621,softplus,256,,4,90,0.00015408850176193106,4,512,False,PRUNED
1100,2.513864278793335,2025-01-27 22:33:58.723309,2025-01-27 22:34:02.391591,0 days 00:00:03.668282,softplus,256,,4,90,0.00010234200136991571,4,464,False,PRUNED
1101,2.44535756111145,2025-01-27 22:34:02.409350,2025-01-27 22:34:07.495710,0 days 00:00:05.086360,softplus,256,,16,100,0.0021082894152138812,4,496,False,PRUNED
1102,2.9016170501708984,2025-01-27 22:34:07.512716,2025-01-27 22:34:10.907805,0 days 00:00:03.395089,softplus,128,,4,90,0.00013055278099677003,4,512,False,PRUNED
1103,2.6103622913360596,2025-01-27 22:34:10.924168,2025-01-27 22:34:14.520129,0 days 00:00:03.595961,selu,256,,2,80,0.00010282905897891252,4,480,False,PRUNED
1104,2.8169660568237305,2025-01-27 22:34:14.536329,2025-01-27 22:34:16.803350,0 days 00:00:02.267021,softplus,256,,4,90,0.0013471702191458783,4,496,False,PRUNED
1105,2.9883251190185547,2025-01-27 22:34:16.822215,2025-01-27 22:34:19.186224,0 days 00:00:02.364009,softplus,256,,4,90,0.0002908674876380559,4,512,False,PRUNED
1106,3.574892282485962,2025-01-27 22:34:19.204787,2025-01-27 22:34:22.982333,0 days 00:00:03.777546,relu,512,,4,80,0.001978354238809534,4,496,False,PRUNED
1107,2.4438509941101074,2025-01-27 22:34:23.000196,2025-01-27 22:34:28.462337,0 days 00:00:05.462141,softplus,256,,64,90,0.00010270811045146557,4,512,False,PRUNED
1108,3.0640451908111572,2025-01-27 22:34:28.481712,2025-01-27 22:34:30.764384,0 days 00:00:02.282672,softplus,256,,4,90,0.006004002133689409,4,512,False,PRUNED
1109,2.5519609451293945,2025-01-27 22:34:30.782295,2025-01-27 22:34:34.223857,0 days 00:00:03.441562,softplus,256,,4,100,0.0011465199392294296,4,176,False,PRUNED
1110,2.8622641563415527,2025-01-27 22:34:34.241197,2025-01-27 22:34:36.950194,0 days 00:00:02.708997,softplus,256,,4,90,0.00010254447865010645,4,224,False,PRUNED
1111,2.837841510772705,2025-01-27 22:34:36.966917,2025-01-27 22:34:40.385199,0 days 00:00:03.418282,softplus,128,,4,90,0.0005537712271074364,4,496,False,PRUNED
1112,2.7705421447753906,2025-01-27 22:34:40.402964,2025-01-27 22:34:42.736741,0 days 00:00:02.333777,selu,256,,4,80,0.0002698316233183295,4,512,False,PRUNED
1113,2.6579625606536865,2025-01-27 22:34:42.754869,2025-01-27 22:34:46.514967,0 days 00:00:03.760098,gelu,256,,4,90,0.00017187682364779255,4,480,False,PRUNED
1114,3.071822166442871,2025-01-27 22:34:46.532884,2025-01-27 22:34:48.940046,0 days 00:00:02.407162,softplus,256,,4,90,0.0001026319539825945,4,512,False,PRUNED
1115,2.8348307609558105,2025-01-27 22:34:48.958001,2025-01-27 22:34:53.179615,0 days 00:00:04.221614,softplus,256,,32,90,0.00011290907930174442,4,496,False,PRUNED
1116,26.766916275024414,2025-01-27 22:34:53.198186,2025-01-27 22:34:56.893976,0 days 00:00:03.695790,softplus,256,0.30000000000000004,4,80,0.00013488308330739015,4,512,True,PRUNED
1117,2.932013988494873,2025-01-27 22:34:56.910981,2025-01-27 22:34:59.283465,0 days 00:00:02.372484,softplus,256,,4,100,0.00011420336898376217,4,496,False,PRUNED
1118,2.4648351669311523,2025-01-27 22:34:59.301738,2025-01-27 22:35:04.168275,0 days 00:00:04.866537,softplus,256,,4,10,0.0008575689401953939,4,512,False,PRUNED
1119,2.902320623397827,2025-01-27 22:35:04.184605,2025-01-27 22:35:05.937663,0 days 00:00:01.753058,softplus,1024,,4,90,0.00010249682121644755,4,480,False,PRUNED
1120,2.989360809326172,2025-01-27 22:35:05.956108,2025-01-27 22:35:11.668954,0 days 00:00:05.712846,relu,128,,4,40,0.0003288012890427121,4,512,False,PRUNED
1121,2.9668543338775635,2025-01-27 22:35:11.686086,2025-01-27 22:35:13.981937,0 days 00:00:02.295851,softplus,256,,4,90,0.0022396529808229003,4,496,False,PRUNED
1122,2.9078712463378906,2025-01-27 22:35:13.999923,2025-01-27 22:35:18.728701,0 days 00:00:04.728778,tanh,256,,4,90,0.00025836050036319626,4,496,False,PRUNED
1123,3.144249200820923,2025-01-27 22:35:18.747016,2025-01-27 22:35:22.362696,0 days 00:00:03.615680,selu,256,,4,80,0.00010252957520823249,4,512,False,PRUNED
1124,4.171992778778076,2025-01-27 22:35:22.379164,2025-01-27 22:35:24.802351,0 days 00:00:02.423187,softplus,256,,4,90,0.00012473083581461818,4,512,False,PRUNED
1125,2.9776110649108887,2025-01-27 22:35:24.819692,2025-01-27 22:35:27.622613,0 days 00:00:02.802921,softplus,256,,16,100,0.00010257286298481277,4,496,False,PRUNED
1126,2.5708630084991455,2025-01-27 22:35:27.640779,2025-01-27 22:35:31.168878,0 days 00:00:03.528099,softplus,256,,4,90,0.0002224040224109453,4,512,False,PRUNED
1127,2.902405023574829,2025-01-27 22:35:31.186864,2025-01-27 22:35:34.871057,0 days 00:00:03.684193,softplus,256,,2,80,0.00011488099034549547,4,512,False,PRUNED
1128,2.5563066005706787,2025-01-27 22:35:34.888607,2025-01-27 22:35:38.372027,0 days 00:00:03.483420,softplus,256,,4,90,0.0001441160374875471,4,480,False,PRUNED
1129,2.693011999130249,2025-01-27 22:35:38.387906,2025-01-27 22:35:43.894126,0 days 00:00:05.506220,softplus,128,,4,90,0.0006820229805099702,5,496,False,PRUNED
1130,3.3737852573394775,2025-01-27 22:35:43.910658,2025-01-27 22:35:46.673204,0 days 00:00:02.762546,softplus,256,,4,90,0.00010253104423036126,4,512,False,PRUNED
1131,2.5824265480041504,2025-01-27 22:35:46.693309,2025-01-27 22:35:50.897285,0 days 00:00:04.203976,selu,256,,64,80,0.00010254475471214965,4,496,False,PRUNED
1132,3.8718743324279785,2025-01-27 22:35:50.915275,2025-01-27 22:35:53.144817,0 days 00:00:02.229542,softplus,512,,4,90,0.00011381008823537708,4,496,False,PRUNED
1133,4.1754631996154785,2025-01-27 22:35:53.163825,2025-01-27 22:35:55.573785,0 days 00:00:02.409960,softplus,256,,4,100,0.00010246623249767822,4,512,False,PRUNED
1134,2.757415771484375,2025-01-27 22:35:55.591126,2025-01-27 22:35:59.447987,0 days 00:00:03.856861,relu,256,,4,90,0.003184291762243405,4,480,False,PRUNED
1135,48.73325729370117,2025-01-27 22:35:59.465335,2025-01-27 22:36:03.223253,0 days 00:00:03.757918,softplus,256,0.2,4,90,0.0001591216815048197,4,48,True,PRUNED
1136,3.050157308578491,2025-01-27 22:36:03.241423,2025-01-27 22:36:05.289008,0 days 00:00:02.047585,gelu,256,,4,80,0.0011117509060010534,1,496,False,PRUNED
1137,2.72426700592041,2025-01-27 22:36:05.307103,2025-01-27 22:36:09.866070,0 days 00:00:04.558967,softplus,256,,4,90,0.0003949914833058484,4,512,False,PRUNED
1138,4.399550914764404,2025-01-27 22:36:09.885127,2025-01-27 22:36:13.086966,0 days 00:00:03.201839,softplus,128,,4,90,0.0001236405422805387,4,208,False,PRUNED
1139,2.538147449493408,2025-01-27 22:36:13.105755,2025-01-27 22:36:16.973425,0 days 00:00:03.867670,softplus,256,,32,90,0.00019053967330293008,4,464,False,PRUNED
1140,2.6374406814575195,2025-01-27 22:36:16.990098,2025-01-27 22:36:20.885297,0 days 00:00:03.895199,softplus,256,,4,80,0.005235261490095281,4,496,False,PRUNED
1141,2.944455862045288,2025-01-27 22:36:20.902242,2025-01-27 22:36:22.803079,0 days 00:00:01.900837,softplus,1024,,4,100,0.00010228101868347774,4,512,False,PRUNED
1142,2.801213026046753,2025-01-27 22:36:22.820070,2025-01-27 22:36:25.095803,0 days 00:00:02.275733,selu,256,,4,90,0.00010264858340273818,4,496,False,PRUNED
1143,2.9189224243164062,2025-01-27 22:36:25.114885,2025-01-27 22:36:27.539510,0 days 00:00:02.424625,softplus,256,,4,90,0.00010256939074451158,4,512,False,PRUNED
1144,2.579101324081421,2025-01-27 22:36:27.556360,2025-01-27 22:36:31.511665,0 days 00:00:03.955305,softplus,256,,4,90,0.0002442370948698616,4,480,False,PRUNED
1145,2.726628303527832,2025-01-27 22:36:31.529323,2025-01-27 22:36:35.140641,0 days 00:00:03.611318,softplus,256,,4,90,0.00011342584449025802,4,512,False,PRUNED
1146,3.34857177734375,2025-01-27 22:36:35.157631,2025-01-27 22:36:37.580092,0 days 00:00:02.422461,softplus,256,,4,80,0.0009039936685822787,4,512,False,PRUNED
1147,3.0458781719207764,2025-01-27 22:36:37.597500,2025-01-27 22:36:40.003740,0 days 00:00:02.406240,softplus,256,,4,90,0.00014008301396949203,4,96,False,PRUNED
1148,3.7434442043304443,2025-01-27 22:36:40.021333,2025-01-27 22:36:44.875535,0 days 00:00:04.854202,relu,128,,2,90,0.00021523400195999612,4,496,False,PRUNED
1149,2.758356809616089,2025-01-27 22:36:44.894264,2025-01-27 22:36:49.903468,0 days 00:00:05.009204,tanh,256,,4,50,0.001867604265656128,4,512,False,PRUNED
1150,2.9896440505981445,2025-01-27 22:36:49.921279,2025-01-27 22:36:52.291002,0 days 00:00:02.369723,softplus,256,,16,80,0.0009649923101160163,4,496,False,PRUNED
1151,2.5609006881713867,2025-01-27 22:36:52.309784,2025-01-27 22:36:55.815009,0 days 00:00:03.505225,softplus,256,,4,100,0.00010241768492877992,4,512,False,PRUNED
1152,3.4405910968780518,2025-01-27 22:36:55.833055,2025-01-27 22:36:58.006788,0 days 00:00:02.173733,selu,256,,4,90,0.0003689712275672646,4,496,False,PRUNED
1153,2.762427806854248,2025-01-27 22:36:58.023450,2025-01-27 22:37:00.069147,0 days 00:00:02.045697,softplus,256,,4,90,0.00012390360901645887,2,512,False,PRUNED
1154,13.034940719604492,2025-01-27 22:37:00.087820,2025-01-27 22:37:04.002572,0 days 00:00:03.914752,softplus,256,0.5,4,90,0.000441762806982526,4,496,True,PRUNED
1155,3.182748794555664,2025-01-27 22:37:04.022543,2025-01-27 22:37:07.370182,0 days 00:00:03.347639,softplus,512,,64,80,0.00010240170734705591,4,512,False,PRUNED
1156,2.980170965194702,2025-01-27 22:37:07.388466,2025-01-27 22:37:09.892568,0 days 00:00:02.504102,softplus,256,,4,90,0.00011433917327438082,4,416,False,PRUNED
1157,2.5263452529907227,2025-01-27 22:37:09.910452,2025-01-27 22:37:15.224565,0 days 00:00:05.314113,softplus,128,,4,90,0.00010248146636596437,4,480,False,PRUNED
1158,2.4685473442077637,2025-01-27 22:37:15.241367,2025-01-27 22:37:20.270661,0 days 00:00:05.029294,softplus,256,,4,100,0.0016602801231806281,4,128,False,PRUNED
1159,2.847867250442505,2025-01-27 22:37:20.290461,2025-01-27 22:37:22.693986,0 days 00:00:02.403525,softplus,256,,4,90,0.0003200474165236626,4,512,False,PRUNED
1160,3.1580679416656494,2025-01-27 22:37:22.710991,2025-01-27 22:37:24.976993,0 days 00:00:02.266002,softplus,256,,4,90,0.0005482696062864191,4,496,False,PRUNED
1161,2.939927816390991,2025-01-27 22:37:24.995724,2025-01-27 22:37:27.390774,0 days 00:00:02.395050,selu,256,,4,80,0.00016480737229459418,4,432,False,PRUNED
1162,2.786142349243164,2025-01-27 22:37:27.410301,2025-01-27 22:37:30.349865,0 days 00:00:02.939564,gelu,256,,32,90,0.0001021945591345692,4,512,False,PRUNED
1163,2.6603569984436035,2025-01-27 22:37:30.368050,2025-01-27 22:37:34.430926,0 days 00:00:04.062876,relu,256,,4,80,0.00011423511727019389,4,480,False,PRUNED
1164,2.606109142303467,2025-01-27 22:37:34.462751,2025-01-27 22:37:38.031158,0 days 00:00:03.568407,softplus,256,,4,100,0.00010225451475105194,4,272,False,PRUNED
1165,3.521512746810913,2025-01-27 22:37:38.050375,2025-01-27 22:37:39.854123,0 days 00:00:01.803748,softplus,1024,,4,90,0.003380379949648937,4,512,False,PRUNED
1166,2.5454561710357666,2025-01-27 22:37:39.875638,2025-01-27 22:37:43.374233,0 days 00:00:03.498595,softplus,256,,4,90,0.00013753018836871247,4,496,False,PRUNED
1167,2.5077362060546875,2025-01-27 22:37:43.392470,2025-01-27 22:37:48.356177,0 days 00:00:04.963707,softplus,128,,4,90,0.0023164192028529923,4,512,False,PRUNED
1168,3.116485595703125,2025-01-27 22:37:48.373888,2025-01-27 22:37:51.115614,0 days 00:00:02.741726,softplus,256,,4,90,0.00010252592022879557,4,496,False,PRUNED
1169,3.7015271186828613,2025-01-27 22:37:51.136158,2025-01-27 22:37:53.521068,0 days 00:00:02.384910,softplus,256,,4,90,0.00011391511331515213,4,512,False,PRUNED
1170,2.9199254512786865,2025-01-27 22:37:53.539499,2025-01-27 22:37:56.060674,0 days 00:00:02.521175,selu,256,,4,80,0.006806657777931589,4,464,False,PRUNED
1171,4.852022647857666,2025-01-27 22:37:56.077618,2025-01-27 22:37:58.330096,0 days 00:00:02.252478,softplus,256,,4,100,0.0001751972104047966,4,496,False,PRUNED
1172,3.5985825061798096,2025-01-27 22:37:58.346756,2025-01-27 22:38:02.387441,0 days 00:00:04.040685,softplus,256,0.1,16,90,0.003768872681464533,4,480,True,PRUNED
1173,2.7636406421661377,2025-01-28 01:14:59.814118,2025-01-28 01:15:03.040843,0 days 00:00:03.226725,softplus,256,,4,80,0.00012520689036622722,4,240,False,PRUNED
1174,3.025662660598755,2025-01-28 01:15:03.059742,2025-01-28 01:15:07.842714,0 days 00:00:04.782972,tanh,256,,2,90,0.0001019065482506444,4,512,False,PRUNED
1175,2.8151931762695312,2025-01-28 01:15:07.858604,2025-01-28 01:15:13.364211,0 days 00:00:05.505607,softplus,128,,4,90,0.0001020762718167774,4,512,False,PRUNED
1176,2.556098699569702,2025-01-28 01:15:13.383638,2025-01-28 01:15:16.969052,0 days 00:00:03.585414,softplus,256,,4,90,0.00010230377073819886,4,496,False,PRUNED
1177,2.733576536178589,2025-01-28 01:15:16.986023,2025-01-28 01:15:22.836296,0 days 00:00:05.850273,relu,256,,4,90,0.003186524614181528,4,512,False,PRUNED
1178,2.710921049118042,2025-01-28 01:15:22.854220,2025-01-28 01:15:26.383061,0 days 00:00:03.528841,softplus,256,,4,80,0.0008234356616450644,4,496,False,PRUNED
1179,3.865216016769409,2025-01-28 01:15:26.399849,2025-01-28 01:15:28.767092,0 days 00:00:02.367243,softplus,512,,4,90,0.00014878695398414746,4,512,False,PRUNED
1180,2.5161683559417725,2025-01-28 01:15:28.784141,2025-01-28 01:15:32.713488,0 days 00:00:03.929347,softplus,256,,4,100,0.002556333566388998,4,480,False,PRUNED
1181,2.9689371585845947,2025-01-28 01:15:32.732015,2025-01-28 01:15:37.029933,0 days 00:00:04.297918,selu,256,,64,90,0.0002034815139437744,5,496,False,PRUNED
1182,2.8302178382873535,2025-01-28 01:15:37.046866,2025-01-28 01:15:39.301722,0 days 00:00:02.254856,softplus,256,,4,80,0.000114241154177094,3,512,False,PRUNED
1183,2.9153289794921875,2025-01-28 01:15:39.320208,2025-01-28 01:15:41.749018,0 days 00:00:02.428810,softplus,256,,4,90,0.00047053955615728783,4,512,False,PRUNED
1184,2.734499454498291,2025-01-28 01:15:41.766170,2025-01-28 01:15:45.359282,0 days 00:00:03.593112,softplus,256,,4,90,0.00010254609548434122,4,496,False,PRUNED
1185,3.094358444213867,2025-01-28 01:15:45.377687,2025-01-28 01:15:48.986467,0 days 00:00:03.608780,softplus,128,,4,90,0.00010247471713749237,4,496,False,PRUNED
1186,2.606031656265259,2025-01-28 01:15:49.005647,2025-01-28 01:15:52.634504,0 days 00:00:03.628857,softplus,256,,4,90,0.00012442062658413482,4,512,False,PRUNED
1187,2.6894447803497314,2025-01-28 01:15:52.651978,2025-01-28 01:15:56.670523,0 days 00:00:04.018545,softplus,256,,4,100,0.0003037662623506958,3,512,False,PRUNED
1188,2.65290904045105,2025-01-28 01:15:56.686430,2025-01-28 01:16:00.153481,0 days 00:00:03.467051,softplus,256,,4,90,0.00010227497225411481,4,496,False,PRUNED
1189,2.9172699451446533,2025-01-28 01:16:00.171337,2025-01-28 01:16:02.731885,0 days 00:00:02.560548,gelu,1024,,4,80,0.00010238556899835949,4,496,False,PRUNED
1190,2.7873294353485107,2025-01-28 01:16:02.750464,2025-01-28 01:16:05.470416,0 days 00:00:02.719952,selu,256,,32,90,0.002843902212235616,4,512,False,PRUNED
1191,37.17203140258789,2025-01-28 01:16:05.487523,2025-01-28 01:16:10.461372,0 days 00:00:04.973849,relu,256,0.2,4,90,0.00011476674029061542,4,480,True,PRUNED
1192,4.2084245681762695,2025-01-28 01:16:10.478800,2025-01-28 01:16:12.804620,0 days 00:00:02.325820,softplus,256,,4,80,0.00013062107622680382,4,512,False,PRUNED
1193,3.5251588821411133,2025-01-28 01:16:12.822325,2025-01-28 01:16:16.086242,0 days 00:00:03.263917,softplus,256,,4,90,0.0005346830292787072,3,496,False,PRUNED
1194,2.8841805458068848,2025-01-28 01:16:16.104679,2025-01-28 01:16:19.689258,0 days 00:00:03.584579,softplus,128,,4,90,0.00010201728793095937,4,512,False,PRUNED
1195,2.584749460220337,2025-01-28 01:16:19.705608,2025-01-28 01:16:23.335133,0 days 00:00:03.629525,softplus,256,,4,90,0.0005025419523081113,4,464,False,PRUNED
1196,2.950092077255249,2025-01-28 01:16:23.351854,2025-01-28 01:16:25.887935,0 days 00:00:02.536081,softplus,256,,16,100,0.00011317812837362073,4,144,False,PRUNED
1197,2.849429130554199,2025-01-28 01:16:25.904004,2025-01-28 01:16:28.479371,0 days 00:00:02.575367,softplus,256,,2,80,0.00010237920720297422,4,480,False,PRUNED
1198,2.9294350147247314,2025-01-28 01:16:28.497116,2025-01-28 01:16:30.715957,0 days 00:00:02.218841,softplus,256,,4,90,0.0002399057592779809,3,512,False,PRUNED
1199,3.129286050796509,2025-01-28 01:16:30.733688,2025-01-28 01:16:33.502126,0 days 00:00:02.768438,selu,256,,4,90,0.00010204421529360369,4,480,False,PRUNED
1200,2.7653470039367676,2025-01-28 01:16:33.521176,2025-01-28 01:16:36.130444,0 days 00:00:02.609268,softplus,256,,4,90,0.00015055883306071974,4,368,False,PRUNED
1201,3.032616376876831,2025-01-28 01:16:36.148261,2025-01-28 01:16:38.812210,0 days 00:00:02.663949,tanh,256,,4,80,0.00011394363255677701,4,512,False,PRUNED
1202,2.8868045806884766,2025-01-28 01:16:38.829947,2025-01-28 01:16:40.884271,0 days 00:00:02.054324,softplus,512,,4,100,0.0015223836716422956,4,496,False,PRUNED
1203,2.5610437393188477,2025-01-28 01:16:40.902545,2025-01-28 01:16:44.072334,0 days 00:00:03.169789,softplus,256,,4,90,0.0012711910461918234,3,512,False,PRUNED
1204,2.8374602794647217,2025-01-28 01:16:44.090963,2025-01-28 01:16:47.885256,0 days 00:00:03.794293,softplus,128,,8,90,0.0003644960166240582,4,496,False,PRUNED
1205,2.6032872200012207,2025-01-28 01:16:47.902899,2025-01-28 01:16:52.839750,0 days 00:00:04.936851,relu,256,,64,80,0.00010243139670212943,4,512,False,PRUNED
1206,2.926386594772339,2025-01-28 01:16:52.858156,2025-01-28 01:16:55.201484,0 days 00:00:02.343328,softplus,256,,4,50,0.0007758741758255233,4,496,False,PRUNED
1207,2.5208816528320312,2025-01-28 01:16:55.219596,2025-01-28 01:16:58.741029,0 days 00:00:03.521433,softplus,256,,4,90,0.000719590932002087,4,512,False,PRUNED
1208,2.759718894958496,2025-01-28 01:16:58.760083,2025-01-28 01:17:02.513264,0 days 00:00:03.753181,softplus,256,,4,90,0.00012434199323147768,4,512,False,PRUNED
1209,2.6975276470184326,2025-01-28 01:17:02.530247,2025-01-28 01:17:05.892063,0 days 00:00:03.361816,selu,256,,4,90,0.00010200593777778418,3,496,False,PRUNED
1210,15.385090827941895,2025-01-28 01:17:05.909190,2025-01-28 01:17:09.752268,0 days 00:00:03.843078,softplus,256,0.30000000000000004,4,80,0.0017563489543600038,4,448,True,PRUNED
1211,2.471975326538086,2025-01-28 01:17:09.770505,2025-01-28 01:17:15.189251,0 days 00:00:05.418746,softplus,256,,32,90,0.00010220575904974804,4,496,False,PRUNED
1212,2.892435312271118,2025-01-28 01:17:15.205055,2025-01-28 01:17:18.277198,0 days 00:00:03.072143,softplus,128,,4,90,0.0001342700101927632,4,512,False,PRUNED
1213,2.7547245025634766,2025-01-28 01:17:18.614827,2025-01-28 01:17:22.492071,0 days 00:00:03.877244,softplus,256,,8,100,0.00021760475596904795,4,496,False,PRUNED
1214,2.983590602874756,2025-01-28 01:17:22.510623,2025-01-28 01:17:24.554259,0 days 00:00:02.043636,gelu,1024,,4,90,0.00010219768963363406,4,512,False,PRUNED
1215,2.8549773693084717,2025-01-28 01:17:24.573084,2025-01-28 01:17:27.923798,0 days 00:00:03.350714,softplus,256,,4,90,0.00016969781515296096,3,336,False,PRUNED
1216,2.91265869140625,2025-01-28 01:17:27.941948,2025-01-28 01:17:30.394262,0 days 00:00:02.452314,softplus,256,,4,80,0.00011541659635842051,4,512,False,PRUNED
1217,2.543447256088257,2025-01-28 01:17:30.412401,2025-01-28 01:17:34.046740,0 days 00:00:03.634339,softplus,256,,4,90,0.00010235078183297515,4,480,False,PRUNED
1218,2.7627036571502686,2025-01-28 01:17:34.065795,2025-01-28 01:17:36.469592,0 days 00:00:02.403797,softplus,256,,4,90,0.00027376661385939744,4,512,False,PRUNED
1219,2.5726044178009033,2025-01-28 01:17:36.486797,2025-01-28 01:17:42.057279,0 days 00:00:05.570482,relu,256,,8,80,0.0010254765320690611,4,496,False,PRUNED
